Project Name,Ticker,Security Score,Market Cap,Onboard Date,Type,Language,Request Date,Revision Date,Total Findings,Critical,Major,Minor,Medium,Informational
PancakeSwap,CAKE,94,"4,394,878,854",10/13/2020,Security Assessment,Solidity,2020-10-04T19:46:27-07:00,2020-10-13T14:46:11-07:00,9,,Logical Issue,Logical Issue,Logical Issue,"Coding Style ,Logical Issue,Gas Optimization"
Celer.Network,CELR,93,"669,178,208",10/24/2020,Security Assessment,Solidity,2021-06-01T19:32:23-04:00,2021-06-25T11:49:55-04:00,44,,,"Language Specific,Logical Issue,Volatile Code",,"Language Specific,Control Flow,Centralization / Privilege,Gas Optimization,Data Flow,Coding Style,Logical Issue"
DODO,,95,"418,669,154",2/18/2020,Security Assessment,Solidity,2021-02-14T20:00:00,2021-02-18T20:00:00,,,,,,
1inch,,93,"761,309,893",2/10/2021,Security Assessment,Solidity,2020-12-02T19:29:57-08:00,2020-12-15T22:00:00-08:00,36,,,"Control Flow,Logical Issue",Logical Issue,"Gas Optimization,Inconsistency,Coding Style,Mathematical Operations,Logical Issue,Language Specific"
Aave,AAVE,91,"4,161,069,633",7/22/2020,Security Assessment,Solidity,2020-07-09T22:00:00-07:00,2020-07-21T22:00:00-07:00,18,,,Mathematical Operations,Logical Issue,"Language Specific,Coding Style,Gas Optimization,Logical Issue"
ShibaSwap,SHIB,92,"28,852,372,148",5/12/2021,Security Assessment,Solidity,2021-05-27T07:58:59-07:00,2021-08-02T12:27:37-07:00,34,,"Centralization / Privilege,Logical Issue,Volatile Code","Centralization / Privilege,Logical Issue,Mathematical Operations",Logical Issue,"Volatile Code,Gas Optimization,Mathematical Operations,Coding Style"
Polygon,MATIC,92,"11,871,943,080",10/24/2020,Security Assessment,Solidity,2020-07-24T00:57:13-07:00,2021-04-19T01:19:53-07:00,15,Security,Implementation,Implementation,,"Compiler version,Function logics,Coding Style,Code optimization,Mathematical Operations,Gas Optimization,Logics,Implementation"
WazirX,WRX,89,"689,517,047",5/21/2021,Security Assessment,Solidity,2021-05-10T18:10:54-04:00,2021-05-21T18:23:32-04:00,9,,,"Centralization / Privilege,Volatile Code",,"Gas Optimization,Compiler Error,Volatile Code"
CertiK,CTK,95,"111,058,378",10/24/2020,Security Assessment,Solidity,2020-09-20T23:00:52-07:00,2020-10-11T22:00:00-07:00,14,,,,,"Language Specific,Coding Style,Optimization,Volatile Code"
Bancor,BNT,91,"1,071,048,505",7/15/2020,Security Audit,Solidity,"October 7, 2020","October 9, 2020",,,,,,
Oceanprotocol,OCEAN,91,"413,620,264",4/8/2020,Security Audit,Solidity,"Aug 11, 2020","Oct 8, 2020",,,,,,
Binance,"BNB,BUSD,BIDR,BGBP",89,"106,315,446,570",11/11/2018,Smart Contract,Solidity,"July 9, 2019","July 31, 2019",,,,,,
ZKSwap,ZKS,95,"175,809,797",4/12/2021,Security Assessment,Solidity,2021-06-15T07:47:15-07:00,2021-06-21T08:03:44-07:00,3,,,,,Coding Style
Swipe,"SXP ,SXPHEDGE ,SXPBULL ,SXPBEAR",91,"488,753,646",8/25/2019,Security Audit,"Solidity, Yul","November 23, 2020","December 16, 2020",,,,,,
Fetch.ai,FET,93,"589,634,238",9/13/2019,Security Audit,"Solidity, Yul","February 1, 2021","February 12, 2021",,,,,,
SafeMoon,SAFEMOON,90,"2,083,897,307",5/3/2021,Security Assessment,Solidity,2021-04-21T12:47:22-07:00,2021-05-03T07:29:55-07:00,12,,Centralization / Privilege,"Logical Issue,Control Flow,Centralization / Privilege",Logical Issue,"Logical Issue,Gas Optimization,Volatile Code,Coding Style,Control Flow"
Chiliz,,89,"2,861,743,278",2/22/2021,Security Audit,"Solidity, Yul","February 06, 2021","February 10, 2021",,,,,,
Telcoin,TEL,93,"1,132,908,118",12/1/2018,Security Assessment,Solidity,2018-11-19T09:08:28-04:00,2018-11-24T13:03:41-04:00,,,,,,
Sandbox.game,SAND,92,"2,559,842,597",12/10/2019,Smart Contracts & Token Wrappers,Solidity,"June 25, 2020","August 19, 2020",,,,,,
Kava,KAVA,89,"574,418,680",3/10/2020,Security Audit,Golang,"December 14, 2020","February 9, 2021",,,,,,
Ampleforth,AMPL,89,"315,498,893",5/6/2020,Security Audit,"Solidity, Yul","February 3, 2021","February 12, 2021",,,,,,
Tellor,TRB,92,"149,045,516",8/6/2019,Smart Contract,Solidity,"June 8, 2020","July 16, 2020",,,,,,
BakerySwap,BAKE,90,"419,847,102",10/24/2020,Smart Contract,Solidity,"September 11, 2020","September 17, 2020",,,,,,
Nervos Network,CKB,,"865,113,445",4/8/2020,Security Audit,Rust,2020-03-12,2020-04-07,,,,,,
Crypto.com,CRO,92,"10,097,875,520",11/30/2018,Security Assessment,Solidity,2018-11-09T09:08:28-04:00,2018-11-20T13:03:41-04:00,,,,,,
Unus Sed Leo,,,"2,583,323,735",5/21/2019,Security Audit,"Solidity, Yul",2019-05-16,2019-05-21,,,,,,
OMG Network,OMG,,"1,671,251,875",6/8/2021,Security Assessment,Solidity,2021-05-13T18:01:44-04:00,2021-06-08T01:19:36-04:00,7,,,"Centralization / Privilege,Logical Issue",,"Gas Optimization,Centralization / Privilege"
SafePal,,,"171,844,603",8/16/2021,Security Assessment,Solidity,2021-08-03T13:09:28+08:00,2021-08-16T12:47:36+08:00,11,,Centralization / Privilege,Logical Issue,Logical Issue,"Logical Issue,Coding Style"
NuCypher,NU,93,"677,636,992",5/25/2021,,,,,,,,,,
Thorchain,RUNE,,"3,839,901,005",4/6/2019,Automated Market Maker Liquidty Network,Golang,"January 21, 2019","April 06, 2019",,,,,,
Terra,LUNA,,"23,163,033,280",9/1/2020,Security Assessment,Golang,2020-08-09T22:24:55-07:00,2020-09-03T22:59:44-07:00,9,,,"Mathematical Operations,Volatile Code",,"Language Specific,Volatile Code,Coding Style"
Akropolis,AKRO,89,"101,762,290",10/24/2020,Smart Contract,Solidity,"August 12, 2020","September 7, 2020",,,,,,
Ontology,"ONT ,ONG",,"963,609,218",5/14/2019,Smart Contract,Solidity,"May 9, 2019","May 14, 2019",,,,,,
Definix,FINIX,95,"19,523,524",4/26/2020,Security Assessment,"Solidity, Yul","March 26, 2021","March 29, 2020",,,,,,
TrueUSD,TUSD,,"1,223,197,649",7/10/2018,Security Assessment,Solidity,2018-06-08T09:08:28-04:00,2018-06-29T13:03:41-04:00,,,,,,
Gains Network,GFARM,93,"31,519,383",1/21/2021,Security Audit,Solidity,"February 10, 2021","February 19, 2021",,,,,,
AllianceBlock,ALBT,92,"352,961,773",10/24/2020,Smart Contract,Solidity,"September 1, 2020","September 9, 2020",10,,,V,,"L,O"
Ceek,CEEK,86,unavailable,5/6/2021,Security Assessment,Solidity,2021-05-16T21:00:37-04:00,2021-05-22T13:24:02-04:00,3,,,C,,G
Hot Cross,HOTCROSS,92,"58,827,153",5/6/2021,Security Assessment,Solidity,2021-05-05T00:42:20-04:00,2021-05-18T18:21:41-04:00,7,,,L,L,"V,C,L"
Relite Finance,RELI,96,"2,025,636",4/28/2021,Security Assessment,Solidity,2021-04-24T23:34:24-04:00,2021-04-24T23:34:24-04:00,1,,,,,G
DinoSwap,DINO,94,"12,270,918",6/18/2021,Security Assessment,Solidity,2021-07-02T10:12:29-04:00,2021-07-06T23:33:28-04:00,6,,,Volatile Code,,"Coding Style,Gas Optimization"
Icon.Foundation,ICX,92,"1,637,123,255",6/16/2020,Service Engine,Python,"March 18, 2020","June 16, 2020",,,,,,
Hoge Finance,HOGE,88,"163,897,979",3/16/2021,Security Assessment,Solidity,2021-04-24T10:22:29-04:00,2021-04-24T10:22:29-04:00,5,,,"L,C",,"L,G"
Kylin Network,KYL,93,"87,161,816",2/22/2021,Security Audit,Solidity,"February 17, 2021","February 28, 2021",,,,,,
TEN,TENFI,92,"760,953",3/12/2021,Security Audit,Solidity,"March 6, 2021","March 18, 2021",5,,,"L,V",,O
Orionprotocol,ORN,96,"260,262,064",10/24/2020,Smart Contract & Crowdsale Mechanism,Solidity,"July 10, 2020","July 11, 2020",,,,,,
Faraland,FARA,94,"60,024,668",5/16/2021,Security Assessment,Solidity,2021-05-10T23:18:40-04:00,2021-05-18T23:05:06-04:00,8,,L,L,"L,C","V,C"
IoTeX,IOTX,94,"2,289,990,070",3/4/2019,,,,,,,,,,
Paxos,PAX,94,"1,023,312,266",7/14/2019,Smart Contract,Solidity,"May 29, 2019","June 14, 2019",,,,,,
BEPRO,BEPRO,90,"75,536,738",10/24/2020,Security Assessment,Solidity,2021-09-30T11:26:02-07:00,2021-10-20T08:59:26-07:00,12,,"Logical Issue,Centralization / Privilege","Logical Issue,Volatile Code",Logical Issue,"Coding Style,Gas Optimization,Inconsistency,Logical Issue"
Kardiachain,,94,"337,522,777",10/24/2020,Security Audit,Golang,"October 5, 2020","December 4, 2020",,,,,,
DYP.Finance,DYP,90,"16,070,980",1/20/2021,Security Assessment,Solidity,2021-04-13T21:21:01-04:00,2021-04-23T21:32:15-04:00,12,,,"Inconsistency,Control Flow,Logical Issue",,"Gas Optimization,Volatile Code"
OBORTECH,,92,"7,646,375",4/3/2021,Security Assessment,Solidity,2021-04-18T23:21:21-04:00,2021-04-18T23:21:21-04:00,4,,,C,,"G,C"
MDEX,MDX,93,"680,685,013",3/24/2021,Security Assessment,Solidity,2021-03-17T20:00:00,2021-03-24T20:00:00,,,,,,
Dogs Of Elon,DOE,86,"71,688,589",10/25/2021,Security Assessment,Solidity,2021-10-20T20:10:50-07:00,2021-10-26T19:16:07-07:00,5,,,Volatile Code,"Centralization / Privilege,Volatile Code","Coding Style,Language Specific"
Band Protocol,BAND,95,"367,020,092",8/7/2019,Smart Contract,Solidity,"June 18, 2019","August 7, 2019",,,,,,
Smaugs,SMG,94,"3,813,228",6/17/2021,Security Assessment,Solidity,2021-05-28T15:10:32-04:00,2021-06-09T02:30:22-04:00,7,,,Language Specific,,"Coding Style,Gas Optimization,Logical Issue,Language Specific"
Mars Ecosystem,XMS,96,"92,569,929",8/21/2021,Security Assessment,Solidity,2021-05-05T08:18:56-07:00,2021-08-20T17:31:53-07:00,36,,Centralization / Privilege,"Control Flow,Volatile Code,Logical Issue",Centralization / Privilege,"Volatile Code,Coding Style,Gas Optimization,Logical Issue,Language Specific"
MultiVac,MTV,90,"79,086,682",10/24/2020,Security Assessment,Solidity,2021-08-11T22:07:01-07:00,2021-08-13T23:17:02-07:00,9,,Centralization / Privilege,Logical Issue,,"Gas Optimization,Language Specific,Coding Style,Logical Issue"
BabySwap,BABY,94,"251,776",6/1/2021,Security Assessment,Solidity,2021-11-08T09:10:56+08:00,2021-11-11T13:25:37+08:00,6,,Centralization / Privilege,Logical Issue,,"Language Specific,Logical Issue"
dForce,DF,88,"56,954,868",2/16/2021,Security Assessment,Solidity,2021-10-18T15:13:00+08:00,2021-10-22T16:13:03+08:00,12,,Centralization / Privilege,Volatile Code,Logical Issue,"Language Specific,Volatile Code,Logical Issue,Coding Style,Gas Optimization"
Metadium,META,93,"190,120,316",10/24/2020,Smart Contract,Solidity,"October 27, 2019","November 27, 2019",,,,,,
Bcpay Fintech,BCP,92,"2,696,535",9/26/2021,Security Assessment,Solidity,2021-09-17T14:11:42-04:00,2021-09-26T13:34:32-04:00,5,,,Mathematical Operations,,"Language Specific,Coding Style,Gas Optimization"
Tether,USDT,92,"74,894,636,483",4/11/2019,Smart Contract,Solidity,"March 27, 2019","April 11, 2019",,,,,,
Bzx.Network,"BZRX ,VBZRX",92,"125,514,006",3/15/2020,Smart Contract,Solidity,"June 07, 2020","September 04, 2020",,,,,,
Beyond Protocol,BP,94,"84,519,174",10/13/2021,Security Assessment,Solidity,2021-10-04T18:33:40-04:00,2021-10-13T22:55:07-04:00,4,,Centralization / Privilege,Volatile Code,,"Coding Style,Gas Optimization"
PancakeHunny,HUNNY,83,"3,020,248",6/23/2021,Security Assessment,Solidity,2021-08-29T23:23:50-04:00,2021-10-06T04:53:36-04:00,10,,Centralization / Privilege,Logical Issue,Logical Issue,"Language Specific,Coding Style"
Firmachain,FCT,89,"58,989,918",10/24/2020,Chain Audit,Golang,"June 15, 2020","July 6, 2020",,,,,,
Tokenplace,TOK,84,unavailable,8/10/2021,Security Assessment,Solidity,2021-07-26T17:43:47-07:00,2021-08-10T11:24:51-07:00,3,,Centralization / Privilege,Mathematical Operations,,Gas Optimization
Stasis,EURS,86,"101,884,282",10/24/2020,Security Audit,"Solidity, Yul","March 24, 2021","April 2, 2021",,,,,,
Alpaca Finance,ALPACA,92,"140,301,364",3/7/2021,Security Assessment,Solidity,2021-05-07T00:33:14-04:00,2021-05-13T20:33:14-04:00,,,,,,
Trias.one,TRY,87,"11,205,077",11/9/2020,Security Assessment,Solidity,2021-11-12T16:25:04+08:00,2021-11-09T14:06:58+08:00,2,,Centralization / Privilege,,,Language Specific
Contentos,COS,90,"84,899,032",4/28/2019,Smart Contract,Solidity,"April 15, 2019","April 28, 2019",,,,,,
USDK,USDK,87,"42,612,760",10/24/2020,Smart Contract,Solidity,"April 3, 2018","June 9, 2019",,,,,,
DeFi For You,DFY,95,"29,344,382",4/13/2021,Security Audit,"Solidity, Yul","February 22, 2021","March 7, 2021",,,,,,
Lightning,LIGHT,94,"41,006,231",6/26/2021,,,,,,,,,,
SafeMartians,SAFEMARS,87,"44,445,144",4/1/2021,Security Assessment,Solidity,2021-07-26T15:18:56-04:00,2021-08-04T21:10:12-04:00,14,,Centralization / Privilege,"Logical Issue,Control Flow,Volatile Code","Logical Issue,Centralization / Privilege","Coding Style,Volatile Code,Logical Issue,Gas Optimization"
ForTube,,92,"48,723,938",8/1/2020,Smart Contract,Solidity,"July 8, 2020","August 1, 2020",,,,,,
Base Protocol,BASE,93,"958,242",1/20/2021,Security Audit,Solidity,"January 08, 2021","January 20, 2021",9,,"O,V","O,L",,"C,G,D"
Goose Finance,EGG,91,"2,547,146",2/24/2021,Security Audit,Solidity,"February 17, 2021","February 23, 2021",14,,"V,L","V,L",,"V,O,L"
ACryptoS,ACS,95,"17,402,667",3/19/2021,Security Audit,Solidity,"March 6, 2021",March 23 2021,,,,,,
Unit Protocol,COL,89,"23,762,600",9/18/2020,Security Audit,"Solidity, Yul","September 3, 2020","September 18, 2020",,,,,,
GMR Finance,GMR,94,"68,753,061",7/9/2021,Security Assessment,Solidity,2021-06-21T20:01:40-07:00,2021-07-08T11:46:04-07:00,13,,Centralization / Privilege,"Control Flow,Logical Issue,Mathematical Operations",Logical Issue,"Logical Issue,Coding Style"
Reserve,"RSV,RSD ,RSR",92,"17,097,503",5/21/2019,Smart Contract,Solidity,"September 27, 2019","October 9, 2019",,,,,,
Mysterium,MYST,92,"44,595,062",10/24/2020,Smart Contract,Solidity,"July 18, 2020","August 13, 2020",,,,,,
TIKI Finance,TIKI,90,"3,103,850",8/5/2021,Security Assessment,Solidity,2021-06-30T12:36:06-07:00,2021-08-05T12:28:45-07:00,11,,Centralization / Privilege,"Control Flow,Inconsistency",,"Volatile Code,Coding Style,Inconsistency,Language Specific"
Frontier,FRONT,86,"65,236,359",10/24/2020,Smart Contract,Solidity,"August 28, 2020","September 11, 2020",,,,,,
Oxbull.Tech,OXB,90,"40,765,867",4/13/2021,,,,,,,,,,
Coinswap_Space,COINS,83,unavailable,4/28/2021,Security Assessment,Solidity,2021-04-19T01:02:59-04:00,2021-04-19T01:02:59-04:00,17,"C,L",M,"V,L,C",,"V,C,L,G"
Golff Finance,,90,"5,285,420",4/27/2021,Security Assessment,Solidity,2021-09-19T01:50:23-04:00,2021-09-21T07:56:05-04:00,6,,Centralization / Privilege,"Compiler Error,Logical Issue,Volatile Code",,Gas Optimization
Moss,MOC,92,"52,285,426",10/24/2020,Smart Contract,Solidity,"August 10, 2020","September 1, 2020",,,,,,
Xion Finance,XION,81,"349,748",3/26/2021,Security Assessment,Solidity,2021-03-29T01:39:06-04:00,2021-03-29T01:39:06-04:00,25,,,L,,"G,L,C,M"
Zelaa Pay,ZPAE,89,"2,764,347",11/22/2020,Security Assessment,Solidity,2020-08-21T21:49:54-04:00,2020-08-26T21:51:48-04:00,2,,Centralization / Privilege,Language Specific Issue,,
BHOLDUS,BHO,93,"13,944,549",10/16/2021,Security Assessment,Solidity,2021-09-17T07:55:25-07:00,2021-10-16T05:56:09-07:00,39,"Logical Issue,Centralization / Privilege","Centralization / Privilege,Logical Issue",Volatile Code,,"Coding Style,Language Specific,Volatile Code,Mathematical Operations,Control Flow,Logical Issue"
Waltonchain,WTC,88,"28,754,908",9/11/2019,Smart Contract,Solidity,"August 21, 2019","September 11, 2019",,,,,,
Rupiahtoken,IDRT,95,"7,305,536",10/24/2020,Smart Contract,Solidity,"March 27, 2019","July 3, 2019",,,,,,
Lien,LIEN,92,"1,329,421",10/24/2020,Smart Contracts,Solidity,"June 25, 2020","September 04, 2020",,,,,,
TenseT,10SET,94,"105,500,108",5/19/2021,Security Assessment,Solidity,2021-05-05T16:35:31-04:00,2021-05-19T16:14:27-04:00,21,,C,"G,M,L",,"C,L,G"
MocktailSwap,MOK,87,"13,475",4/8/2021,Security Audit,Rust,"March 30, 2021","April 6, 2020",,,,,,
LessToken,LESS,91,"2,607,791",6/5/2021,Security Assessment,Solidity,2021-06-03T15:28:57-04:00,2021-06-10T00:11:06-04:00,3,,C,,,G
Dapp.com,DAPPT,91,"8,928,283",10/24/2020,Smart Contract,Solidity,"June 7, 2019","August 6, 2019",,,,,,
Impermax Finance,IMX,86,"7,489,767",4/27/2021,Security Assessment,Solidity,2021-04-19T09:40:09-04:00,2021-04-19T09:40:09-04:00,13,,C,C,,"V,L,M"
Decentr,DEC,90,"13,925,715",8/18/2020,Smart Contract,Solidity,"July 2, 2020","August 18, 2020",,,,,,
Berry Data,BRY,92,"5,580,424",3/4/2021,Security Audit,Solidity,"March 1, 2021",March 23 2021,,,,,,
Papel Token,PAPEL,89,"1,890,650",6/4/2021,Security Assessment,Solidity,2021-06-04T04:43:37+02:00,2021-06-21T18:47:24+02:00,14,,Centralization / Privilege,"Logical Issue,Control Flow,Centralization / Privilege",Logical Issue,"Coding Style,Volatile Code,Logical Issue,Gas Optimization"
EverRise,RISE,94,"74,570,297",7/2/2021,Security Assessment,Solidity,2021-06-23T23:00:32-04:00,2021-06-27T23:38:51-04:00,12,Centralization / Privilege,"Centralization / Privilege,Logical Issue,Coding Style","Logical Issue,Control Flow",,"Control Flow,Gas Optimization"
DollarProtocol,USDX,91,"4,990,800",10/24/2020,Security Audit,"Solidity, Yul","January 5, 2021","January 22, 2021",35,,D,"L,I",,"I,N"
Amasa,AMAS,86,unavailable,8/23/2021,Security Assessment,Solidity,2021-07-12T12:38:56-04:00,2021-08-24T22:40:11-04:00,16,,,"Gas Optimization,Centralization / Privilege,Logical Issue",,"Coding Style,Gas Optimization,Mathematical Operations,Logical Issue"
Spend,SPND,89,"11,108,306",10/24/2020,Smart Contract,Solidity,"March 29, 2019","March 31, 2019",,,,,,
Ducato,DUCATO,91,"2,419,096",8/3/2020,Smart Contract,Solidity,"July 31, 2020","August 3, 2020",,,,,,
Rigel Protocol,RGP,87,"215,635",2/22/2021,Security Audit,Solidity,"February 16, 2021","February 19, 2021",,,,,,
2local,2LC,87,"761,995",3/12/2021,Security Audit,Solidity,"March 8, 2021","March 11, 2021",,,,,,
CafeSwap Finance,BREW,88,"2,213,803",2/23/2021,Security Assessment,Solidity,2021-03-29T20:13:00,2021-04-28T20:13:00,,,,,,
Dehub,DEHUB,94,"74,669,898",10/24/2021,Security Assessment,Solidity,2021-10-12T19:13:52-07:00,2021-10-24T19:27:33-07:00,16,,"Centralization / Privilege,Logical Issue,Mathematical Operations","Logical Issue,Control Flow",Logical Issue,"Coding Style,Logical Issue"
Autofarm,AUTO,89,"41,869,874",3/3/2021,Security Audit,Solidity,"March 3, 2021","March 26, 2021",44,L,L,L,,"O,C,L,M,V"
BitBlocksFinance,BBKFI,88,unavailable,5/11/2021,Security Assessment,Solidity,2021-07-01T02:15:56-04:00,2021-09-25T20:11:44-04:00,12,,Centralization / Privilege,"Logical Issue,Volatile Code",,"Coding Style,Logical Issue,Gas Optimization,Volatile Code"
Paçoca,PACOCA,92,"13,566,798",9/4/2021,Security Assessment,Solidity,2021-06-22T00:22:19-04:00,2021-09-04T00:11:39-04:00,15,,"Centralization / Privilege,Volatile Code,Control Flow",Logical Issue,,"Data Flow,Control Flow,Gas Optimization,Volatile Code,Coding Style"
Quoxent,QUO,83,"93,108",10/24/2020,Smart Contract,Solidity,"July 24, 2020","August 20, 2020",,,,,,
BFK Warzone,BFK,83,unavailable,11/7/2021,,,,,,,,,,
IRON Finance,IRON,87,unavailable,9/10/2021,Security Assessment,Solidity,2021-08-10T11:47:59-04:00,2021-09-14T01:22:00-04:00,13,,"Centralization / Privilege,Logical Issue","Centralization / Privilege,Logical Issue,Volatile Code","Logical Issue,Mathematical Operations,Volatile Code","Gas Optimization,Volatile Code,Logical Issue"
Secured MoonRat Token (SMRAT),MRAT,87,unavailable,5/7/2021,Security Assessment,Solidity,2021-05-01T11:17:24-04:00,2021-05-07T00:39:40-04:00,11,,C,"L,C,G",L,"L,C,O"
AutoShark,FINS,73,unavailable,9/27/2021,Security Assessment,Solidity,2021-09-17T13:45:11-04:00,2021-09-25T16:02:30-04:00,8,,Centralization / Privilege,,,"Gas Optimization,Coding Style,Logical Issue"
MOBOX,MOBOX,93,"413,384,672",5/7/2021,Security Assessment,Solidity,2021-04-02T19:43:27-07:00,2021-05-07T19:47:55-07:00,36,"Centralization / Privilege,Compiler Error","Centralization / Privilege,Logical Issue","Volatile Code,Logical Issue,Control Flow,Mathematical Operations",,"Coding Style,Gas Optimization,Volatile Code,Logical Issue"
Kebab,KEBAB,93,"32,392",2/8/2021,Security Audit,Solidity,"March 4, 2021","March 31, 2021",20,,L,L,,"O,L,C"
KoalaDeFi,,89,unavailable,4/2/2021,Security Assessment,Solidity,2021-03-14T20:30:00Z,2021-04-02T20:30:00Z,,,,,,
Leonicorn Swap,LEOS,94,"8,199,646",6/24/2021,Security Assessment,Solidity,2021-07-12T19:31:35-04:00,2021-07-14T15:08:45-04:00,6,,Centralization / Privilege,,,"Logical Issue,Control Flow,Gas Optimization"
CEEZEE,SAFU,85,unavailable,5/21/2021,Security Assessment,Solidity,2021-05-09T09:49:29-04:00,2021-05-17T11:37:33-04:00,3,,,L,,G
InjectiveProtocol,INJ,,"520,383,287",10/24/2020,Security Audit,Solidity,"September 20, 2020","September 20, 2020",1,,,,,V
Dvision Network,DVI,,"460,255,302",8/19/2021,Security Assessment,Solidity,2021-07-14T01:04:20-04:00,2021-07-15T02:33:33-04:00,2,,,,,"Coding Style,Gas Optimization"
Alchemix,ALCX,91,"352,550,611",5/21/2021,Security Assessment,Solidity,2021-05-13T10:28:55-04:00,2021-05-18T22:17:48-04:00,20,,Centralization / Privilege,"Inconsistency,Logical Issue",,"Centralization / Privilege,Coding Style,Logical Issue,Control Flow,Volatile Code"
MyMasterWar,MAT,93,"16,347,339",10/4/2021,Security Assessment,Solidity,2021-10-07T20:53:32-07:00,2021-10-19T05:17:04-07:00,17,,"Centralization / Privilege,Logical Issue",Volatile Code,Logical Issue,Gas Optimization
StandardHashrate,,,"272,759,136",1/15/2021,Security Audit,Solidity,"December 14, 2020","January 6, 2021",11,,,O,,"L,C,D,M,O,G"
DOXXED,,84,unavailable,11/4/2021,Security Assessment,Solidity,2021-10-14T07:46:19-07:00,2021-11-04T08:30:33-07:00,15,,Centralization / Privilege,"Logical Issue,Volatile Code",Logical Issue,"Coding Style,Logical Issue,Volatile Code,Language Specific,Gas Optimization"
The Grand Banks,GRAND,88,unavailable,5/21/2021,Security Assessment,Solidity,2021-05-23T23:01:57-04:00,2021-06-08T23:01:44-04:00,12,,Centralization / Privilege,Logical Issue,Centralization / Privilege,"Gas Optimization,Coding Style,Logical Issue"
SpookySwap,BOO,,"150,176,718",6/15/2021,Security Assessment,Solidity,2021-06-01T21:14:26-04:00,2021-06-07T07:48:52-04:00,7,,,Logical Issue,,"Gas Optimization,Logical Issue"
MX Samurai,MXS,81,unavailable,10/20/2021,Security Assessment,Solidity,2021-08-26T18:00:47-04:00,2021-10-05T17:27:45-04:00,29,Logical Issue,Centralization / Privilege,"Logical Issue,Control Flow,Volatile Code",,"Gas Optimization,Logical Issue,Coding Style,Language Specific"
PolyQuity,PYQ,84,unavailable,6/28/2021,Security Assessment,Solidity,2021-06-17T14:33:55+08:00,2021-06-28T17:03:59+08:00,5,,,Logical Issue,,"Coding Style,Gas Optimization,Logical Issue"
Kalata,KALA,92,"10,475,397",7/14/2021,Security Assessment,Solidity,2021-05-24T23:26:41-04:00,2021-07-14T17:00:38-04:00,41,,"Centralization / Privilege,Logical Issue,Control Flow","Control Flow,Volatile Code,Coding Style,Data Flow","Logical Issue,Mathematical Operations","Language Specific,Volatile Code,Gas Optimization,Coding Style"
LazyMint,LAZY,85,unavailable,6/3/2021,Security Assessment,Solidity,2021-06-02T15:28:20-04:00,2021-07-05T14:26:43-04:00,23,,,"Centralization / Privilege,Logical Issue","Centralization / Privilege,Logical Issue,Volatile Code","Language Specific,Coding Style,Logical Issue"
Bill Hwang Finance,BILL,85,unavailable,5/31/2021,Security Assessment,Solidity,2021-05-29T13:10:28-04:00,2021-05-31T14:19:22-04:00,,,,,,
Wault Finance,WAULT,74,unavailable,2/17/2021,Security Audit,Solidity,"March 5, 2021","March 15, 2021",4,,L,,,"M,C,O"
SingularityDAO,SDAO,,"65,393,620",8/15/2021,Security Assessment,Solidity,2021-07-22T15:43:39-04:00,2021-08-15T15:46:13-04:00,7,,,Volatile Code,"Volatile Code,Centralization / Privilege","Coding Style,Logical Issue,Gas Optimization"
Polkadex,PDEX,,"67,791,364",7/13/2021,Security Assessment,"Golang,Solidity,Rust",2021-07-05T02:53:32-07:00,2021-07-12T23:14:13-07:00,0,,,,,
Stratisplatform,STRAX,,"272,086,705",8/20/2021,Security Assessment,C#,2021-08-04T17:51:01-04:00,2021-08-19T23:02:39-04:00,7,,,"Volatile Code,Control Flow,Centralization / Privilege",,Inconsistency
elephant.money,,85,unavailable,3/26/2021,Security Audit,Solidity,"March 18, 2021","March 26, 2021",8,,,"O,V,L",,"M,G,O"
CoinWind,COW,88,unavailable,10/4/2021,Security Assessment,Solidity,2021-07-11T13:37:43-07:00,2021-10-04T14:25:06-07:00,31,Centralization / Privilege,"Centralization / Privilege,Volatile Code","Volatile Code,Control Flow,Logical Issue,Mathematical Operations,Coding Style","[None, 'Logical Issue', 'Control Flow', 'Mathematical Operations', 'Volatile Code']","Coding Style,Gas Optimization"
Seedify.Fund,SFUND,,"181,392,394",5/27/2021,Security Assessment,Solidity,2021-05-06T02:03:54-04:00,2021-05-31T07:07:32-04:00,9,,Logical Issue,"Logical Issue,Language Specific",Mathematical Operations,"Logical Issue,Gas Optimization,Coding Style"
MixMarvel.Finance,MIX,,"66,875,512",7/13/2021,Security Assessment,Solidity,2021-07-09T16:51:06+08:00,2021-07-13T17:36:33+08:00,3,,,Compiler Error,,"Language Specific,Gas Optimization"
Million Token,MM,,"23,222,980",7/28/2021,Security Assessment,Solidity,2021-07-22T10:55:26-04:00,2021-07-22T12:33:23-04:00,2,,,,,"Language Specific,Coding Style"
TrustSwap,SWAP,,"94,181,242",6/2/2021,Security Assessment,Solidity,2021-05-25T13:13:02-04:00,2021-06-18T09:35:13-04:00,5,,,Logical Issue,,"Language Specific,Gas Optimization"
LCX,LCX,,"208,235,589",11/5/2020,Security Assessment,Solidity,2021-08-07T03:56:46-07:00,2021-10-07T20:07:50-07:00,5,,Centralization / Privilege,,,"Language Specific,Gas Optimization"
DeepBrain Chain,DBC,,"26,234,226",8/14/2021,Security Assessment,Solidity,2021-08-12T18:03:53-07:00,2021-08-13T21:17:55-07:00,3,,Centralization / Privilege,,,"Language Specific,Gas Optimization"
Dao Maker,,,"264,923,596",4/14/2021,Security Assessment,"Solidity,Yul",2021-05-30T01:33:17-04:00,2021-06-09T20:10:03-04:00,7,,,Mathematical Operations,,"Coding Style,Volatile Code,Language Specific,Gas Optimization"
Visor Finance,VISR,,"68,628,807",6/24/2021,Security Assessment,Solidity,2021-06-24T10:02:53-04:00,2021-07-12T16:46:15-04:00,10,,,Logical Issue,,"Gas Optimization,Coding Style,Centralization / Privilege,Logical Issue"
Premia Finance,PREMIA,,"36,007,463",2/19/2021,Security Audit,Solidity,"Feburary 19, 2021","March 3, 2021",13,,,"P,L",,"C,G,O,L"
Phala Network,PHA,,"197,161,700",7/18/2021,Security Assessment,Solidity,2021-07-04T18:08:30-07:00,2021-07-16T18:04:03-07:00,14,,,"Centralization / Privilege,Logical Issue",,"Logical Issue,Coding Style,Gas Optimization"
BarnBridge,BOND,,"159,248,152",8/4/2021,Security Assessment,Solidity,2021-07-22T14:05:45-04:00,2021-08-04T22:22:57-04:00,6,,,"Centralization / Privilege,Logical Issue",,Coding Style
Sphynx BSC,SPHYNX BSC,77,unavailable,11/10/2021,Security Assessment,Solidity,2021-11-08T09:53:49+08:00,2021-11-10T09:42:07+08:00,4,,Centralization / Privilege,"Logical Issue,Volatile Code",,
HARD Protocol,HARD,,"96,845,199",10/16/2020,Security Audit,Golang,"October 05, 2020","October 16, 2020",,,,,,
Swash,SWASH,,"34,023,011",11/11/2021,Security Assessment,Solidity,2021-08-18T19:14:57+01:00,2021-08-18T23:14:04+01:00,2,,,Centralization / Privilege,,Volatile Code
Polylastic,,,"19,136,640",5/17/2021,Security Assessment,Solidity,2021-07-07T10:25:57+08:00,2021-07-12T19:05:04+08:00,9,,Centralization / Privilege,"Control Flow,Centralization / Privilege","Language Specific,Logical Issue","Volatile Code,Language Specific,Logical Issue"
Don-Key Finance,,,"19,206,877",5/12/2021,Security Assessment,Solidity,2021-04-27T04:46:10-04:00,2021-05-12T04:46:10-04:00,1,,,Centralization / Privilege,,
Stacktical (DSLA Protocol),DSLA,,"48,476,776",3/11/2021,Security Assessment,Solidity,2021-04-06T15:14:44-04:00,2021-04-06T15:14:44-04:00,29,,,L,,"G,M,V"
Venus Reward Token (VRT),VRT,,"23,963,659",6/21/2021,Security Assessment,Solidity,2021-05-12T06:33:18-07:00,2021-05-14T07:17:56-07:00,4,,,Logical Issue,,"Language Specific,Coding Style"
Media Industry Licensing Content,MLT,,"47,293,158",5/24/2021,Security Assessment,Solidity,2021-05-16T23:06:27-04:00,2021-05-16T23:06:59-04:00,4,,,C,,"L,G"
Polkamarkets,POLK,,"80,171,389",11/3/2021,Security Assessment,Solidity,2021-09-26T18:47:10-07:00,2021-11-02T11:18:18-07:00,5,,Volatile Code,Logical Issue,,"Data Flow,Volatile Code,Coding Style"
DRK Chain,DRK,,"18,953,369",10/12/2021,Security Assessment,Solidity,2021-08-30T15:43:20+08:00,2021-10-12T14:06:43+08:00,15,,,Logical Issue,,"Language Specific,Logical Issue,Optimization,Gas Optimization,Mathematical Operations"
Tokocrypto,TKO,,"141,948,744",3/31/2021,Security Assessment,Solidity,"March 23, 2021","March 31, 2021",2,,L,L,,
Radio Caca,RACA,,"1,960,511,129",10/27/2021,Security Assessment,Solidity,2021-10-19T14:38:19+08:00,2021-10-27T23:15:47+08:00,5,,Centralization / Privilege,,Logical Issue,
CluCoin,CluCoins,,"11,358,304",5/24/2021,Security Assessment,Solidity,2021-05-19T20:00:00,2021-05-25T20:00:00,3,,,,,"Language Specific,Coding Style"
MyDeFiPet,DPET,,"27,392,083",9/13/2021,Security Assessment,Solidity,2021-07-27T07:13:40-04:00,2021-09-13T01:24:08-04:00,15,,,"Centralization / Privilege,Volatile Code",Language Specific,"Coding Style,Language Specific,Logical Issue"
Woonkly,,,"91,356,315",3/18/2021,Security Audit,Solidity,"March 4, 2021","March 18, 2021",22,L,L,V,,"O,D,C,M"
UniCrypt,UNCX,,"20,996,946",5/20/2021,Security Assessment,Solidity,2021-05-17T14:03:45-04:00,2021-05-20T11:36:28-04:00,4,,,G,,"G,C"
Multiplier,MXX,,"1,576,696",9/1/2020,Security Assessment,Solidity,2021-06-28T02:20:05-04:00,2021-07-02T02:22:12-04:00,0,,,,,
Dora Factory,DORA,,"43,992,193",3/30/2021,Security Assessment,Solidity,2021-07-21T23:41:47-04:00,2021-07-28T23:36:01-04:00,11,,"Logical Issue,Centralization / Privilege",Logical Issue,"Logical Issue,Centralization / Privilege","Gas Optimization,Logical Issue,Coding Style,Control Flow"
EQIFI,EQX,,"16,770,309",7/27/2021,Security Assessment,Solidity,2021-06-23T05:04:33-04:00,2021-07-27T05:21:25-04:00,2,Logical Issue,,,,Gas Optimization
GoMining Token,GMT,,"64,083,934",8/13/2021,Security Assessment,Solidity,2021-07-27T01:19:44-04:00,2021-08-12T07:59:41-04:00,4,,Centralization / Privilege,Centralization / Privilege,,Gas Optimization
EpiK Protocol,EPK,,"13,020,986",11/1/2021,Security Assessment,Solidity,2021-10-29T10:54:23+08:00,2021-11-08T11:16:23+08:00,8,,,"Mathematical Operations,Volatile Code,Logical Issue","Centralization / Privilege,Volatile Code","Logical Issue,Language Specific"
Annex Finance,ANN,88,unavailable,8/13/2021,Security Assessment,Solidity,2021-07-11T18:06:46-07:00,2021-09-25T20:23:12-07:00,22,,"Centralization / Privilege,Data Flow",Logical Issue,Logical Issue,"Logical Issue,Language Specific,Gas Optimization,Coding Style"
Billion Happiness,BHC,,"11,226,828",3/23/2021,Security Audit,Solidity,"March 15, 2021","March 23, 2021",1,,,,,O
Vabble,VAB,,"8,207,215",7/1/2021,Security Assessment,Solidity,2021-06-22T14:30:19-04:00,2021-06-22T14:32:45-04:00,0,,,,,
Wall Street Games,WSG,,"39,604,556",7/31/2021,Security Assessment,Solidity,2021-07-17T01:16:14-04:00,2021-08-01T23:39:44-04:00,8,,Centralization / Privilege,,Logical Issue,"Logical Issue,Language Specific"
TCH TOKEN,TCH,,"10,584,517",6/15/2021,Smart Contract,Solidity,"June 13, 2021","June 14, 2021",3,,,Centralization / Privilege,,"Volatile Code,Logical Issue"
Thoreum Finance,THOREUM,,"29,783,156",7/1/2021,Security Assessment,Solidity,2021-06-28T06:20:53-07:00,2021-07-01T16:08:04+08:00,19,,,"Logical Issue,Mathematical Operations",,"Gas Optimization,Logical Issue,Language Specific"
Rune.Game,RUNE,,"6,934,930",10/29/2021,Security Assessment,Solidity,2021-10-25T16:43:25-07:00,2021-10-29T13:27:43-07:00,2,,Centralization / Privilege,,,Volatile Code
dHEDGE DAO,DHT,,"18,848,720",7/23/2021,Security Assessment,Solidity,2021-09-13T09:09:51+08:00,2021-09-30T14:03:57+08:00,8,,Centralization / Privilege,,,"Coding Style,Logical Issue"
mStable,MUSD,,"123,780,476",1/18/2021,Smart Contract,"Solidity, Yul","January 8, 2021","January 18, 2021",18,,L,L,"L,V","I,C,G"
Nafter Token,NAFT,,"13,814,168",5/14/2021,Security Assessment,Solidity,2021-05-12T19:20:56-04:00,2021-05-14T19:59:49-04:00,11,,,"Logical Issue,Inconsistency",,"Gas Optimization,Coding Style,Language Specific,Inconsistency"
Plasmapay,PPAY,,"17,749,405",10/24/2020,Security Audit,"Solidity, Yul","December 20, 2020","December 29, 2020",,,,,,
UBU Finance,UBU,88,unavailable,3/4/2021,Security Audit,Solidity,"March 1, 2021","March 5, 2021",,,,,,
Xend Finance,XEND,,"6,080,037",2/22/2021,Security Audit,"Solidity, Yul","February 12, 2021 ","February 13, 2021",,,,,,
Lympo Market Token(LMT),LMT,,"6,999,654",6/29/2021,Security Assessment,Solidity,2021-06-25T10:59:18+08:00,2021-06-28T13:19:12+08:00,4,,,,,"Language Specific,Optimization,Gas Optimization,Centralization / Privilege"
Cartesi,CTSI,,"558,264,672",9/22/2021,Security Assessment,Solidity,2021-09-06T01:23:39-04:00,2021-09-22T16:41:45-04:00,19,,Centralization / Privilege,"Volatile Code,Logical Issue","Volatile Code,Logical Issue","Coding Style,Language Specific,Business Model"
YOOSHI,YOOSHI,,unavailable,6/13/2021,Smart Contract,Solidity,"June 10, 2021","June 13, 2021",,,,,,
Boson Protocol,BOSON,,"200,711,155",3/2/2021,Security Audit,"Solidity, Yul",2021-02-22T14:24:00Z,2021-03-05T14:24:00Z,,,,,,
Convergence Finance,CONV,,"43,819,129",4/4/2021,Smart Contract,Solidity,"March 23, 2021","March 23, 2021",,,,,,
Fractal,FCL,,"5,753,759",9/30/2021,Preliminary Comments,Rust,2021-09-13T10:50:13-07:00,2021-09-29T21:53:24-07:00,4,,,,,"Mathematical Operations,Inconsistency,Coding Style"
NKN,NKN,,"461,321,683",8/23/2018,Smart Contract,Solidity,2018-12-23T20:00:00,2018-12-27T20:00:00,,,,,,
WINkLink,WIN,,"547,250,540",8/6/2019,Smart Contract,Solidity,2019-07-23T20:00:00,2019-08-06T20:00:00,,,,,,
CorgiCoin,CORGI,,"4,336,723",11/6/2021,Security Assessment,Solidity,2021-11-03T07:54:32-07:00,2021-11-05T08:51:10-07:00,1,,,,,Gas Optimization
Stafi,FIS,,"46,751,295",1/6/2021,Security Assessment,Golang,2021-04-05T20:00:00,2021-04-19T20:00:00,,,,,,
COTI,COTI,,"454,072,517",3/29/2021,Security Assessment,"Solidity,Yul",2021-03-16T20:00:00,2021-03-29T20:00:00,,,,,,
Polymesh,POLY,,"498,142,086",2/4/2021,Security Assessment,"Solidity,Yul",2021-01-29T20:00:00,2021-02-04T20:00:00,,,,,,
MCDEX,MCB,,"104,177,987",4/4/2021,Smart Contract,Solidity,"April 03, 2021","April 03, 2021",,,,,,
Fleta,,,unavailable,5/14/2021,Security Assessment,Solidity,2021-06-24T07:47:04-04:00,2021-07-06T05:32:57-04:00,22,,,"Centralization / Privilege,Language Specific,Volatile Code,Logical Issue","Centralization / Privilege,Language Specific,Logical Issue","Language Specific,Gas Optimization,Logical Issue,Coding Style"
Beefy Finance,,,"107,114,180",3/7/2021,Security Audit,Solidity,"Feburary 22, 2021","March 5, 2021",14,,C,C,,"C,L,V,O"
Ellipsis Finance,EPS,,"255,154,951",4/22/2021,Security Assessment,"Solidity,Yul",2021-04-03T20:00:00,2021-04-22T20:00:00,,,,,,
biscuit,BCU,81,unavailable,3/18/2021,,,,,,,,,,
Value Network,VNTW,,"6,473,421",5/3/2021,Security Assessment,Solidity,2021-05-04T14:56:13-04:00,2021-05-04T17:23:18-04:00,3,,,,,"G,C"
Light DeFi,LIGHT,87,unavailable,9/8/2021,Security Assessment,Solidity,2021-09-03T18:01:49-04:00,2021-09-08T01:53:31-04:00,11,,"Logical Issue,Centralization / Privilege",Logical Issue,Logical Issue,"Coding Style,Volatile Code,Optimization"
BNSFinance,BNSD,,"3,291,988",11/4/2020,Security Audit,"Solidity, Yul","September 11th, 2020","October 23rd, 2020",27,L,,V,,"L,O,C,V"
CRATOS,CRTS,,"144,735,173",8/25/2021,Security Assessment,Solidity,2021-08-16T11:05:25-04:00,2021-08-25T19:12:23-04:00,18,,Centralization / Privilege,Logical Issue,,"Coding Style,Volatile Code,Logical Issue,Gas Optimization,Language Specific"
8Pay,8PAY,,"4,109,531",5/30/2021,Security Assessment,Solidity,2021-05-10T07:19:46-07:00,2021-05-21T07:19:46-07:00,2,,,Volatile Code,,Gas Optimization
Shadows,,,"11,961,386",3/2/2021,Security Audit,Solidity,"Feburary 21, 2021","Feburary 25, 2021",10,,,"L,O",,"G,L,C"
Vulcan Forged,,,"398,286,326",5/14/2021,Smart Contract,Solidity,"May 15, 2021"," May 15, 2021",,,,,,
Linear Finance,,,"194,113,567",5/24/2021,Smart Contract,Solidity,2021-05-14,2021-05-19,,,,,,
AMEPAY,AME,,"3,359,226",6/7/2021,Security Assessment,"Solidity,Yul",2021-04-10T09:08:28-04:00,2021-04-19T13:03:41-04:00,3,,,Language Specific,,Coding Style
iBox,iBox,,"226,071,964",9/22/2021,Security Assessment,Solidity,2021-09-19T01:21:53-04:00,2021-09-22T07:42:40-04:00,8,,"Centralization / Privilege,Logical Issue",Logical Issue,Control Flow,"Gas Optimization,Logical Issue,Coding Style"
Ariva,ARV,,"29,252,746",9/30/2021,Security Assessment,Solidity,2021-09-27T16:49:38+08:00,2021-09-30T14:10:44+08:00,12,,Centralization / Privilege,Volatile Code,,"Language Specific,Coding Style,Volatile Code,Gas Optimization"
Equalizer Finance,EQZ,,"20,761,096",8/4/2021,Security Assessment,Solidity,2021-06-30T11:06:52-04:00,2021-08-06T20:40:26-04:00,10,Logical Issue,Logical Issue,"Centralization / Privilege,Logical Issue",Centralization / Privilege,"Coding Style,Gas Optimization,Logical Issue,Centralization / Privilege"
Aavegotchi,,,"145,473,555",3/10/2021,Security Audit,"Solidity, Yul","December 21, 2020","March 1, 2021",,,,,,
DINOX,DNXC,,"8,154,110",6/18/2021,Security Assessment,Solidity,2021-06-10T04:40:37-04:00,2021-06-18T09:36:31-04:00,8,,,"Volatile Code,Language Specific",,"Language Specific,Coding Style,Gas Optimization"
Strike Finance,STRK,,"157,733,478",4/8/2021,Security Assessment,"Solidity,Yul",2021-04-07T20:00:00,2021-04-08T20:00:00,,,,,,
StoneDefi,,,"12,536,787",11/11/2021,Security Assessment,Solidity,2021-10-29T10:39:20+08:00,2021-11-11T16:06:58+08:00,10,,Centralization / Privilege,"Volatile Code,Logical Issue",,Mathematical Operations
Occam Finance,OCC,,"93,811,801",5/14/2021,Security Audit,Solidity,2021-05-11T14:24:00Z,2021-05-15T14:24:00Z,,,,,,
V.systems,VSYS,,"52,774,097",10/18/2019,Chain,Scala,"June, 2020","June, 2020",,,,,,
Rabbit Finance,RABBIT,,"5,016,865",5/23/2021,Security Assessment,Solidity,2021-05-11T00:17:07-07:00,2021-05-23T06:29:06-07:00,19,,,"Logical Issue,Centralization / Privilege",Centralization / Privilege,"Gas Optimization,Centralization / Privilege,Language Specific,Control Flow,Logical Issue,Coding Style,Mathematical Operations"
Seascape,,,"32,846,524",10/28/2021,Security Assessment,Solidity,2021-09-26T14:16:05+08:00,2021-10-28T19:16:08+08:00,26,,"Logical Issue,Centralization / Privilege","Volatile Code,Logical Issue,Mathematical Operations",Logical Issue,"Coding Style,Volatile Code"
KiwiGo,KGO,,"788,209",5/11/2021,Security Assessment,Solidity,2021-04-15T22:34:38-04:00,2021-04-24T23:18:34-04:00,3,,,,,"G,L"
Router Protocol,ROUTE,,"32,325,492",8/3/2021,Security Assessment,Solidity,2021-06-29T00:11:42-07:00,2021-08-03T04:23:27-07:00,11,,Logical Issue,"Centralization / Privilege,Logical Issue",,"Logical Issue,Gas Optimization"
MahaDAO,MAHA,,"9,636,148",2/10/2021,Security Audit,Solidity,"January 11, 2021","January 21, 2021",6,,P,,,"O,G"
PAID Network,,,"64,651,238",1/24/2021,Security Audit,"Solidity, Yul","February 17, 2021","February 24, 2021",,,,,,
Ethereum Yield,ETHY,,"955,065",11/10/2020,Security Audit,"Solidity, Yul","November 6, 2020","November 10, 2020",5,,,L,,"L,G"
Thundercore,TT,,"104,694,981",5/5/2020,Smart Contract,Solidity,"May 1, 2019","May 5, 2019",,,,,,
Chainge Finance,CHNG,,"8,714,952",5/7/2020,Security Assessment,Solidity,2021-04-19T16:52:52+08:00,2021-05-07T09:37:03+08:00,4,,Centralization / Privilege,,,"Logical Issue,Optimization,Coding Style"
Ideaology,IDEA,,"9,837,548",7/12/2021,Security Assessment,Solidity,2021-06-26T06:19:53-07:00,2021-07-07T09:23:54-07:00,13,,,"Logical Issue,Volatile Code",,"Gas Optimization,Language Specific,Logical Issue"
TrueFeedBack,TFBX,,"5,863,139",7/26/2021,Security Assessment,Solidity,2021-07-01T14:08:59-04:00,2021-07-26T07:35:27-04:00,12,,,"Gas Optimization,Logical Issue",,"Language Specific,Gas Optimization"
Privateum,PVM,,"9,672,127",8/6/2021,Security Assessment,Solidity,2021-07-16T02:40:36-04:00,2021-07-20T02:45:26-04:00,7,,Centralization / Privilege,,,"Mathematical Operations,Logical Issue,Gas Optimization"
Helmet,HELMET,91,"7,476,719",1/10/2021,,,,,,,,,,
Aluna Social,ALN,,"2,572,490",11/27/2020,Security Audit,"Solidity, Yul","September 7, 2020","November 27, 2020",43,,,"L,V",M,"L,G,V,C"
Nerve Finance,NRV,,"77,747,624",4/12/2021,Security Audit," Solidity, Yul","March 24, 2021","April 6, 2021",,,,,,
Citadel.one,XCT,94,"3,963,807",8/31/2021,Security Assessment,Solidity,2021-07-02T21:39:24-04:00,2021-08-19T22:11:37-04:00,24,,"Centralization / Privilege,Logical Issue",Logical Issue,Logical Issue,"Logical Issue,Gas Optimization"
DEXKIT,KIT,,"4,509,675",6/30/2021,Security Assessment,Solidity,2021-06-08T20:03:19-07:00,2021-06-30T11:13:42-07:00,7,,,Volatile Code,,"Gas Optimization,Mathematical Operations,Volatile Code"
SafeTesla,,89,unavailable,5/11/2021,,,,,,,,,,
Bitgesell,BGL,,"669,788",4/22/2021,Security Assessment,Solidity,2021-04-17T09:38:52-04:00,2021-04-22T09:47:41-04:00,3,,,Centralization / Privilege,,Language Specific
Penguin Finance,PEFI,,"18,518,764",6/14/2021,Security Assessment,Solidity,2021-05-19T13:59:01-04:00,2021-06-14T14:31:42-04:00,8,,Logical Issue,Logical Issue,,"Gas Optimization,Coding Style,Language Specific"
Shirtum,SHI,,"24,800,463",8/31/2021,Security Assessment,Solidity,2021-08-25T14:19:54-04:00,2021-08-27T12:01:15-04:00,9,,Logical Issue,"Mathematical Operations,Logical Issue,Centralization / Privilege",,Coding Style
HodlTree,HTRE,,"799,150",6/16/2021,Security Assessment,Solidity,2021-05-11T09:53:32-04:00,2021-06-16T11:04:06-04:00,5,,,Volatile Code,,"Language Specific,Coding Style,Gas Optimization"
OpenOcean,OOE,,"88,648,296",2/18/2021,Security Audit,Solidity,"March 1, 2021","March 9, 2021",,,,,,
Deri Protocol,DERI,,"62,557,426",6/3/2021,Smart Contract,Solidity,"May 26, 2021","June 03, 2021",,,,,,
Reflect Foundation,RFI,,"806,433",4/17/2021,Security Assessment,Solidity,2021-01-02T14:55:48-04:00,2021-01-18T10:28:11-04:00,4,,,O,,"G,O,L"
GoCrypto,GOC,,"25,556,484",10/20/2021,Security Assessment,Solidity,2021-10-07T08:14:55-07:00,2021-10-20T06:21:07-07:00,3,,Centralization / Privilege,,,Coding Style
ApeSwap Finance,,,"152,541,733",5/2/2021,Security Audit,Solidity,"March 02, 2021","May 05, 2021",15,,L,L,,"O,L,C"
TotemFi,TOTM,,"1,745,741",4/12/2021,Security Assessment,Solidity,2021-03-31T12:01:16-04:00,2021-03-31T12:01:16-04:00,13,,,L,,"G,C,L,V"
Cudo Ventures,CUDOS,,"108,760,160",5/19/2021,Security Assessment,"Solidity,Yul",2021-03-22T20:00:00,2021-05-19T20:00:00,25,,,"Volatile Code,Logical Issue",,"Coding Style,Gas Optimization,Language Specific"
OmniEstateGroup,ORT,,unavailable,7/1/2021,Security Assessment,Solidity,2021-06-09T11:42:55-04:00,2021-06-28T01:37:39-04:00,6,,,,Centralization / Privilege,Coding Style
Argon.run,,,"5,004,403",4/5/2021,Security Audit,Solidity,"March 31, 2021","April 5, 2021",11,"L,C",L,V,,"M,L"
Panda Yield,,,"24,196",3/1/2021,Security Audit,Solidity,"Feburary 16, 2021","Feburary 28, 2021",9,,,P,,"C,G,L,O"
PolkaBridge,PBR,,"89,522,956",3/22/2021,Security Audit,Solidity,"March 16, 2021","March 22, 2021",8,,V,,,"C,O"
Covalent,CQT,,"54,720,800",10/6/2019,Security Assessment,Solidity,2019-09-20T20:00:00Z,2019-10-06T20:00:00Z,,,,,,
Netvrk,NTVRK,86,unavailable,5/15/2021,Preliminary Comments,Solidity,2021-05-17T16:05:32-04:00,2021-05-30T11:33:03-04:00,10,,,"C,L",L,C
SifChain,,,"52,194,889",6/12/2021,Security Assessment,Solidity,2021-03-01T04:46:50-04:00,2021-03-26T07:36:07-04:00,,,,,,
Bifrost,BFC,,"227,602,261",8/3/2021,Security Assessment,Solidity,2021-07-15T04:46:41-04:00,2021-08-03T04:51:44-04:00,9,,Logical Issue,"Gas Optimization,Logical Issue",,Coding Style
GYSR,GYSR,,"2,522,247",6/9/2021,Security Assessment,Solidity,2021-05-20T04:09:47-04:00,2021-06-09T12:36:18-04:00,18,,,"Volatile Code,Centralization / Privilege",,"Language Specific,Gas Optimization,Coding Style,Volatile Code,Control Flow"
Crypto Carbon Energy,CYCE,,"20,506,872",10/22/2021,Security Assessment,Solidity,2021-10-25T09:23:15-07:00,2021-10-22T16:25:49-07:00,4,,Centralization / Privilege,,,Gas Optimization
Crudeoil Finance,OIL,78,unavailable,3/18/2021,Security Audit,Solidity,"Feburary 28, 2021","March 8, 2021",3,,,L,,"L,G"
X World Games (XWG),,,"38,196,319",3/19/2021,Security Assessment,"Solidity,Yul",2021-03-17T20:00:00,2021-03-18T20:00:00,,,,,,
Wing Finance,,,"45,619,550",5/12/2021,Smart Contract,Solidity,"May 11, 2021","May 11, 2021",,,,,,
UniLend,UFT,,"28,655,733",3/30/2021,Security Audit,"Solidity, Yul","March 2, 2021","March 15, 2021",,,,,,
Taraxa,TARA,,unavailable,7/28/2021,Security Assessment,Solidity,2021-07-17T04:15:36-07:00,2021-07-28T00:00:21-07:00,10,,"Logical Issue,Centralization / Privilege",Logical Issue,,"Language Specific,Logical Issue,Gas Optimization"
YFLink,SYFL,,"28,698,800",2/17/2021,Security Audit,"Solidity, Yul","January 29, 2021","February 18, 2021",,,,,,
Unslashed Finance,,,"5,662,137",1/10/2021,Security Audit,Solidity,"October 12, 2020","November 23, 2020",,,,,,
EcoCelium DeFi,ECO,,"525,974",6/21/2021,Security Assessment,Solidity,2021-05-14T13:21:35+08:00,2021-06-09T10:54:21+08:00,11,,,"Centralization / Privilege,Compiler Error",,"Coding Style,Logical Issue"
Energy Ledger,ELX,,"3,855,685",10/25/2021,Security Assessment,Solidity,2021-10-12T08:55:30-07:00,2021-10-25T13:17:12-07:00,3,,Centralization / Privilege,Volatile Code,,Language Specific
YEFI,YEFI,,unavailable,7/1/2021,Security Assessment,Solidity,2021-06-28T17:25:33+08:00,2021-07-01T15:27:00+08:00,5,,,Centralization / Privilege,,"Volatile Code,Language Specific"
DokiDoki Finance,doki,,"2,281,071",4/6/2021,Security Audit,Solidity,"March 16, 2021","April 6, 2021",7,,L,,,O
88mph,MPH,,"26,653,672",2/22/2021,Security Audit,"Solidity, Yul","February 01, 2021","February 19, 2021",,,,,,
Spartan Protocol,SPARTA,,"32,581,681",3/7/2021,Security Audit,"Solidity, Yul","September 18, 2020 ","October 5, 2020",,,,,,
Emoney,,,"30,187,142",4/16/2020,"Interest-bearing, currency-backed tokens",Golang,"February 12, 2020","April 16, 2020",,,,,,
AURA,AURA,,unavailable,8/25/2021,Security Assessment,Solidity,2021-07-15T23:05:22-04:00,2021-07-16T21:17:35-04:00,4,,,,Centralization / Privilege,"Logical Issue,Gas Optimization,Language Specific"
Eggplant Finance,,,"13,956",6/30/2021,Security Assessment,Solidity,2021-06-14T01:30:27-07:00,2021-06-30T12:28:56-07:00,7,Logical Issue,,"Volatile Code,Logical Issue",,Gas Optimization
Feta,FETA,84,unavailable,4/16/2021,,,,,,,,,,
GAMEE,,,"40,364,798",4/27/2021,Smart Contract,Solidity,"April 25, 2021","April 25, 2021",,,,,,
BSCStation,BSCS,,"15,029,971",11/3/2021,Security Assessment,Solidity,2021-10-20T09:58:36+08:00,2021-11-03T11:43:54+08:00,18,Logical Issue,"Centralization / Privilege,Logical Issue","Volatile Code,Logical Issue",,"Gas Optimization,Logical Issue"
Eleven Finance,ELE,,"2,627,948",7/19/2021,Security Assessment,Solidity,2021-06-29T13:58:57-07:00,2021-07-19T12:46:23-07:00,5,,Logical Issue,"Centralization / Privilege,Gas Optimization",,"Gas Optimization,Control Flow"
Xwin Finance,,86,"4,461,568",2/25/2021,,,,,,,,,,
DuckDAO Incubator,DUCK ,,"12,205,620",2/8/2021,Security Audit,"Solidity, Yul","Feburary 04, 2021","Feburary 08, 2021",13,V,C,"V,C",,"O,M,D"
GXChain,GXC,,"50,131,024",9/4/2020,Smart Contract,C++/Solidity,"August 24, 2020","September 4, 2020",,,,,,
Benchmark Protocol,MARK,,"3,746,906",11/23/2020,Security Assessment,Solidity,2021-04-15T20:00:00,2021-05-01T20:00:00,6,,,"Volatile Code,Logical Issue",,"Coding Style,Gas Optimization,Logical Issue,Volatile Code"
Keytango,,,"1,202,569",3/2/2021,Security Audit,Solidity,"Feburary 16, 2021","Feburary 24, 2021",11,,,"L,I",,"C,D,G,O,M"
SaltSwap,,,"16,706,314",3/23/2021,Security Audit,Solidity,"March 1, 2021","March 23, 2021",,,,,,
GourmetGalaxy,,,"1,659,616",2/23/2021,Security Audit,"Solidity, Yul","January 17, 2021","January 25, 2021",8,,,L,L,"L,G,C"
Sishi Finance,,,"454,780",5/24/2021,Security Assessment,Solidity,2021-05-11T20:51:51-04:00,2021-05-24T23:23:18-04:00,6,,,"Logical Issue,Gas Optimization",,Gas Optimization
polarisdefi,POLAR,92,"168,167",4/7/2021,,,,,,,,,,
MacaronSwap,,94,"1,329,744",6/7/2021,Security Assessment,Solidity,2021-04-26T07:12:01-07:00,2021-06-07T14:10:58-07:00,56,,"Logical Issue,Volatile Code,Centralization / Privilege","Volatile Code,Logical Issue,Centralization / Privilege","Logical Issue,Volatile Code,Language Specific","Gas Optimization,Volatile Code,Coding Style,Mathematical Operations,Logical Issue"
LaunchPool,,,"22,923,875",2/16/2021,Security Audit,"Solidity, Yul","January 16, 2021","January 18, 2021",,,,,,
Unido,,,"25,043,716",2/19/2021,Security Audit,"Solidity, Yul","February 20, 2021","March 2, 2021",,,,,,
HYVE,,,"14,588,775",5/10/2021,Smart Contract,Solidity,"January 1, 2021","May 9, 2021",,,,,,
Bondly Finance,BONDLY,,"18,763,903",1/7/2021,,,,,,,,,,
UREEQA Inc.,,,"15,571,277",3/26/2021,Security Assessment,Solidity,2021-03-02T14:55:48-04:00,2021-03-26T10:28:11-04:00,,,,,,
Tower,,,"17,217,025",4/27/2021,Smart Contract,Solidity,"April 25, 2021","April 25, 2021",,,,,,
PussyCatCore,PCATV3,,unavailable,6/21/2021,Security Assessment,Solidity,2021-05-18T10:32:56-07:00,2021-06-18T06:43:46-07:00,28,Volatile Code,,"Volatile Code,Logical Issue,Mathematical Operations",,"Language Specific,Gas Optimization,Coding Style,Volatile Code,Magic Numbers"
Beyond Finance,BEYOND,,"12,665,379",4/29/2021,Security Assessment,Solidity,2021-04-12T22:47:04-04:00,2021-04-12T22:47:04-04:00,11,,"M,L",,,"L,G"
Unirealchain,UNR,,unavailable,8/31/2021,Security Assessment,Solidity,2021-08-18T14:18:54-04:00,2021-08-31T02:26:06-04:00,7,,,"Centralization / Privilege,Logical Issue",,"Language Specific,Coding Style"
Ichi,,,"18,963,686",4/1/2021,Security Audit,Solidity,"March 26, 2021","April 1, 2021 ",,,,,,
WXT,,,"14,869,843",5/10/2021,Smart Contract,Solidity,"May 8, 2021","May 9, 2021",,,,,,
FuruCombo,,,"14,595,774",4/13/2021,Security Audit,"Solidity, Yul","March 18, 2021","April 14, 2021",,,,,,
Tixl,TXL,,"17,245,472",3/12/2021,Security Audit,"Solidity, Yul","January 12, 2021","January 15, 2021",,,,,,
Idavoll Network,IDV,,"15,375,684",2/25/2021,Security Audit,Solidity,"February 26, 2020","March 1, 2021",,,,,,
SOTA,NFT,,"639,086",12/19/2020,Security Assessment,Solidity,2021-05-19T19:42:17-07:00,2021-05-25T20:05:40-07:00,3,,Centralization / Privilege,Logical Issue,,Logical Issue
Seed,SEED,,unavailable,7/29/2021,Security Assessment,Solidity,2021-07-28T22:58:53-07:00,2021-07-29T00:43:51-07:00,3,,,,,"Language Specific,Coding Style,Logical Issue"
Liti Capital,,,unavailable,5/21/2021,Security Assessment,Solidity,2021-05-20T13:17:32-04:00,2021-06-07T00:31:57-04:00,6,,,,,"L,C"
BHP,,,"11,765,699",1/15/2021,Security Audit,,"December 22, 2020","December 30, 2020",,,,,,
Dexa Coin,DEXA,,"15,173,598",4/6/2021,Security Audit,Solidity,"April 03, 2021","April 03, 2021",,,,,,
Hedget,,,"11,080,659",5/26/2021,Security Audit,"Solidity, Yul",2021-04-28T20:00:00,"May 26, 2021",,,,,,
Metahero,HERO,86,unavailable,7/14/2021,Security Assessment,Solidity,2021-06-25T04:29:38-04:00,2021-07-12T04:30:26-04:00,10,,Logical Issue,"Logical Issue,Centralization / Privilege",,"Control Flow,Coding Style"
Burency,,,"16,353,805",3/24/2020,Smart Contract,Solidity,"March 4, 2021","March 17, 2021",,,,,,
ZZZ Finance,ZZZ,,"8,452",10/24/2020,Security Audit,Solidity,"August 01, 2020","October 12, 2020",17,V,,V,,"C,O,D"
EarnX,EARNX,,"2,034,286",7/2/2021,Security Assessment,Solidity,2021-06-21T19:46:27-07:00,2021-07-01T19:41:20-07:00,12,,Centralization / Privilege,"Control Flow,Logical Issue,Mathematical Operations","Logical Issue,Centralization / Privilege","Logical Issue,Coding Style"
StakeWise,,,"7,892,728",6/1/2021,Security Assessment,Solidity,2021-05-24T06:21:57-04:00,2021-06-01T07:20:23-04:00,,,,,,
Feeder Finance,feed,,unavailable,6/25/2021,Security Assessment,Solidity,2021-06-09T09:00:12-04:00,2021-06-21T23:34:55-04:00,17,,,Logical Issue,Centralization / Privilege,"Centralization / Privilege,Gas Optimization,Logical Issue"
Nsure Network,,,"6,237,542",3/31/2021,Smart Contract,Solidity,"February 2, 2021","February 14, 2021",,,,,,
FilDA,FILDA,,"9,750,946",6/4/2021,Smart Contract,Solidity,"June 01, 2021","June 04, 2021",,,,,,
PocMon,MON,,"2,050,355",11/3/2021,Security Assessment,Solidity,2021-10-25T18:27:57-07:00,2021-11-02T08:15:29-07:00,7,,Centralization / Privilege,"Logical Issue,Control Flow",Logical Issue,
PERI Finance,PERI,,"1,510,053",7/1/2021,Security Assessment,Solidity,2021-06-16T04:23:00-04:00,2021-07-01T05:51:19-04:00,10,,Coding Style,,Volatile Code,"Language Specific,Volatile Code,Gas Optimization"
Football Stars,FootballStars,,"4,175,030",6/29/2021,Security Assessment,Solidity,2021-06-28T05:04:48-04:00,2021-06-29T10:12:38-04:00,15,,"Logical Issue,Centralization / Privilege",Logical Issue,,"Language Specific,Gas Optimization,Coding Style,Logical Issue,Centralization / Privilege"
GaeaCoin,GAC,,unavailable,7/21/2021,Security Assessment,Solidity,2021-07-14T22:12:09-04:00,2021-07-21T02:52:54-04:00,5,,Centralization / Privilege,,Logical Issue,"Gas Optimization,Language Specific,Logical Issue"
Aucoin,,,unavailable,6/5/2021,Security Assessment,Solidity,2021-05-17T17:59:22-04:00,2021-06-05T18:28:27-04:00,2,,,,,"G,L"
DAOventures,DVG,,"1,077,548",6/15/2021,Security Assessment,Solidity,2021-06-28T02:47:47-04:00,2021-07-21T07:53:43-04:00,12,,,"Volatile Code,Centralization / Privilege,Gas Optimization,Logical Issue","Centralization / Privilege,Mathematical Operations","Mathematical Operations,Gas Optimization"
Moonpot,POTS,,unavailable,7/7/2021,Security Assessment,Solidity,2021-06-23T17:40:42-04:00,2021-07-07T09:47:12-04:00,6,,,"Logical Issue,Coding Style",,"Language Specific,Logical Issue"
Bunicorn,BUNI,,"6,084,535",7/23/2021,Security Assessment,Solidity,2021-07-10T01:40:34-07:00,2021-07-22T20:06:27-07:00,12,,Centralization / Privilege,"Volatile Code,Logical Issue",,"Language Specific,Gas Optimization,Coding Style"
Nausicaa-Inu,Nausicaa-Inu,88,unavailable,11/7/2021,Security Assessment,Solidity,2021-11-02T10:51:23+08:00,2021-11-06T15:38:38+08:00,10,,Centralization / Privilege,,,"Language Specific,Gas Optimization,Coding Style,Logical Issue"
Apple Finance,APPLE,,unavailable,6/15/2021,Security Assessment,Solidity,2021-06-10T09:08:28-04:00,2021-06-15T13:03:41-04:00,14,,Centralization/Privilege,Logical Issue,,"Centralization/Privilege,Logical Issue,Language Specific,Coding Style,Gas Optimization"
BitANT,,,unavailable,5/30/2021,Security Assessment,Solidity,2021-05-30T16:17:09-04:00,2021-05-30T16:18:05-04:00,,,,,,G
JBEST,HEXCH,,unavailable,8/17/2021,Security Assessment,Solidity,2021-06-19T01:10:37-04:00,2021-08-10T03:01:42-04:00,4,,Logical Issue,,Logical Issue,"Volatile Code,Gas Optimization"
Squirrel Finance,NUTS,,"1,845,112",6/15/2021,Security Assessment,Solidity,2021-05-22T22:01:11-04:00,2021-06-12T19:26:12-04:00,17,,Logical Issue,Logical Issue,Centralization / Privilege,"Coding Style,Logical Issue"
Cook Finance,,,"4,768,031",2/19/2021,Security Audit,"Solidity, Yul","February 3, 2021","February 10, 2021",,,,,,
BitcashPay,BCP,83,"48,495",3/10/2021,,,,,,,,,,
OctoFi,OCTO,,"2,693,676",4/12/2021,Security Assessment,Solidity,2021-03-28T20:00:00,2021-04-12T20:00:00,,,,,,
XDeFi,,,unavailable,1/26/2021,Security Audit,Solidity,"February 8, 2021","February 26, 2021",,,,,,
Zenfuse,,,"4,954,737",4/4/2021,Security Audit,"Solidity, Yul","March 16, 2021","March 17, 2021",,,,,,
Cryptonovae,,,"3,641,942",2/17/2021,Security Audit,Solidity,"February 16, 2021","February 22, 2021",,,,,,
Phoswap,,77,unavailable,2/25/2021,Security Audit,Solidity,"February 20, 2021","February 26, 2021",,,,,,
ProtoFi,,,unavailable,8/30/2021,Security Assessment,Solidity,2021-07-30T18:13:28-04:00,2021-08-30T11:50:34-04:00,17,,,"Centralization / Privilege,Logical Issue","Logical Issue,Volatile Code",Coding Style
MarginSwap,MFI,,"3,128,558",4/6/2021,Security Assessment,"Solidity,Yul",2021-03-19T20:00:00,2021-04-06T20:00:00,,,,,,
Bagus Wallet,BG,,unavailable,11/4/2021,Security Assessment,Solidity,2021-10-31T18:49:56-07:00,2021-11-04T18:24:13-07:00,4,,Centralization / Privilege,,,"Language Specific,Gas Optimization,Coding Style"
SpiderDao,,,"2,737,353",12/14/2020,Security Audit,"Solidity, Yul","December 3, 2020","December 14, 2020",,,,,,
Twinci,,,"1,418,579",5/24/2021,Smart Contract,Solidity,"May 21, 2021"," May 21, 2021",,,,,,
Ethalend,,,"1,361,011",3/30/2021,Security Audit,"Solidity, Yul","February 24, 2021","March 30, 2021",,,,,,
Shrew,SHREW,,"15,948",7/28/2021,Security Assessment,Solidity,2021-07-21T12:51:46-04:00,2021-07-27T22:10:52-04:00,4,,Centralization / Privilege,"Volatile Code,Mathematical Operations",,Gas Optimization
Creator Chain,CTR,,unavailable,8/6/2021,Security Assessment,Solidity,2021-08-06T19:03:32-07:00,2021-08-31T02:58:27-07:00,3,,Centralization/ Privilege,Centralization/ Privilege,,Language Specific
Asko Finance,ASKO,,"7,626,368",4/4/2021,Security Audit,Solidity,"March 04, 2021","April 15, 2021",26,,,,,D
XFarmer,XF,,unavailable,10/4/2021,Security Assessment,Solidity,2021-09-09T09:10:53+08:00,2021-09-30T17:58:56+08:00,21,,"Logical Issue,Centralization / Privilege,Volatile Code","Logical Issue,Volatile Code",,"Gas Optimization,Coding Style,Logical Issue"
KickPad,KPAD,,"930,609",3/26/2021,Security Assessment,Solidity,2021-03-02T14:55:48-04:00,2021-03-26T10:28:11-04:00,,,,,,
Happycoin,,,"2,444,634",5/10/2021,Security Assessment,Solidity,2021-05-04T13:23:20-04:00,2021-05-26T00:14:21-04:00,15,,"L,C","L,C",,"C,G,V,L"
Ruler,,,"96,582",2/21/2021,Security Audit,"Solidity, Yul",2021-02-07T14:24:00Z,2021-02-21T14:24:00Z,,,,,,
Hyper Finance,,,"87,038",4/22/2021,Smart Contract,Solidity,"April 20, 2021","April 20, 2021",,,,,,
Keep4r,KP4R,,"402,086",11/3/2020,Security Audit,Solidity,"November 02, 2020","November 03, 2020",,,,,,
Deflect,ZUSD,,"1,123,867",2/22/2021,Security Audit,"Solidity, Yul","January 19, 2021","January 25, 2021",,,,,,
Keep,KEEP,,"503,191,026",9/17/2021,Security Assessment,Solidity,2021-08-23T11:17:04-04:00,2021-09-16T22:15:58-04:00,16,,"Centralization / Privilege,Volatile Code",Logical Issue,Volatile Code,"['Gas Optimization', None]"
CoFiX,COFI/COFIX,,"3,791,706",7/27/2021,Security Assessment,Solidity,2021-04-18T22:33:19-07:00,2021-07-27T23:08:16-07:00,10,,Logical Issue,"Gas Optimization,Mathematical Operations,Inconsistency",,Gas Optimization
Moon Maker Protocol,MMP,,unavailable,7/20/2021,Security Assessment,Solidity,2021-06-14T15:10:25-04:00,2021-07-20T21:18:32-04:00,14,,"Logical Issue,Centralization / Privilege",Centralization / Privilege,,"Coding Style,Control Flow,Gas Optimization,Logical Issue,Volatile Code"
Sharedstake,SGT,,unavailable,4/12/2021,Security Audit," Solidity, Yul","March 9, 2021","March 29, 2021",,,,,,
Barter Smartplace,,,"3,628",3/28/2021,Security Audit,"Solidity, Yul","March 25, 2021","April 1, 2021",,,,,,
GAIA,GAIA,,"598,515",5/4/2021,Security Assessment,Solidity,2021-04-22T20:00:00,2021-05-04T20:00:00,,,,,,
Tutti Frutti Finance,TFF,,"78,962",4/26/2021,Security Audit,Solidity,"April 13, 2021","April 16, 2020",,,,,,
Palette Finance,BLUE,,unavailable,6/10/2021,Security Assessment,Solidity,2021-06-01T10:39:43-04:00,2021-06-16T22:01:05-04:00,6,,Logical Issue,"Volatile Code,Logical Issue,Centralization / Privilege",,Logical Issue
Adamant,ADDY,81,unavailable,7/30/2021,Security Assessment,Solidity,2021-06-13T21:03:01-04:00,2021-07-29T22:25:01-04:00,28,,Centralization / Privilege,"Volatile Code,Logical Issue","Volatile Code,Centralization / Privilege","Volatile Code,Logical Issue,Coding Style"
SocialSwap,,,unavailable,7/15/2021,Security Assessment,Solidity,2021-05-25T11:45:53-04:00,2021-07-01T12:16:17-04:00,3,,,Logical Issue,,Coding Style
Boosted Finance,BOOST,,"395,366",12/14/2020,Security Audit,"Solidity, Yul","September 9, 2020","December 4, 2020",43,,V,"L,C,V",V,"L,C,G,D"
SAPPCHAT,APP,,unavailable,5/20/2021,Security Assessment,Solidity,2021-05-08T01:26:44-04:00,2021-05-20T01:08:46-04:00,2,,,,,"L,C"
Graviton,GTON,93,"7,043,737",10/15/2021,Security Assessment,Solidity,2021-09-08T02:33:20-07:00,2021-10-14T19:26:40-07:00,7,,Centralization / Privilege,,,"Language Specific,Logical Issue"
TXT,TXT,,unavailable,7/13/2021,Security Assessment,Solidity,2021-07-01T19:11:47+08:00,2021-07-01T19:29:31+08:00,4,,,Volatile Code,,"Language Specific,Gas Optimization"
Awesome Finance,AWE,,unavailable,7/11/2021,Security Assessment,Solidity,2021-07-02T14:55:48-04:00,2021-07-11T10:28:11-04:00,10,,,"Logical Issue,Centralization / Privilege",Volatile Code,"Language Specific,Coding Style"
CoffeeSwap,COFE,79,unavailable,4/13/2021,,,,,,,,,,
Cryption Network,CNT,,unavailable,6/2/2021,Security Assessment,Solidity,2021-05-26T09:07:26-04:00,2021-06-02T16:02:53-04:00,1,,,,,G
Landbox,LAND,,"248,408",5/3/2021,Security Assessment,Solidity,2021-05-02T22:30:15-04:00,2021-05-10T12:34:02-04:00,12,,C,"C,G,V,M",,"C,L"
Trava Finance,TRAVA,,"8,397,482",8/30/2021,Security Assessment,Solidity,2021-08-13T04:28:03-04:00,2021-08-30T04:20:00-04:00,7,,Centralization / Privilege,Coding Style,,"Coding Style,Gas Optimization"
UltraSafe,ULTRA,,unavailable,5/16/2021,Security Assessment,Solidity,2021-05-18T16:10:50-04:00,2021-05-18T16:48:47-04:00,10,,,"L,C",,"C,L,G,V"
QANX,QANX,,unavailable,5/27/2021,Security Assessment,Solidity,2021-10-11T12:28:03-07:00,2021-10-27T18:22:52-07:00,4,,Centralization / Privilege,"Volatile Code,Coding Style",,Volatile Code
Newdex,DEX,,unavailable,7/5/2021,Security Assessment,Solidity,2021-07-01T11:16:48+08:00,2021-07-05T19:10:15+08:00,4,,,Centralization / Privilege,,"Language Specific,Gas Optimization"
Crypto Zoon,ZOON,,"11,369,234",8/31/2021,Security Assessment,Solidity,2021-08-18T12:13:48-04:00,2021-08-31T13:13:29-04:00,11,,Centralization / Privilege,Volatile Code,Logical Issue,"Volatile Code,Gas Optimization"
Anrkeyx,ANRX,,"11,818,601",2/16/2021,Security Assessment,Solidity,2021-04-15T14:42:05-07:00,2021-05-24T17:14:03-07:00,39,Logical Issue,"Logical Issue,Volatile Code","Volatile Code,Logical Issue,Language Specific",,"Language Specific,Gas Optimization,Coding Style,Control Flow"
Knight War The Holy Trio,KWS,,"2,496,303",9/24/2021,Security Assessment,Solidity,2021-09-19T14:21:15+08:00,2021-09-24T13:11:53+08:00,7,,Centralization / Privilege,Volatile Code,,Gas Optimization
GloryDoge,GLORYD,,unavailable,11/7/2021,Security Assessment,Solidity,2021-11-02T23:34:18-07:00,2021-11-06T01:17:07-07:00,8,,Centralization / Privilege,"Volatile Code,Logical Issue",Control Flow,"Gas Optimization,Logical Issue"
Gaia EverWorld,GAIA,,unavailable,10/16/2021,Security Assessment,Solidity,2021-09-21T00:33:47+04:00,2021-10-15T09:01:19+04:00,4,,Centralization / Privilege,,,Coding Style
Cruise,CRE,,unavailable,7/12/2021,Security Assessment,Solidity,2021-07-06T23:16:14-07:00,2021-07-12T01:04:32-07:00,6,,Compiler Error,Mathematical Operations,,Gas Optimization
Rosefintech,AMAS,,unavailable,6/30/2021,Security Assessment,Solidity,2021-06-26T09:59:09+08:00,2021-06-30T11:14:22+08:00,2,,,,,"Gas Optimization,Coding Style"
ethbox,,,unavailable,2/8/2021,Security Audit,"Solidity, Yul","January 24, 2021","Feburary 12, 2021",5,,,I,,"C,O,L"
Elevate Defi,,,"207,134",3/1/2021,Security Audit,Solidity,"Feburary 18, 2021","Feburary 26, 2021",12,,L,,,"C,O,L"
SafeComet,SAFECOMET,,unavailable,6/10/2021,Security Assessment,Solidity,2021-05-27T10:17:46-04:00,2021-06-17T10:36:28-04:00,14,,Centralization / Privilege,"Logical Issue,Control Flow,Centralization / Privilege",Logical Issue,"Coding Style,Volatile Code,Logical Issue,Gas Optimization,Language Specific"
MoonRatX,SMRAT,,unavailable,8/12/2021,Security Assessment,Solidity,2021-07-28T21:18:20-04:00,2021-08-12T01:42:27-04:00,3,,Centralization / Privilege,Volatile Code,,Language Specific
Constant proportional portfolio contract,,,unavailable,6/23/2021,Security Assessment,Solidity,2021-06-01T00:02:35-07:00,2021-06-22T22:14:46-07:00,14,,,Logical Issue,,"Gas Optimization,Logical Issue,Coding Style"
Lixir,LIX,,unavailable,9/12/2021,Security Assessment,Solidity,2021-06-14T20:57:35-04:00,2021-09-12T14:10:28-04:00,22,,,"Logical Issue,Centralization / Privilege",Logical Issue,"Coding Style,Logical Issue"
Binapet,BPET,,"853,564",9/20/2021,Security Assessment,Solidity,2021-09-13T17:30:21-04:00,2021-09-20T14:59:00-04:00,11,,"Centralization / Privilege,Mathematical Operations","Logical Issue,Volatile Code",,"Language Specific,Inconsistency,Gas Optimization,Coding Style"
Empty Set Dollar,ESD,,"3,516,436",11/9/2020,Security Audit,Solidity,"October 06, 2020","November 06, 2020",15,,I,I,,"I,O"
Firebird Finance,"HOPE,HOPE-P",,unavailable,6/24/2021,Security Assessment,Solidity,2021-06-15T13:26:52-04:00,2021-06-19T14:57:15-04:00,12,,Centralization / Privilege,Centralization / Privilege,,"Logical Issue,Coding Style"
TrustPad,,,unavailable,5/10/2021,Preliminary Comments,Solidity,2021-05-05T19:20:13-04:00,2021-05-07T19:49:54-04:00,6,,,C,,"L,G,C"
CHAIR,BNCH,,unavailable,7/7/2021,Security Assessment,Solidity,2021-05-17T11:59:20+08:00,2021-05-23T12:02:37+08:00,9,,,"Centralization / Privilege,Logical Issue",,"Logical Issue,Gas Optimization,Mathematical Operations"
KuSwap Finance,KUS,,"10,655,292",11/4/2021,Security Assessment,Solidity,2021-08-03T15:10:31-04:00,2021-11-04T11:40:02-04:00,24,Logical Issue,"Logical Issue,Centralization / Privilege","Logical Issue,Volatile Code,Gas Optimization",Logical Issue,"Language Specific,Logical Issue,Coding Style,Gas Optimization"
Zionodes,ZMFTT,78,unavailable,4/16/2021,,,,,,,,,,
Apollo11,Apollo11,,unavailable,6/28/2021,Security Assessment,Solidity,2021-06-23T14:55:00+08:00,2021-06-29T00:06:28+08:00,9,,Mathematical Operations,Centralization / Privilege,,"Logical Issue,Coding Style,Gas Optimization,Language Specific"
Galaxy Heroes Coin,GHC,,"80,823,516",11/6/2021,Security Assessment,Solidity,2021-10-20T07:27:02-07:00,2021-11-05T13:55:34-07:00,16,Centralization / Privilege,"Centralization / Privilege,Control Flow","Logical Issue,Volatile Code,Control Flow",,"Coding Style,Logical Issue"
NFTmall,,,unavailable,4/16/2021,Security Audit,Solidity,"April 12, 2021","April 15, 2021",1,,C,,,
Teneo,TENEO,,unavailable,8/1/2021,Security Assessment,Solidity,2021-03-11T21:06:46-04:00,2021-08-13T23:23:12-04:00,,,,,,
Liquidus Finance,LIQ,,unavailable,10/11/2021,Security Assessment,Solidity,2021-08-14T00:27:14+04:00,2021-09-30T09:30:46+04:00,3,,Centralization / Privilege,,,"Language Specific,Coding Style"
Dinosaur Eggs,DSG,,unavailable,10/4/2021,Security Assessment,Solidity,2021-09-02T13:51:42+08:00,2021-09-28T19:38:43+08:00,27,,"Centralization / Privilege,Logical Issue,Volatile Code",Logical Issue,"Volatile Code,Logical Issue","Coding Style,Gas Optimization,Mathematical Operations"
PolkaPlay,POLO,,unavailable,8/1/2021,Security Assessment,Solidity,2021-07-31T01:07:39-04:00,2021-08-01T10:30:54-04:00,4,,Centralization / Privilege,Volatile Code,,"Coding Style,Gas Optimization"
Polysky Finance,,,unavailable,10/28/2021,Security Assessment,Solidity,2021-09-08T18:40:15-07:00,2021-10-27T06:28:19-07:00,19,,"Centralization / Privilege,Logical Issue","Logical Issue,Volatile Code",Logical Issue,
Simurgh Finance,SIMURGH,,unavailable,8/17/2021,Security Assessment,Solidity,2021-08-03T16:24:48-04:00,2021-08-17T11:20:13-04:00,32,,Centralization / Privilege,"Logical Issue,Centralization / Privilege","Mathematical Operations,Volatile Code,Centralization / Privilege","Logical Issue,Volatile Code,Gas Optimization,Centralization / Privilege"
Wanaka Farm,WANA,,unavailable,8/20/2021,Security Assessment,Solidity,2021-08-08T00:57:49-04:00,2021-08-20T22:31:06-04:00,6,,Centralization / Privilege,,,"Logical Issue,Coding Style"
Crypto Island,CISLA,,unavailable,9/11/2021,Security Assessment,Solidity,2021-09-01T04:51:42-04:00,2021-09-10T21:14:20-04:00,8,,"Centralization / Privilege,Logical Issue",Logical Issue,,"Coding Style,Control Flow,Logical Issue"
Miswap,MIS,,unavailable,7/28/2021,Security Assessment,Solidity,2021-07-26T22:50:12-07:00,2021-07-28T00:21:03-07:00,12,,Centralization / Privilege,"Volatile Code,Logical Issue",,"Language Specific,Gas Optimization,Coding Style,Logical Issue"
Bull Launch Pad,,,unavailable,9/26/2021,Security Assessment,Solidity,2021-08-28T21:32:05-04:00,2021-09-23T16:41:13-04:00,7,,Centralization / Privilege,Volatile Code,"Mathematical Operations,Logical Issue,Volatile Code",Volatile Code
Vexchange,,,unavailable,6/30/2021,Security Assessment,Solidity,2021-05-23T23:30:37-04:00,2021-06-24T07:27:13-04:00,7,,,Logical Issue,,"Gas Optimization,Coding Style,Logical Issue"
Wasabix Finance,WASABI,,"5,387,311",3/19/2021,Security Assessment,Solidity,2021-06-07T05:12:35-07:00,2021-06-28T12:40:51-07:00,40,,Centralization / Privilege,"Logical Issue,Control Flow,Inconsistency",Centralization / Privilege,"Coding Style,Logical Issue,Volatile Code"
Phantom Protocol,PHM,,unavailable,7/31/2021,Security Assessment,Solidity,2021-07-14T02:34:11-04:00,2021-07-31T07:27:58-04:00,20,,Centralization / Privilege,"Volatile Code,Centralization / Privilege,Logical Issue","Centralization / Privilege,Logical Issue","Volatile Code,Coding Style"
Boost Coin,,,unavailable,8/8/2021,Security Assessment,Solidity,2021-08-02T11:41:12-04:00,2021-08-07T12:58:01-04:00,12,,Centralization / Privilege,"Logical Issue,Control Flow,Volatile Code,Centralization / Privilege",,"Coding Style,Gas Optimization,Logical Issue"
Celestial,,,"2,737,645",10/2/2021,Security Assessment,Solidity,2021-09-19T11:25:02+08:00,2021-09-28T19:53:37+08:00,38,,Centralization / Privilege,"Volatile Code,Mathematical Operations",,"Language Specific,Logical Issue,Gas Optimization,Control Flow,Volatile Code,Coding Style"
SwampFinance,,86,unavailable,5/25/2021,Security Assessment,Solidity,2021-04-12T17:42:27-07:00,2021-05-25T06:27:17-07:00,33,Logical Issue,Logical Issue,"Centralization / Privilege,Volatile Code,Coding Style,Logical Issue,Gas Optimization,Mathematical Operations",,"Gas Optimization,Volatile Code,Logical Issue"
Concern Poverty Chain,CHY,,unavailable,7/8/2021,Security Assessment,Solidity,2021-07-05T13:26:51+08:00,2021-07-08T13:36:21+08:00,9,,,"Logical Issue,Centralization / Privilege",,"Language Specific,Logical Issue,Gas Optimization,Coding Style,Control Flow"
PearZap Finance,PEAR,,unavailable,8/8/2021,Security Assessment,Solidity,2021-07-11T22:46:20-04:00,2021-08-02T04:11:36-04:00,12,,Centralization / Privilege,"Centralization / Privilege,Logical Issue,Volatile Code","Logical Issue,Centralization / Privilege","Logical Issue,Gas Optimization"
KODI,KODI,,unavailable,11/1/2021,Security Assessment,Solidity,2021-10-17T09:00:27-07:00,2021-11-01T18:19:34-07:00,18,,"Centralization / Privilege,Logical Issue","Volatile Code,Control Flow,Logical Issue",Logical Issue,"Language Specific,Coding Style,Gas Optimization,Logical Issue"
Nested Finance,NST,,unavailable,7/17/2021,Security Assessment,Solidity,2021-06-07T16:25:06+02:00,2021-07-16T17:00:34+02:00,19,,,"Centralization / Privilege,Logical Issue","Logical Issue,Centralization / Privilege","Coding Style,Gas Optimization,Logical Issue"
Yeld Finance,,,"597,986",2/24/2021,Security Audit,Solidity,"Feburary 7, 2021","eburary 24, 2021",21,,L,"O,V,L",,"O,L,V"
EdenLoop,,,unavailable,9/2/2021,Security Assessment,Solidity,2021-08-20T15:26:17-04:00,2021-08-30T02:01:22-04:00,,,,,,
CakeCrypt,CAKECRYPT,,unavailable,3/23/2021,Security Audit,Solidity,"March 16, 2021","March 26, 2021",10,,O,L,,"O,D,L"
PolyAlpha Finance,ALPHA,,unavailable,9/3/2021,Security Assessment,Solidity,2021-08-30T13:05:26-04:00,2021-09-03T16:09:41-04:00,8,,,Logical Issue,Centralization / Privilege,"Logical Issue,Volatile Code,Gas Optimization"
SUPERDOGE,,,unavailable,5/31/2021,Security Assessment,Solidity,2021-05-05T00:55:49-04:00,2021-05-31T12:37:41-04:00,15,,Centralization / Privilege,"Logical Issue,Control Flow",,"Coding Style,Gas Optimization,Logical Issue"
ATM(Autonomous Trust Momentum),LUCA,,unavailable,10/12/2021,Security Assessment,Solidity,2021-10-08T13:02:32+08:00,2021-10-12T09:56:09+08:00,15,,"Centralization / Privilege,Logical Issue",Logical Issue,,"Logical Issue,Gas Optimization,Coding Style"
MoonEdge,MOONED,82,unavailable,7/11/2021,Security Assessment,Solidity,2021-06-15T13:44:36-07:00,2021-07-11T04:32:30-07:00,15,,"Logical Issue,Centralization / Privilege","Volatile Code,Mathematical Operations",,"Logical Issue,Gas Optimization,Coding Style"
PinkSale,PINKSALE,,unavailable,11/5/2021,Security Assessment,Solidity,2021-10-25T12:21:44-07:00,2021-11-04T11:57:42-07:00,6,,Centralization / Privilege,,Logical Issue,"Coding Style,Volatile Code,Logical Issue"
BUMooN,BUMN,,unavailable,9/1/2021,Security Assessment,Solidity,2021-08-30T01:02:49-04:00,2021-09-01T13:42:17-04:00,10,,Centralization / Privilege,"Volatile Code,Logical Issue",Logical Issue,"Gas Optimization,Logical Issue,Coding Style"
Carrot Token,CARROT,,unavailable,7/12/2021,Security Assessment,Solidity,2021-07-03T19:20:17+08:00,2021-07-12T15:00:04+08:00,13,,,"Gas Optimization,Logical Issue","Centralization / Privilege,Mathematical Operations","Coding Style,Logical Issue,Optimization"
Toy Doge Coin,TOYDOGE,,unavailable,8/3/2021,Security Assessment,Solidity,2021-07-27T03:03:16-04:00,2021-08-01T21:56:38-04:00,10,,Centralization / Privilege,"Logical Issue,Centralization / Privilege",,"Gas Optimization,Logical Issue,Coding Style,Language Specific"
EpicHero,EPICHERO,,unavailable,10/23/2021,Security Assessment,Solidity,2021-10-18T07:56:00-07:00,2021-10-22T18:35:57-07:00,20,Centralization / Privilege,,"Volatile Code,Gas Optimization,Logical Issue","Inconsistency,Logical Issue,Control Flow","Volatile Code,Gas Optimization,Logical Issue,Data Flow"
ICT Security Token,,,unavailable,5/18/2021,Security Assessment,Solidity,2021-05-18T22:48:58-04:00,2021-05-20T19:58:45-04:00,4,,,C,,G
YDragon,YDR,,unavailable,8/20/2021,Security Assessment,Solidity,2021-08-04T04:02:23-04:00,2021-08-20T04:02:29-04:00,10,,Centralization / Privilege,Volatile Code,,"Language Specific,Logical Issue,Coding Style,Gas Optimization"
Raze Network,RAZE,,unavailable,4/16/2021,Security Audit,Solidity,"April 12, 2021","April 15, 2021",1,,,,,G
Artex,ARTEX,,unavailable,10/5/2021,Security Assessment,Solidity,2021-08-24T12:06:14-04:00,2021-10-04T11:47:15-04:00,3,,Centralization / Privilege,,Centralization / Privilege,Gas Optimization
InfinitX,INX,,unavailable,11/9/2021,Security Assessment,Solidity,2021-10-28T23:59:28-07:00,2021-11-08T17:47:17-08:00,16,Language Specific,"Centralization / Privilege,Logical Issue","Inconsistency,Volatile Code","Coding Style,Control Flow","Gas Optimization,Coding Style"
Nexus Mutual,WNXM,,"1,214,626,323",12/14/2020,,,,,,,,,,
MakiSwap,,,unavailable,5/25/2021,Security Assessment,Solidity,2021-05-18T01:16:47-04:00,2021-05-26T00:12:08-04:00,,,,,,
Caramel Swap,MEL,,unavailable,8/20/2021,Security Assessment,Solidity,2021-07-24T09:15:49-04:00,2021-08-20T12:35:04-04:00,8,,"Logical Issue,Centralization / Privilege",Centralization / Privilege,,"Coding Style,Logical Issue,Volatile Code,Mathematical Operations,Inconsistency"
FraxFinance,"FRAX ,FXS",,"931,738,796",11/11/2020,Security Audit,"Solidity, Yul","October 11, 2020","November 6, 2020",39,I,I,I,,"I,O"
Bzzone,BZZONE,,unavailable,9/7/2021,Security Assessment,Solidity,2021-09-01T01:09:05-04:00,2021-09-07T01:10:44-04:00,7,,Centralization / Privilege,Logical Issue,,"Logical Issue,Gas Optimization"
NSURcoin,NSUR,,unavailable,10/31/2021,Security Assessment,Solidity,2021-09-11T17:51:11-04:00,2021-10-07T00:00:34-04:00,14,,Centralization / Privilege,"Logical Issue,Control Flow","Mathematical Operations,Logical Issue","Gas Optimization,Coding Style,Language Specific,Mathematical Operations,Logical Issue"
Tipsy,TIPSY,,unavailable,8/10/2021,Preliminary Comments,Solidity,2021-08-06T14:42:53-04:00,2021-08-10T15:39:23-04:00,3,,,,,"Gas Optimization,Coding Style,Language Specific"
Gelato,GEL,,unavailable,7/30/2021,Security Assessment,Solidity,2021-07-12T20:49:03-04:00,2021-07-22T22:27:28-04:00,10,,,"Centralization / Privilege,Logical Issue",Volatile Code,"Coding Style,Logical Issue"
Crypter,CRYPT,,unavailable,10/26/2021,Security Assessment,Solidity,2021-10-20T20:20:35-07:00,2021-10-26T22:36:37-07:00,17,Centralization / Privilege,Centralization / Privilege,"Volatile Code,Logical Issue,Coding Style",Logical Issue,"Data Flow,Volatile Code,Gas Optimization,Coding Style,Inconsistency"
FireDAO Protocol,FIRE ,,unavailable,2/8/2021,Security Audit,"Solidity, Yul","Feburary 04, 2021","Feburary 08, 2021",14,,,"O,V",,"L,O,C"
Carma Coin,CARMA,,unavailable,7/21/2021,Security Assessment,Solidity,2021-06-29T16:13:56-04:00,2021-07-21T14:52:45-04:00,16,,Centralization / Privilege,Logical Issue,Centralization / Privilege,"Logical Issue,Coding Style,Control Flow,Gas Optimization,Volatile Code,Mathematical Operations"
MoonDogeSwap,,,unavailable,7/5/2021,Security Assessment,Solidity,2021-06-06T22:25:50-04:00,2021-07-05T01:34:50-04:00,28,,"Volatile Code,Centralization / Privilege,Logical Issue","Logical Issue,Gas Optimization",Centralization / Privilege,"Logical Issue,Gas Optimization"
Anypad,APAD,,unavailable,7/14/2021,Security Assessment,Solidity,2021-07-03T09:09:18+08:00,2021-07-14T15:27:21+08:00,13,,Logical Issue,Logical Issue,,"Logical Issue,Gas Optimization"
BabyHusky,BabyHusky,,unavailable,7/6/2021,Security Assessment,Solidity,2021-07-05T13:12:42+08:00,2021-07-06T10:08:22+08:00,4,,,,,"Logical Issue,Coding Style,Gas Optimization"
YFBTC Protocol,yfbtc ,,unavailable,2/8/2021,Security Audit,"Solidity, Yul","January 20, 2021","Feburary 08, 2021",,,,,,
Footie+ Everything Football on Blockchain,Footie,,unavailable,7/2/2021,Security Assessment,Solidity,2021-06-30T09:20:31+08:00,2021-07-02T19:53:07+08:00,6,,Centralization / Privilege,"Centralization / Privilege,Logical Issue",,"Language Specific,Volatile Code,Logical Issue"
Four Leaf Clover,FLC,,unavailable,7/3/2021,Security Assessment,Solidity,2021-06-28T19:20:43+08:00,2021-07-03T13:02:53+08:00,11,,Centralization / Privilege,Volatile Code,,"Language Specific,Gas Optimization,Coding Style,Logical Issue"
Knit Finance,KFT,,unavailable,10/18/2021,Security Assessment,Solidity,2021-10-11T14:00:00+08:00,2021-10-18T11:25:39+08:00,2,,,Control Flow,,Language Specific
AntEx,ANTEX,,unavailable,8/16/2021,Security Assessment,Solidity,2021-08-14T04:07:27-04:00,2021-08-15T22:05:25-04:00,10,,"Centralization / Privilege,Logical Issue","Centralization / Privilege,Volatile Code",,"Language Specific,Gas Optimization,Coding Style"
BARREL,BARREL,,unavailable,7/27/2021,Security Assessment,Solidity,2021-07-21T21:20:02-04:00,2021-07-27T07:45:59-04:00,4,,,,Centralization / Privilege,Coding Style
NiftyPays,,,unavailable,6/29/2021,Security Assessment,Solidity,2021-06-21T09:20:28+08:00,2021-06-22T09:28:34+08:00,1,,,,,Gas Optimization
PantherSwap,PANTHER,,unavailable,6/13/2021,Security Assessment,Solidity,2021-05-28T19:11:21-04:00,2021-06-11T14:43:25-04:00,17,,,"Mathematical Operations,Inconsistency,Logical Issue","Volatile Code,Centralization / Privilege,Logical Issue","Coding Style,Gas Optimization,Logical Issue,Volatile Code,Mathematical Operations"
Sunrise Gaming,SUNC,,unavailable,11/10/2021,Security Assessment,Solidity,2021-08-03T08:43:59-07:00,2021-11-11T09:41:21-08:00,11,Centralization / Privilege,"Volatile Code,Centralization / Privilege","['Volatile Code', None, 'Logical Issue']",,Logical Issue
SafeMeme,SME,,unavailable,7/8/2021,Security Assessment,Solidity,2021-06-07T23:05:42+02:00,2021-07-09T05:26:13+02:00,8,,,,"Logical Issue,Centralization / Privilege","Coding Style,Gas Optimization,Logical Issue"
Alita Finance,ALI,,unavailable,8/4/2021,Security Assessment,Solidity,2021-07-25T19:32:08-07:00,2021-08-04T04:48:30-07:00,16,,Centralization / Privilege,"Logical Issue,Volatile Code,Coding Style","Centralization / Privilege,Logical Issue","Gas Optimization,Coding Style,Inconsistency,Logical Issue"
Pika Protocol,PKS,,unavailable,6/21/2021,Security Assessment,Solidity,2021-05-10T09:43:00-04:00,2021-06-14T21:29:51-04:00,12,,Centralization / Privilege,"Logical Issue,Volatile Code",,"Volatile Code,Gas Optimization,Mathematical Operations,Coding Style"
Fanatics Finance,,,unavailable,10/15/2021,Security Assessment,Solidity,2021-09-14T18:38:34+04:00,2021-10-15T21:37:01+04:00,11,,"Centralization / Privilege,Logical Issue","Volatile Code,Logical Issue","Logical Issue,Volatile Code","Logical Issue,Gas Optimization"
Metaminers,MNC,,unavailable,7/19/2021,Security Assessment,Solidity,2021-07-05T02:38:42-04:00,2021-07-19T01:25:40-04:00,15,,Logical Issue,Centralization / Privilege,Logical Issue,"Coding Style,Volatile Code,Gas Optimization,Control Flow,Data Flow"
Monfter,MON,,unavailable,6/24/2021,Security Assessment,Solidity,2021-06-22T14:05:24+08:00,2021-06-23T13:12:30+08:00,4,,,,,"Logical Issue,Gas Optimization,Magic Numbers"
PirateCoin,PIRATECOIN☠,,unavailable,10/28/2021,Security Assessment,Solidity,2021-10-21T02:04:03-07:00,2021-10-27T18:18:26-07:00,23,Logical Issue,"Logical Issue,Centralization / Privilege","Control Flow,Logical Issue,Volatile Code",Logical Issue,"Language Specific,Coding Style,Gas Optimization,Control Flow,Volatile Code,Logical Issue"
Metaverse Miner,META,,unavailable,9/8/2021,Security Assessment,Solidity,2021-09-02T00:18:47-07:00,2021-09-21T20:44:11-07:00,38,,"Volatile Code,Centralization / Privilege,Logical Issue","Volatile Code,Inconsistency,Logical Issue,Control Flow","Logical Issue,Gas Optimization","Optimization,Gas Optimization,Coding Style,Volatile Code,Logical Issue,Control Flow"
Chain,CHN,86,unavailable,11/7/2021,Security Assessment,Solidity,2021-11-05T10:50:49-07:00,2021-11-07T07:14:59-08:00,3,,Centralization / Privilege,,,Language Specific
Lizard,,,unavailable,7/14/2021,Security Assessment,Solidity,2021-06-30T20:15:01-07:00,2021-07-09T00:25:32-07:00,16,,Centralization / Privilege,"Logical Issue,Centralization / Privilege,Mathematical Operations",Centralization / Privilege,"Language Specific,Coding Style,Gas Optimization,Logical Issue"
Absorber,,,unavailable,3/19/2021,Security Audit,Solidity,"March 19, 2021","March 22, 2021",10,,O,,,"L,O,G"
CryptoArt.Ai,CART,,unavailable,8/2/2021,Security Assessment,Solidity,2021-05-26T07:13:09-04:00,2021-06-06T21:49:31-04:00,17,,,"Volatile Code,Centralization / Privilege",,"Language Specific,Gas Optimization,Coding Style,Logical Issue,Volatile Code"
PolkaEx,PKEX,,unavailable,9/23/2021,Security Assessment,Solidity,2021-07-20T17:18:09+08:00,2021-09-23T15:47:50+08:00,34,,"Logical Issue,Centralization / Privilege","Volatile Code,Language Specific,Control Flow,Logical Issue",,"Logical Issue,Inconsistency,Gas Optimization,Language Specific,Coding Style,Volatile Code"
GameDAO,GDT,,unavailable,8/11/2021,Security Assessment,Solidity,2021-07-17T01:07:20-04:00,2021-08-11T04:32:20-04:00,6,,Centralization / Privilege,,,"Logical Issue,Coding Style"
EarnBUSD,EarnBUSD,,unavailable,8/15/2021,Security Assessment,Solidity,2021-07-21T02:42:08-04:00,2021-08-15T11:47:03-04:00,15,,Centralization / Privilege,"Gas Optimization,Volatile Code,Logical Issue",Logical Issue,"Logical Issue,Volatile Code,Control Flow,Mathematical Operations"
SPACEY2025,SPAY,,unavailable,7/1/2021,Security Assessment,Solidity,2021-06-26T13:09:05+08:00,2021-07-01T10:50:41+08:00,8,,,"Volatile Code,Centralization / Privilege",,"Language Specific,Gas Optimization"
NanoDOGE,NANODOGE,,unavailable,7/15/2021,Security Assessment,Solidity,2021-07-11T22:19:11-07:00,2021-07-15T04:48:09-07:00,10,,,"Gas Optimization,Optimization,Centralization / Privilege,Control Flow","Centralization / Privilege,Logical Issue,Optimization","Gas Optimization,Coding Style"
CURE Token,CURE,,unavailable,11/4/2021,Security Assessment,Solidity,2021-10-29T00:16:10-07:00,2021-11-03T19:31:48-07:00,15,,Centralization / Privilege,"Logical Issue,Volatile Code","Coding Style,Centralization / Privilege","Control Flow,Gas Optimization,Volatile Code"
Retro World,RETRO,,unavailable,7/11/2021,Security Assessment,Solidity,2021-06-27T11:00:36-04:00,2021-07-13T00:15:18-04:00,12,,,"Logical Issue,Centralization / Privilege",,"Coding Style,Language Specific,Logical Issue"
Legend Fantasy War (LFW),LFW,,unavailable,8/11/2021,Security Assessment,Solidity,2021-08-06T02:21:43-04:00,2021-08-06T20:53:46-04:00,3,,Centralization / Privilege,Centralization / Privilege,,Volatile Code
Celery,,,unavailable,10/13/2021,Security Assessment,Solidity,2021-10-05T23:33:55+04:00,2021-10-14T23:36:32+04:00,11,,Centralization / Privilege,Volatile Code,,"Coding Style,Mathematical Operations"
ZOO - Crypto World,ZOO,,unavailable,8/8/2021,Security Audit,Solidity,2021-07-27T20:58:45-04:00,2021-07-28T20:58:45-04:00,17,,"Centralization / Privilege,Logical Issue,Volatile Code","Volatile Code,Control Flow,Coding Style,Logical Issue",,"Gas Optimization,Magic Numbers,Coding Style,Logical Issue"
ProjectMars,MARS,,unavailable,7/28/2021,Security Assessment,Solidity,2021-06-28T01:41:00-04:00,2021-08-20T14:54:59-04:00,14,,Centralization / Privilege,"Centralization / Privilege,Control Flow,Logical Issue",Logical Issue,"Logical Issue,Gas Optimization,Volatile Code,Coding Style,Control Flow"
Totem Finance,TOTEM,,unavailable,11/11/2021,Security Assessment,Solidity,2021-09-21T23:11:29-07:00,2021-11-10T17:29:46-08:00,16,,"Centralization / Privilege,Logical Issue","Volatile Code,Logical Issue",,"Gas Optimization,Coding Style,Logical Issue,Control Flow,Volatile Code"
TORG,,,unavailable,7/28/2021,Security Assessment,Solidity,2021-07-02T01:05:55-07:00,2021-07-28T08:49:57-07:00,8,,Centralization / Privilege,"Data Flow,Volatile Code",,"Gas Optimization,Volatile Code,Logical Issue"
FarmSpace,SPACE,83,unavailable,4/6/2021,,,,,,,,,,
DeHero,HEROS,,unavailable,7/13/2021,Security Assessment,Solidity,2021-04-20T10:31:56+08:00,2021-04-30T13:24:18+08:00,18,,"Centralization / Privilege,Logical Issue,Volatile Code",Logical Issue,,"Logical Issue,Optimization,Volatile Code,Mathematical Operations"
Lyra Finance,,,unavailable,8/22/2021,Security Assessment,Solidity,2021-07-30T15:07:02-04:00,2021-08-22T12:02:50-04:00,33,,Centralization / Privilege,"Logical Issue,Mathematical Operations,Volatile Code","Centralization / Privilege,Logical Issue","Language Specific,Logical Issue,Coding Style,Inconsistency,Mathematical Operations"
MiniShiba Inu,MINISHIBA,,unavailable,8/24/2021,Security Assessment,Solidity,2021-08-15T12:45:40-04:00,2021-08-24T01:14:56-04:00,13,Centralization / Privilege,Centralization / Privilege,"Control Flow,Logical Issue",,"Gas Optimization,Logical Issue,Coding Style"
No One,NOONE,,unavailable,10/30/2021,Security Audit,Solidity,2021-10-28T00:13:15-07:00,2021-10-29T00:13:15-07:00,17,,Centralization / Privilege,"Control Flow,Volatile Code",Logical Issue,"Language Specific,Coding Style,Volatile Code,Gas Optimization,Logical Issue"
XCarnival,XCV,,unavailable,10/29/2021,Security Assessment,Solidity,2021-09-23T09:16:51+08:00,2021-10-29T14:41:48+08:00,14,,"Centralization / Privilege,Logical Issue","Volatile Code,Logical Issue","Gas Optimization,Logical Issue,Volatile Code",Coding Style
Paycheck,,,unavailable,10/25/2021,Security Assessment,Solidity,2021-09-15T22:31:51-04:00,2021-10-26T22:00:18-04:00,13,,Centralization / Privilege,"Logical Issue,Volatile Code",,"Logical Issue,Mathematical Operations,Gas Optimization,Volatile Code,Coding Style"
NOEL FINANCE,NTFI,,unavailable,8/3/2021,Security Assessment,Solidity,2021-07-13T01:26:53-04:00,2021-07-29T07:47:42-04:00,7,,Centralization / Privilege,Logical Issue,Logical Issue,"Language Specific,Gas Optimization,Coding Style"
Rezerve,,,unavailable,8/9/2021,Security Assessment,Solidity,2021-07-22T22:23:14-07:00,2021-08-08T23:12:16-07:00,23,,Centralization / Privilege,"Logical Issue,Control Flow,Volatile Code","Logical Issue,Centralization / Privilege,Optimization","Coding Style,Gas Optimization,Logical Issue"
PAWZ,PAWS,,unavailable,8/10/2021,Security Assessment,Solidity,2021-07-31T12:08:49-04:00,2021-08-22T22:55:12-04:00,16,,"Centralization / Privilege,Logical Issue","Logical Issue,Control Flow,Volatile Code","Centralization / Privilege,Logical Issue","Coding Style,Volatile Code,Gas Optimization,Language Specific,Logical Issue"
PolyStarter,POLR,,unavailable,7/22/2021,Security Assessment,Solidity,2021-06-13T07:32:24-04:00,2021-07-22T14:23:32-04:00,28,,"Centralization / Privilege,Logical Issue","Volatile Code,Logical Issue,Centralization / Privilege",,"Logical Issue,Coding Style,Volatile Code"
Tower Finance,,,unavailable,10/6/2021,Security Assessment,Solidity,2021-08-30T12:30:35-04:00,2021-10-06T16:40:15-04:00,58,"Logical Issue,Centralization / Privilege","Centralization / Privilege,Logical Issue","Logical Issue,Volatile Code",Logical Issue,"Logical Issue,Language Specific,Coding Style,Volatile Code"
Sunder Protocol,Sunder,,unavailable,8/13/2021,Security Assessment,Solidity,2021-07-22T21:59:05-04:00,2021-08-12T07:39:40-04:00,18,,Centralization / Privilege,"Volatile Code,Logical Issue",Logical Issue,"Language Specific,Gas Optimization"
Chihiro Inu,CHIRO,83,unavailable,11/5/2021,,,,,,,,,,
Wolverine,WLVR,82,unavailable,11/7/2021,,,,,,,,,,
WOOFi Swap,WOO,,"873,323,023",10/25/2021,Security Assessment,Solidity,2021-09-13T15:59:16+08:00,2021-10-25T11:52:56+08:00,10,,Centralization / Privilege,Logical Issue,,"Language Specific,Coding Style,Logical Issue"
Conjure,,,unavailable,6/13/2021,Security Assessment,Solidity,2021-05-28T21:03:42-04:00,2021-06-09T21:06:46-04:00,14,,"L,C",L,,"L,G,C"
Sonar,PING,,"23,140,511",10/9/2021,Security Assessment,Solidity,2021-10-08T18:40:04+08:00,2021-10-09T11:33:57+08:00,14,,Centralization / Privilege,Volatile Code,,"Language Specific,Volatile Code,Gas Optimization,Coding Style"
EUR+,,,unavailable,11/2/2021,Security Assessment,Solidity,2021-09-13T14:43:26-04:00,2021-10-30T00:13:49-04:00,25,"Logical Issue,Control Flow,Volatile Code",Centralization / Privilege,Logical Issue,Mathematical Operations,"Language Specific,Coding Style,Logical Issue,Gas Optimization"
OIN Finance,OIN,,"11,072,954",11/4/2021,Security Assessment,Solidity,2021-09-07T11:21:23+08:00,2021-11-04T22:35:41+08:00,10,,"Centralization / Privilege,Logical Issue","Mathematical Operations,Data Flow",,"Language Specific,Mathematical Operations,Logical Issue,Volatile Code"
Radar,RADAR,,unavailable,9/30/2021,Security Assessment,Solidity,2021-09-23T19:11:00+08:00,2021-09-30T09:07:36+08:00,9,,Centralization / Privilege,,,"Gas Optimization,Coding Style,Language Specific"
DeepGo,DGT,,unavailable,9/2/2021,Security Assessment,Solidity,2021-08-05T19:32:35-07:00,2021-09-02T19:57:23-07:00,20,,"Centralization / Privilege,Logical Issue","Logical Issue,Mathematical Operations,Centralization / Privilege",Logical Issue,"Coding Style,Logical Issue,Gas Optimization"
Riochain,RFUEL,84,unavailable,7/15/2020,Smart Contracts & Token,Rust,"May 15, 2020","July 15, 2020",,,,,,
5ROI-Global,ROI,,unavailable,10/28/2021,Security Assessment,Solidity,2021-10-25T14:53:59+08:00,2021-10-28T16:36:59+08:00,2,,,Mathematical Operations,Control Flow,
Kitty Inu,KITTY,89,unavailable,10/29/2021,,,,,,,,,,
Mandala,,,unavailable,11/10/2020,Security Audit,"Solidity, Yul","November 5, 2020","November 10, 2020",,,,,,
Animoca,,83,unavailable,10/24/2020,Smart Contracts & Token,Solidity,"May 5, 2020","August 20, 2020",,,,,,
O3 Swap,O3,,"52,107,561",5/12/2021,Security Assessment,Solidity,2021-05-10T13:58:23+08:00,2021-05-12T16:13:58+08:00,7,Logical Issue,Centralization / Privilege,Mathematical Operations,,Volatile Code
BitGuru,,,unavailable,5/10/2021,Smart Contract,Solidity,"May 07, 2021","May 07, 2021",,,,,,
Baldi Finance,,,unavailable,5/6/2021,Security Assessment,Solidity,2021-04-29T20:00:00,2021-05-01T20:00:00,,,,,,
DeChart,DCH,,unavailable,5/6/2021,Security Assessment,Solidity,2021-04-27T20:00:00,2021-05-06T20:00:00,,,,,,
Better,,,unavailable,7/3/2021,Security Assessment,Solidity,2021-06-21T15:42:12+08:00,2021-07-03T10:00:09+08:00,26,"Volatile Code,Centralization / Privilege,Logical Issue","Logical Issue,Volatile Code","Control Flow,Centralization / Privilege,Logical Issue,Mathematical Operations",Logical Issue,"Gas Optimization,Language Specific,Volatile Code"
Hackerlink,,,unavailable,1/20/2021,Smart Contract,Solidity,"March 16, 2021","March 18, 2021",,,,,,
Zild Finance,ZILD,,unavailable,5/6/2021,Security Assessment,Solidity,2021-04-19T20:00:00,2021-05-01T20:00:00,,,,,,
CompliFi,,,unavailable,11/11/2020,Security Audit,"Solidity, Yul","March 10, 2021 ","March 23, 2021",,,,,,
YFX,,,unavailable,1/25/2021,Security Audit,Solidity,"January 01, 2021","April 20, 2021",,,,,,
AGPC,AGPC,,unavailable,5/6/2021,Security Assessment,Solidity,2021-05-06T20:00:00,2021-05-06T20:00:00,,,,,,
Core MultiChain,CMCX,87,unavailable,5/10/2021,Security Assessment,"Solidity,Yul",2021-03-16T20:00:00,2021-05-10T20:00:00,,,,,,
Sacred Finance,,,unavailable,5/6/2021,Security Assessment,Solidity,2021-04-26T20:00:00,2021-05-06T20:00:00,,,,,,
Biswap,,88,unavailable,6/10/2021,Security Assessment,Solidity,2021-04-22T09:08:28-04:00,2021-06-09T13:03:41-04:00,10,,,"Logical Issue,Centralization/Privilege","Logical Issue,Volatile Code","Logical Issue,Gas Optimization"
Guru,,,unavailable,1/6/2020,Security Audit,Solidity,"December 16, 2020","December 18, 2020",,,,,,
Tristers Light Minter,,,unavailable,11/9/2020,Smart Contract,Solidity,"November 3, 2020","November 6, 2020",,,,,,
NEXTYPE Finance,NT,,unavailable,9/29/2021,Security Assessment,Solidity,2021-09-18T13:51:29+08:00,2021-09-29T15:06:03+08:00,9,,Centralization / Privilege,"Language Specific,Logical Issue,Coding Style,Mathematical Operations",Logical Issue,
Shiba BSC,"SHIB,LEASH,BONE",,unavailable,5/12/2021,Smart Contract,Solidity,"May 11, 2021","May 11, 2021",,,,,,
Sperax,SPA,,unavailable,10/27/2021,Security Assessment,Solidity,2021-06-26T10:05:37+08:00,2021-10-27T10:44:59+08:00,5,,Logical Issue,,"Control Flow,Logical Issue","Gas Optimization,Coding Style"
AladdinDAO,ALD,,unavailable,10/11/2021,Security Assessment,Solidity,2021-10-03T14:13:30+08:00,2021-10-11T11:11:45+08:00,4,,Centralization / Privilege,Logical Issue,Logical Issue,Logical Issue
Mulan Finance,,,unavailable,4/22/2021,Security Assessment,Solidity,2021-05-02T14:47:59+08:00,2021-05-20T15:46:42+08:00,4,,,Logical Issue,,"Optimization,Mathematical Operations,Logical Issue"
iMe Lab,LIME,,unavailable,5/21/2021,Security Assessment,Solidity,2021-05-14T11:30:56-04:00,2021-05-21T11:45:52-04:00,2,,Centralization / Privilege,,Centralization / Privilege,
Lever,,,unavailable,4/26/2021,Security Assessment,Solidity,"April 21, 2021","April 26, 2021",,,,,,
FinBet,,,unavailable,5/24/2021,Security Assessment,Solidity,2021-05-14T15:27:37+08:00,2021-05-18T17:25:40+08:00,2,,,,,"Volatile Code,Optimization"
HTMOON,,,unavailable,5/14/2021,Smart Contract,Solidity,"May 13, 2021","May 13, 2021",,,,,,
HUMANnft,,,unavailable,5/21/2021,Security Assessment,Solidity,2021-07-13T01:38:55-04:00,2021-07-26T01:43:30-04:00,7,,"Logical Issue,Centralization / Privilege",Centralization / Privilege,Logical Issue,Gas Optimization
TrustFi Network,,,unavailable,5/15/2021,Security Assessment,Solidity,2021-07-30T07:00:59-04:00,2021-08-09T04:00:16-04:00,7,,,Logical Issue,,"Language Specific,Logical Issue,Coding Style"
Dark Horse Derivatives(DHD),,,unavailable,9/13/2021,Security Assessment,Solidity,2021-09-09T16:33:39+08:00,2021-09-13T09:37:34+08:00,16,,"Coding Style,Centralization / Privilege","Volatile Code,Logical Issue",Logical Issue,"Gas Optimization,Logical Issue,Volatile Code,Coding Style"
AppleB,APPLEB,,unavailable,5/27/2021,Smart Contract,Solidity,2021-05-18T20:00:00,2021-05-24T20:00:00,,,,,,
Bring,,,unavailable,2/8/2021,Smart Contract,Solidity,"February 5, 2021","February 6, 2021",,,,,,
CyberStop NFTs Marketplace,,,unavailable,5/6/2021,Security Assessment,Solidity,2021-04-14T20:00:00,2021-05-06T20:00:00,,,,,,
Bunny Park,,,unavailable,7/30/2021,Security Assessment,Solidity,2021-05-23T20:39:37-07:00,2021-07-29T18:24:11-07:00,30,"Logical Issue,Control Flow",Centralization / Privilege,"Logical Issue,Gas Optimization,Inconsistency","Centralization / Privilege,Logical Issue","Logical Issue,Coding Style,Gas Optimization"
Samecoin,,,unavailable,6/7/2021,Smart Contract,Solidity,"June 04, 2021","June 07, 2021",,,,,,
WardenSwap,WAD,,unavailable,5/7/2021,Security Assessment,"Solidity,Yul",2021-04-23T20:00:00,2021-05-07T20:00:00,,,,,,
CheeseSwap,chs,,unavailable,3/8/2021,Security Audit,Solidity,"March 08, 2021","March 23, 2021",1,,,L,,
Enft.one,EMJ,,unavailable,5/7/2021,Security Assessment,Solidity,2021-04-29T09:54:37+08:00,2021-05-07T17:56:47+08:00,9,,"Centralization / Privilege,Logical Issue",,,"Optimization,Volatile Code,Mathematical Operations"
YF Vaults,ASKO,,unavailable,4/17/2021,Security Assessment,Solidity,2021-03-30T20:00:00,2021-04-17T20:00:00,,,,,,
Gemstones Finance,GMS,,unavailable,6/16/2021,Security Assessment,Solidity,2021-06-08T14:33:43+08:00,2021-06-13T10:02:47+08:00,13,,Control Flow,Logical Issue,,"Coding Style,Logical Issue,Gas Optimization"
CellETF,,,unavailable,5/14/2021,Smart Contract,Solidity,"May 14, 2021","May 14, 2021",,,,,,
OpenLeverage Protocol,OLE,,unavailable,5/12/2021,Security Assessment,Solidity,2021-05-24T10:24:58+08:00,2021-06-24T15:54:52+08:00,26,,Logical Issue,Logical Issue,,"Gas Optimization,Coding Style,Logical Issue,Mathematical Operations"
WhiteX,WHX,,unavailable,9/8/2021,Security Assessment,Solidity,2021-09-01T19:20:37-04:00,2021-09-08T01:55:44-04:00,4,,,Centralization / Privilege,,"Coding Style,Language Specific"
Cash Flow,,,unavailable,5/11/2021,Smart Contract,Solidity,"May 11, 2021","May 11, 2021",,,,,,
OMS,,,unavailable,4/20/2021,Security Assessment,"Solidity,Yul",2021-04-05T20:00:00,2021-04-20T20:00:00,,,,,,
Vee Finance,,,unavailable,5/15/2021,Smart Contract,Solidity,"May 26, 2021","May 26, 2021",,,,,,
PuddingSwap,,,unavailable,5/12/2021,Smart Contract,Solidity,"May 11, 2021","May 11, 2021",,,,,,
Biconomy,,,unavailable,3/17/2021,Security Assessment,"Solidity,Yul",2021-02-16T20:00:00,2021-03-17T20:00:00,,,,,,
SMars,,,unavailable,5/19/2021,Security Assessment,Solidity,2021-05-16T19:08:17-07:00,2021-05-19T01:29:24-07:00,12,,"Logical Issue,Centralization / Privilege","Logical Issue,Control Flow,Centralization / Privilege",,"Coding Style,Volatile Code,Logical Issue,Gas Optimization,Control Flow"
Kyoko.finance,,,unavailable,9/9/2021,Security Assessment,Solidity,2021-05-17T23:45:07+08:00,2021-06-09T18:59:06+08:00,11,,Centralization / Privilege,"Mathematical Operations,Centralization / Privilege,Logical Issue",,"Logical Issue,Gas Optimization"
Pureswap,,,unavailable,4/27/2021,Smart Contract,Solidity,"April 27, 2021","April 27, 2021",,,,,,
Pocket Arena,,,unavailable,7/7/2021,Security Assessment,Solidity,2021-05-09T04:46:11-07:00,2021-07-01T18:57:55-07:00,9,,Logical Issue,"Logical Issue,Volatile Code,Centralization / Privilege",,"Gas Optimization,Language Specific,Volatile Code"
PandaSwap,PND,,unavailable,5/2/2021,Security Assessment,Solidity,2021-08-10T01:10:58-04:00,2021-08-11T05:52:25-04:00,16,,"Centralization / Privilege,Logical Issue","Logical Issue,Volatile Code",,"Gas Optimization,Language Specific,Logical Issue"
Moma Finance,,,unavailable,5/18/2021,Smart Contract,Solidity,"May 19, 2021"," May 19, 2021",,,,,,
Papaya Swap,,,unavailable,5/11/2021,Smart Contract,Solidity,"May 10, 2021","May 10, 2021",,,,,,
Leopard,,84,unavailable,6/9/2021,Security Assessment,Solidity,2021-06-07T06:21:57-04:00,2021-06-09T07:20:23-04:00,4,,Logical Issue,Logical Issue,,"Logical Issue,Language Specific"
SpiralX,,,unavailable,8/3/2021,Security Assessment,Solidity,2021-04-06T04:03:03-07:00,2021-08-03T00:58:07-07:00,21,,"Centralization / Privilege,Compiler Error,Control Flow,Data Flow",Logical Issue,,"Language Specific,Coding Style,Gas Optimization"
Popsicle Finance,ICE,,unavailable,5/5/2021,Security Audit,"Solidity, Yul",2021-04-08T14:24:00Z,2021-05-05T14:24:00Z,,,,,,
OCTANS,OCTA,87,"5,246,290",6/7/2021,Security Assessment,Solidity,2021-05-12T09:08:28-04:00,2021-06-09T13:03:41-04:00,12,,Centralization/Privilege,"Logical Issue,Control Flow,Centralization/Privilege",Logical Issue,"Logical Issue,Gas Optimization,Coding Style"
ChainWallet,,,unavailable,6/18/2021,Security Assessment,Solidity,2021-06-08T09:35:01+08:00,2021-06-17T09:46:28+08:00,22,,Volatile Code,"Logical Issue,Centralization / Privilege,Volatile Code",,"Language Specific,Gas Optimization,Coding Style,Logical Issue"
FarmHero,HERO,84,unavailable,6/9/2021,Security Assessment,Solidity,2021-05-31T22:56:31-04:00,2021-06-09T22:03:20-04:00,22,,"Logical Issue,Volatile Code","Volatile Code,Logical Issue","Centralization / Privilege,Logical Issue","Gas Optimization,Volatile Code,Logical Issue"
San Guo,,,unavailable,5/14/2021,Smart Contract,Solidity,2021-05-07T20:00:00Z," May 14, 2021",,,,,,
Hakuna Matata,HKUN,87,unavailable,9/3/2021,Security Assessment,Solidity,2021-07-28T12:50:55-07:00,2021-09-22T12:57:11-07:00,10,"Data Flow,Logical Issue","Centralization / Privilege,Logical Issue",Logical Issue,Logical Issue,"Language Specific,Gas Optimization"
Universal Protocol,UPT,,unavailable,2/10/2021,Security Audit,"Solidity, Yul","November 17, 2020","December 22, 2020",,,,,,
Club Token,CLUB,,unavailable,6/18/2021,Security Assessment,Solidity,2021-06-16T14:24:11+08:00,2021-06-17T14:31:35+08:00,3,,,Centralization / Privilege,,"Language Specific,Volatile Code"
KindlyCoin,,84,unavailable,8/26/2021,Security Assessment,Solidity,2021-07-14T22:04:11-04:00,2021-08-26T01:26:29-04:00,14,,,"Inconsistency,Logical Issue",Centralization / Privilege,"Logical Issue,Coding Style,Gas Optimization,Control Flow"
Orange Cat Token,Ocat,,unavailable,6/18/2021,Security Assessment,Solidity,2021-06-16T10:54:27+08:00,2021-06-16T11:24:00+08:00,0,,,,,
Sukhavati Network Token,skt,,unavailable,6/16/2021,Security Assessment,Solidity,2021-06-16T14:23:33+08:00,2021-06-16T15:01:48+08:00,0,,,,,
DREAMR,DMR,,unavailable,5/24/2021,Security Assessment,Solidity,2021-05-20T09:08:28-04:00,2021-05-24T13:03:41-04:00,10,,,"Volatile Code,Logical Issue",Logical Issue,"Language Specific,Gas Optimization,Coding Style"
Rangers Protocol,RPG,,unavailable,10/4/2021,Security Assessment,Solidity,2021-10-04T10:19:43+08:00,2021-10-04T12:05:02+08:00,8,,Centralization / Privilege,"Volatile Code,Logical Issue",,"Coding Style,Language Specific"
CoPuppy,,,unavailable,6/18/2021,Security Assessment,Solidity,2021-07-21T22:58:51-07:00,2021-07-29T22:51:48-07:00,9,,,"Centralization / Privilege,Logical Issue",,"Coding Style,Logical Issue"
4JNET Technology Limited,4JNET,,unavailable,10/18/2021,Security Assessment,Solidity,2021-09-03T17:24:15+08:00,2021-10-18T14:48:46+08:00,8,,Centralization / Privilege,"Logical Issue,Control Flow",,"Coding Style,Gas Optimization,Logical Issue"
Whale Fall,WHALE,,unavailable,6/18/2021,Security Assessment,Solidity,2021-06-11T15:23:28+08:00,2021-06-18T09:38:36+08:00,12,,,"Control Flow,Centralization / Privilege,Logical Issue","Logical Issue,Centralization / Privilege","Control Flow,Gas Optimization,Coding Style,Volatile Code,Logical Issue"
PlanckX,PlanckX,,unavailable,10/12/2021,Security Assessment,Solidity,2021-10-02T13:46:53+08:00,2021-10-12T11:25:35+08:00,17,,Centralization / Privilege,Logical Issue,Volatile Code,"Language Specific,Coding Style,Logical Issue,Gas Optimization,Inconsistency"
NIO,,,unavailable,6/19/2021,Security Assessment,Solidity,2021-06-17T17:06:44+08:00,2021-06-18T19:48:33+08:00,15,,Centralization / Privilege,"Control Flow,Volatile Code,Centralization / Privilege",Logical Issue,"Language Specific,Gas Optimization,Coding Style,Control Flow,Volatile Code"
Highstreet Market,,,unavailable,6/18/2021,Security Assessment,Solidity,2021-06-03T11:47:04+08:00,2021-06-15T13:07:15+08:00,16,,Logical Issue,Logical Issue,,"Gas Optimization,Logical Issue,Coding Style"
DeFi11,,,unavailable,6/20/2021,Security Assessment,Solidity,2021-06-15T09:05:38+08:00,2021-06-15T09:32:35+08:00,0,,,,,
Bwitter,BT,,unavailable,10/21/2021,Security Assessment,Solidity,2021-10-19T15:41:43+08:00,2021-10-21T14:31:42+08:00,5,,"Centralization / Privilege,Logical Issue",Volatile Code,,Gas Optimization
NFTA,,,unavailable,5/1/2020,Security Assessment,Solidity,2021-04-28T20:30:00,2021-04-28T20:30:00,,,,,,
BullRock Swap,BLRS,,unavailable,8/26/2021,Security Assessment,Solidity,2021-08-09T08:30:11-07:00,2021-08-26T11:05:05-07:00,11,Centralization / Privilege,Centralization / Privilege,"Volatile Code,Inconsistency,Logical Issue",Volatile Code,"Coding Style,Language Specific,Gas Optimization"
BakerDAO,,,unavailable,6/19/2021,Security Assessment,Solidity,2021-06-02T23:48:46+08:00,2021-06-19T03:26:36+08:00,10,,,"Logical Issue,Mathematical Operations",,"Gas Optimization,Logical Issue"
Hare Token,HARE,,unavailable,6/24/2021,Security Assessment,Solidity,2021-06-22T17:31:54+08:00,2021-06-24T13:53:58+08:00,13,,"Centralization / Privilege,Logical Issue","Logical Issue,Control Flow,Centralization / Privilege",,"Coding Style,Control Flow,Logical Issue,Gas Optimization,Volatile Code"
GrowingFi,GROW,,unavailable,7/11/2021,Security Assessment,Solidity,2021-05-31T07:20:21-07:00,2021-07-08T15:29:35-07:00,12,,,"Volatile Code,Centralization / Privilege,Logical Issue",Volatile Code,"Gas Optimization,Coding Style"
Fans Force,FFN,,unavailable,7/12/2021,Security Assessment,Solidity,2021-07-08T13:09:47+08:00,2021-07-10T19:55:48+08:00,7,,,Logical Issue,,"Logical Issue,Optimization,Gas Optimization,Centralization / Privilege"
ExzoCoin,EXZO,,unavailable,6/7/2021,Security Assessment,Solidity,2021-05-24T12:05:01-04:00,2021-06-07T10:56:03-04:00,7,,Volatile Code,"Logical Issue,Mathematical Operations,Volatile Code,Centralization / Privilege",,"Language Specific,Gas Optimization"
DINA,DINA,,unavailable,6/7/2021,Smart Contract,Solidity,"June 05, 2021","June 07, 2021",,,,,,
Crypto Puffs,PUFF,,unavailable,8/12/2021,Security Assessment,Solidity,2021-08-09T13:57:18-07:00,2021-08-12T13:14:09-07:00,6,,Centralization / Privilege,"Mathematical Operations,Logical Issue,Volatile Code",,Gas Optimization
YetuSwap,YETU,,unavailable,7/13/2021,Security Assessment,Solidity,2021-06-22T18:18:56-04:00,2021-07-13T10:22:59-04:00,15,Logical Issue,"Volatile Code,Centralization / Privilege","Centralization / Privilege,Logical Issue,Volatile Code",Centralization / Privilege,"Language Specific,Gas Optimization,Volatile Code,Control Flow"
Buba(BBC)Coin,BBC,,unavailable,6/25/2021,Security Assessment,Solidity,2021-06-23T17:39:51+08:00,2021-06-25T15:56:02+08:00,7,,,,,"Language Specific,Gas Optimization"
OMNI,OMNI,,unavailable,7/13/2021,Security Assessment,Solidity,2021-07-01T10:29:20-04:00,2021-07-13T06:15:09-04:00,35,,,"Logical Issue,Volatile Code",,"Volatile Code,Language Specific,Centralization / Privilege,Inconsistency,Gas Optimization,Coding Style"
KokomoSwap,,,unavailable,5/26/2021,Security Assessment,Solidity,2021-05-18T11:20:35-04:00,2021-05-26T15:40:20-04:00,9,,Volatile Code,Logical Issue,,"Coding Style,Gas Optimization,Logical Issue,Control Flow"
Daily Quest,Quest,,unavailable,6/28/2021,Security Assessment,Solidity,2021-06-28T08:03:05-07:00,2021-06-28T19:06:29-07:00,7,,,"Gas Optimization,Volatile Code,Logical Issue,Centralization / Privilege",,Coding Style
Magic Academy,TPOS,,unavailable,11/3/2021,Security Assessment,Solidity,2021-10-29T13:39:18+08:00,2021-11-03T13:40:37+08:00,22,,"Centralization / Privilege,Logical Issue","Logical Issue,Volatile Code",Logical Issue,"Language Specific,Gas Optimization,Coding Style,Control Flow,Logical Issue"
PolkaCity,POLC,,unavailable,5/19/2021,Security Assessment,"Solidity,Yul",2021-05-11T21:23:00-04:00,2021-05-18T21:23:00-04:00,29,,Volatile Code,"Volatile Code,Control Flow,Dead Code,Logical Issue,Language Specific",Control Flow,"Language Specific,Coding Style,Gas Optimization"
Dragon Knight,DK,,unavailable,11/6/2021,Security Assessment,Solidity,2021-10-27T10:37:26+08:00,2021-11-06T17:05:22+08:00,2,,Centralization / Privilege,,Centralization / Privilege,
Daoswap,DAO,,unavailable,10/19/2021,Security Assessment,Solidity,2021-10-06T13:10:35+08:00,2021-10-19T13:03:59+08:00,6,,Centralization / Privilege,,,"Volatile Code,Coding Style,Language Specific"
PeacockCoin,PEKC,,unavailable,6/10/2021,Security Assessment,Solidity,2021-05-10T14:26:26-04:00,2021-06-10T07:49:57-04:00,2,,,Mathematical Operations,,Language Specific
hi.com,HI,,unavailable,7/27/2021,Security Assessment,Solidity,2021-07-23T11:00:43-04:00,2021-07-27T04:49:32-04:00,21,,Logical Issue,"Logical Issue,Language Specific",Logical Issue,"Coding Style,Language Specific,Gas Optimization,Inconsistency"
STAND,STDC,,unavailable,5/19/2021,Security Assessment,Solidity,2021-05-18T09:05:52-04:00,2021-05-19T09:12:47-04:00,2,,,,,"Language Specific,Gas Optimization"
Spores Network,,,unavailable,7/23/2021,Security Assessment,Solidity,2021-07-12T14:36:45-04:00,2021-07-23T10:45:03-04:00,27,,,"Volatile Code,Logical Issue,Centralization / Privilege",Mathematical Operations,"Language Specific,Gas Optimization,Coding Style,Logical Issue,Mathematical Operations,Volatile Code"
Universe Protocol,UP,,unavailable,6/7/2021,Smart Contract,Solidity,"May 24, 2021","June 07, 2021",,,,,,
OxySwap,OXS,,unavailable,6/29/2021,Security Assessment,Solidity,2021-06-23T10:51:17+08:00,2021-06-30T10:45:03+08:00,10,,,Logical Issue,,"Language Specific,Gas Optimization,Inconsistency"
Volmex,,,unavailable,5/21/2021,Security Assessment,"Solidity,Yul",2021-05-01T20:00:00,2021-05-21T20:00:00,,,,,,
Dopple Finance,DOP,,unavailable,6/11/2021,Security Assessment,Solidity,2021-05-12T23:20:09-04:00,2021-06-11T04:01:46-04:00,32,Logical Issue,Logical Issue,"Logical Issue,Volatile Code",,"Language Specific,Gas Optimization,Volatile Code,Logical Issue,Coding Style"
Tranchess Protocol,CHESS,,unavailable,6/15/2021,Security Assessment,Solidity,2021-03-22T09:08:28-04:00,2021-06-02T13:03:41-04:00,26,,"Centralization/Privilege,Logical Issue","Mathematical Operations,Logical Issue",Mathematical Operations,"Language Specific,Logical Issue,Gas Optimization"
Ops,,,unavailable,6/25/2021,Security Assessment,Solidity,2021-06-09T03:15:13+08:00,2021-06-24T21:19:59+08:00,11,,"Centralization / Privilege,Volatile Code,Logical Issue",Logical Issue,,"Gas Optimization,Volatile Code,Logical Issue"
MoonPump,PUMP,,unavailable,7/2/2021,Security Assessment,Solidity,2021-06-18T13:00:28-07:00,2021-07-01T20:07:05-07:00,8,,Centralization / Privilege,"Logical Issue,Control Flow",,"Logical Issue,Language Specific,Gas Optimization,Control Flow"
Legend,,,unavailable,6/7/2021,Smart Contract,Solidity,"June 05, 2021","June 06, 2021",,,,,,
Second Block,Second Block,,unavailable,6/21/2021,Security Assessment,Solidity,2021-06-17T14:25:14+08:00,2021-06-21T13:12:14+08:00,11,Volatile Code,"Logical Issue,Centralization / Privilege,Volatile Code","Centralization / Privilege,Logical Issue",Logical Issue,"Mathematical Operations,Volatile Code,Logical Issue"
HashLand,HASHLAND COIN,,unavailable,11/3/2021,Security Assessment,Solidity,2021-10-26T10:59:19+08:00,2021-11-03T15:17:15+08:00,30,,Centralization / Privilege,"Volatile Code,Logical Issue","Centralization / Privilege,Logical Issue","Data Flow,Volatile Code,Coding Style,Logical Issue"
UNXD,,,unavailable,9/22/2021,Security Assessment,Solidity,2021-09-12T01:44:55-04:00,2021-09-15T21:35:53-04:00,8,,"Logical Issue,Centralization / Privilege",Volatile Code,,"Gas Optimization,Volatile Code,Coding Style"
Copycat Finance,COPY,,unavailable,9/20/2021,Security Assessment,Solidity,2021-08-02T23:13:31-04:00,2021-09-20T12:01:21-04:00,25,Logical Issue,"Logical Issue,Centralization / Privilege",Logical Issue,Logical Issue,"Coding Style,Gas Optimization,Volatile Code"
YoHero,YO,,unavailable,10/3/2021,Preliminary Comments,Solidity,2021-09-27T18:01:18+08:00,2021-10-02T14:47:02+08:00,8,,Centralization / Privilege,Logical Issue,Logical Issue,Coding Style
Neko Network of Maze Protocol,NEKO,,unavailable,8/6/2021,Security Assessment,Solidity,2021-06-21T23:12:36-04:00,2021-08-05T21:15:35-04:00,23,,"Centralization / Privilege,Logical Issue,Volatile Code","Logical Issue,Centralization / Privilege,Control Flow",,"Language Specific,Gas Optimization,Logical Issue"
JAM Finance,JAM,,unavailable,7/12/2021,Security Assessment,Solidity,2021-06-24T20:15:26-07:00,2021-07-18T22:47:14-07:00,19,,"Centralization / Privilege,Logical Issue","Gas Optimization,Volatile Code,Logical Issue",,"Control Flow,Coding Style,Gas Optimization"
Wuxian.io,WWIN,,unavailable,6/14/2021,Security Assessment,Solidity,2021-06-07T18:07:33-04:00,2021-06-14T14:48:39-04:00,,,,,,
Punk Vision,,,unavailable,7/21/2021,Security Assessment,Solidity,2021-06-15T21:23:25-04:00,2021-07-19T01:47:43-04:00,15,,Logical Issue,"Volatile Code,Mathematical Operations,Logical Issue,Centralization / Privilege",,"Language Specific,Gas Optimization,Coding Style"
RewardsBunny,RBunny,82,unavailable,8/10/2021,Security Assessment,Solidity,2021-07-28T01:36:42-04:00,2021-08-10T16:44:00-04:00,15,Centralization / Privilege,Centralization / Privilege,"Logical Issue,Control Flow",Logical Issue,"Logical Issue,Coding Style,Volatile Code,Gas Optimization"
SheepDex,SPC,,unavailable,9/22/2021,Security Assessment,Solidity,2021-08-03T09:42:59+08:00,2021-10-09T18:52:03+08:00,58,Logical Issue,"Centralization / Privilege,Logical Issue","Volatile Code,Logical Issue","Volatile Code,Logical Issue","['Gas Optimization', 'Volatile Code', 'Logical Issue', 'Mathematical Operations', 'Coding Style', None]"
KING SHIBA,KINGSHIB,84,"32,991,355",11/3/2021,,,,,,,,,,
TechToken,TCN,,unavailable,5/20/2021,Security Assessment,Solidity,2021-05-17T10:52:14-04:00,2021-05-20T13:13:17-04:00,4,,,,,"Language Specific,Volatile Code,Logical Issue"
stakewith.us,,,unavailable,7/23/2021,Security Assessment,"Solidity,Vyper",2021-07-08T09:00:17-04:00,2021-08-06T18:49:25-04:00,42,,,"Volatile Code,Centralization / Privilege,Logical Issue",,"Inconsistency,Centralization / Privilege,Volatile Code,Coding Style,Gas Optimization"
Bitspawn,,,unavailable,5/20/2021,Security Assessment,Solidity,2021-05-07T12:05:58-04:00,2021-05-20T13:00:22-04:00,4,,Centralization / Privilege,,,"Language Specific,Coding Style"
StorePay Coin,,85,unavailable,10/26/2021,Security Assessment,Solidity,2021-10-14T11:38:19-07:00,2021-10-26T14:07:53-07:00,2,,Centralization / Privilege,,,Language Specific
Street Runner,,86,unavailable,10/7/2021,Security Assessment,Solidity,2021-10-06T07:13:20-04:00,2021-10-07T01:48:59-04:00,4,,Centralization / Privilege,Volatile Code,,"Gas Optimization,Language Specific"
Cointribute,CTB,,unavailable,5/20/2021,Security Assessment,Solidity,2021-05-18T09:58:41-04:00,2021-05-20T10:09:21-04:00,2,,,,,"Gas Optimization,Logical Issue"
MoneyTime,,,unavailable,8/16/2021,Security Assessment,Solidity,2021-06-23T04:11:56-04:00,2021-08-14T04:08:47-04:00,68,Logical Issue,"Volatile Code,Centralization / Privilege,Logical Issue","Logical Issue,Volatile Code,Control Flow,Centralization / Privilege",Control Flow,"Language Specific,Gas Optimization,Logical Issue,Coding Style,Volatile Code"
Piggy Finance,,87,unavailable,6/11/2021,Security Assessment,Solidity,2021-06-24T00:41:45-07:00,2021-07-08T11:13:13-07:00,12,,,"Centralization / Privilege,Logical Issue",,"Volatile Code,Gas Optimization"
C*mstar,,82,unavailable,7/19/2021,Security Assessment,Solidity,2021-07-13T18:05:15-07:00,2021-07-18T18:59:19-07:00,14,,Centralization / Privilege,"Logical Issue,Control Flow,Centralization / Privilege",Centralization / Privilege,"Gas Optimization,Coding Style,Control Flow,Logical Issue,Language Specific,Volatile Code"
Decentra,DELO,86,unavailable,10/29/2021,Security Assessment,Solidity,2021-10-11T10:14:58+08:00,2021-10-29T11:10:24+08:00,9,,Centralization / Privilege,"Volatile Code,Logical Issue",,"Language Specific,Coding Style,Logical Issue"
SafeLaunch,SFE,81,unavailable,5/25/2021,Security Assessment,Solidity,2021-05-25T05:15:23-04:00,2021-06-08T05:15:23-04:00,5,,,Centralization / Privilege,,"Coding Style,Logical Issue,Gas Optimization"
HOKK Finance,HOKK,84,unavailable,7/17/2021,Security Assessment,Solidity,2021-06-08T22:55:49-07:00,2021-07-17T01:32:15-07:00,24,,,"Logical Issue,Centralization / Privilege",,"Gas Optimization,Logical Issue,Coding Style"
ONUS,ONUS,65,unavailable,10/24/2020,Security Assessment,Solidity,2021-09-20T13:29:10-04:00,2021-09-23T10:04:33-04:00,4,,Centralization / Privilege,,,Gas Optimization
Idle Finance,IDLE,92,"8,400,252",10/25/2021,Security Assessment,Solidity,2021-10-11T23:04:47-04:00,2021-10-25T15:41:15-04:00,9,,Centralization / Privilege,Volatile Code,"Logical Issue,Control Flow",
LIFE Crypto,LIFE,83,unavailable,10/14/2021,Security Assessment,Solidity,2021-10-13T13:39:31+08:00,2021-10-14T13:23:33+08:00,4,,Centralization / Privilege,,Centralization / Privilege,"Gas Optimization,Logical Issue"
Booster,BOOST,85,unavailable,10/16/2021,Security Assessment,Solidity,2021-09-29T05:45:26-07:00,2021-10-16T09:26:14-07:00,4,,Centralization / Privilege,Logical Issue,,
MicroPets,MicroPets,87,unavailable,10/29/2021,Security Assessment,Solidity,2021-10-25T14:58:43+08:00,2021-10-29T13:05:36+08:00,9,,Centralization / Privilege,Volatile Code,,"Logical Issue,Gas Optimization,Language Specific,Volatile Code"
Stoneage NFT,,88,unavailable,10/10/2021,Security Assessment,Solidity,2021-10-05T11:48:08-07:00,2021-10-10T12:01:23-07:00,4,,Centralization / Privilege,,Logical Issue,Coding Style
Gallant,Gallant,88,unavailable,10/28/2021,,,,,,,,,,
TapSwap Finance,,81,unavailable,5/25/2021,,,,,,,,,,
Niax,NIAX,86,unavailable,7/26/2020,Smart Contract,Solidity,"July 24, 2020","July 26, 2020",,,,,,
expX,,,unavailable,7/28/2021,Security Assessment,Solidity,2021-06-24T13:34:15-04:00,2021-07-28T16:54:20-04:00,23,,"Centralization / Privilege,Volatile Code","Volatile Code,Mathematical Operations","Mathematical Operations,Control Flow,Volatile Code","Inconsistency,Volatile Code,Mathematical Operations,Coding Style,Language Specific"
Surf Moon,,83,unavailable,11/5/2021,Security Assessment,Solidity,2021-10-27T06:37:45-07:00,2021-11-04T08:28:58-07:00,10,,Centralization / Privilege,"Control Flow,Logical Issue",,"Logical Issue,Volatile Code,Coding Style,Inconsistency"
ELONGATE,ELONGATE,87,unavailable,5/10/2021,Security Assessment,Solidity,2021-04-19T13:04:39-04:00,2021-05-10T13:04:08-04:00,13,,Centralization / Privilege,"Logical Issue,Control Flow,Centralization / Privilege",Logical Issue,"Logical Issue,Gas Optimization,Volatile Code,Coding Style,Control Flow"
AmunAg,"ETH3L ,BTC3L ,ETH3S ,BTC3S ,BTCSHORT",80,unavailable,10/24/2020,Smart Contracts & Token,Solidity,"March 26, 2020","April 10, 2020",,,,,,
Tree Defi,SEED,81,unavailable,6/27/2021,Security Assessment,Solidity,2021-05-14T23:36:41-07:00,2021-07-03T19:49:05-07:00,16,,"Volatile Code,Centralization / Privilege,Logical Issue","Volatile Code,Logical Issue,Mathematical Operations,Control Flow",Mathematical Operations,"Logical Issue,Gas Optimization,Volatile Code"
SafuYield Protocol,SAFUYIELD,88,unavailable,8/11/2021,Security Assessment,Solidity,2021-07-22T11:44:03-07:00,2021-08-11T15:32:32-07:00,10,,,"Inconsistency,Gas Optimization,Logical Issue",Centralization / Privilege,"Inconsistency,Coding Style,Volatile Code,Gas Optimization"
Shield Network,SHIELDNET,83,unavailable,6/22/2021,Security Assessment,Solidity,2021-06-15T04:46:50-04:00,2021-06-22T07:36:07-04:00,6,,,"Volatile Code,Centralization / Privilege",Logical Issue,"Language Specific,Gas Optimization"
Onion MIXER,OMT,83,unavailable,6/7/2021,Smart Contract,Solidity,"June 04, 2021","June 07, 2021",,,,,,
Nexus Crypto Services,NEXUS,85,unavailable,10/5/2021,Security Assessment,Solidity,2021-10-04T18:42:06-07:00,2021-10-05T16:21:14-07:00,7,,"Centralization / Privilege,Logical Issue",Gas Optimization,"Inconsistency,Logical Issue",
ETHVAULT,ETHvault,83,unavailable,9/15/2021,,,,,,,,,,
Diamond Boyz Coin,DBZ,83,unavailable,10/15/2021,Security Assessment,Solidity,2021-10-04T11:32:57-07:00,2021-10-15T16:48:20-07:00,8,,"Logical Issue,Centralization / Privilege","Control Flow,Logical Issue",,"Gas Optimization,Logical Issue,Coding Style"
Bali Token,,89,unavailable,9/30/2021,Security Assessment,Solidity,2021-09-24T10:59:45+08:00,2021-09-30T11:30:07+08:00,3,,Centralization / Privilege,,,Language Specific
Memenopoly,MNOP,83,unavailable,11/7/2021,,,,,,,,,,
Sphynxtoken,,86,unavailable,9/26/2021,Security Assessment,Solidity,2021-09-22T08:55:35+08:00,2021-09-26T09:30:02+08:00,7,,Centralization / Privilege,,,"Logical Issue,Volatile Code,Coding Style,Language Specific"
Ez365,EZ365,84,unavailable,10/24/2020,Smart Contract,Solidity,"July 6, 2019","July 9, 2019",,,,,,
BinaryX,,81,unavailable,5/6/2021,Security Assessment,Solidity,2021-03-22T20:00:00,2021-04-12T20:00:00,,,,,,
HiFarm,HIF,86,unavailable,8/23/2021,Security Assessment,Solidity,2021-07-26T10:36:24-04:00,2021-08-23T11:19:12-04:00,21,,"Centralization / Privilege,Logical Issue,Volatile Code","Volatile Code,Logical Issue,Centralization / Privilege","Volatile Code,Logical Issue","Language Specific,Coding Style,Gas Optimization,Volatile Code,Logical Issue"
Kishu Inu,KISHU,86,unavailable,8/18/2021,Security Assessment,Solidity,2021-08-16T14:59:09-07:00,2021-08-18T14:22:58-07:00,6,,Centralization / Privilege,Logical Issue,,"Logical Issue,Gas Optimization,Coding Style,Mathematical Operations"
12ships,TSHP,83,unavailable,8/22/2019,Smart Contract,Solidity,"May 9, 2019","August 22, 2019",,,,,,
Quras,XQC,84,unavailable,10/24/2020,,,,,,,,,,
SSB Token,,84,unavailable,10/25/2021,Security Assessment,Solidity,2021-10-08T18:56:39+08:00,2021-10-25T17:23:03+08:00,9,,Centralization / Privilege,"Volatile Code,Logical Issue",,"Language Specific,Gas Optimization,Coding Style"
ChainPort,PORT,87,unavailable,6/18/2021,Security Assessment,Solidity,2021-06-15T05:46:59-04:00,2021-06-18T05:46:59-04:00,19,,Logical Issue,"Logical Issue,Coding Style",,"Coding Style,Gas Optimization,Centralization / Privilege"
Sanucoin,,83,unavailable,10/24/2020,Smart Contracts & Token Wrappers,Solidity,"July 6, 2020","July 7, 2020",,,,,,
Onther,,86,unavailable,10/24/2020,Smart Contract,Solidity,"July 2, 2020","August 11, 2020",,,,,,
Piccolo Inu,PINU,85,unavailable,10/25/2021,,,,,,,,,,
yfuni ,YFUNI,82,unavailable,4/26/2021,Security Assessment,Solidity,2021-03-24T20:00:00,2021-04-26T20:00:00,,,,,,
Satozhi,SATOZ,84,unavailable,6/22/2021,Security Assessment,Solidity,2021-06-15T10:37:26-04:00,2021-06-22T07:35:16-04:00,16,,,"Logical Issue,Mathematical Operations,Inconsistency",Mathematical Operations,"Gas Optimization,Coding Style"
BenepitToken,BNP,84,unavailable,10/24/2020,Smart Contract,Solidity,"June 12, 2019","June 20, 2019",,,,,,
Position Exchange,POSI,90,"43,266,435",8/12/2021,Security Assessment,Solidity,2021-08-04T18:00:48-07:00,2021-08-10T23:21:12-07:00,9,,Centralization / Privilege,Logical Issue,,"Logical Issue,Coding Style,Gas Optimization"
Babel fish,BABEL,87,unavailable,11/10/2021,,,,,,,,,,
Ultimate NFT,UNFT,87,unavailable,10/23/2021,Security Assessment,Solidity,2021-10-06T13:12:09+08:00,2021-10-23T15:12:51+08:00,3,,Centralization / Privilege,Volatile Code,,Volatile Code
Meo.tools,MEO,79,unavailable,10/25/2021,Security Assessment,Solidity,2021-10-18T14:04:50-07:00,2021-10-25T09:50:52-07:00,8,,"Centralization / Privilege,Logical Issue","Control Flow,Volatile Code",,"Volatile Code,Coding Style,Logical Issue"
Battle Hero,BATH,83,unavailable,10/13/2021,Security Assessment,Solidity,2021-09-28T23:01:02-04:00,2021-10-13T12:19:57-04:00,12,,Centralization / Privilege,Volatile Code,,"Mathematical Operations,Language Specific,Coding Style,Volatile Code"
CubFinance,,87,unavailable,4/1/2021,Security Audit,Solidity,"March 26, 2021","Mar 30, 2021 ",,,,,,
UltiArena,ULTI,89,unavailable,8/25/2021,Security Assessment,Solidity,2021-08-16T13:22:44-04:00,2021-08-25T13:50:33-04:00,14,,"Centralization / Privilege,Control Flow","Control Flow,Volatile Code,Logical Issue",Inconsistency,"Coding Style,Inconsistency,Logical Issue"
Holdex Finance,HOLDEX,87,unavailable,10/13/2021,Security Assessment,Solidity,2021-09-27T10:48:11-04:00,2021-10-13T10:25:55-04:00,5,,Centralization / Privilege,,,"Language Specific,Gas Optimization"
Surge ETH,,80,unavailable,9/10/2021,Security Assessment,Solidity,2021-08-31T04:47:01-04:00,2021-09-06T03:52:21-04:00,10,,Centralization / Privilege,"Logical Issue,Centralization / Privilege",,"Logical Issue,Gas Optimization,Coding Style"
ITAM,ITAM,87,unavailable,10/18/2021,Security Assessment,Solidity,2021-09-03T08:10:08-07:00,2021-10-18T13:31:23-07:00,21,"Logical Issue,Centralization / Privilege","Logical Issue,Control Flow,Centralization / Privilege","Volatile Code,Logical Issue,Mathematical Operations",Logical Issue,"Coding Style,Gas Optimization,Logical Issue"
USDD(UD),UD,,unavailable,9/8/2021,Security Assessment,Solidity,2021-09-06T23:25:23-07:00,2021-09-07T22:44:52-07:00,2,,,"Centralization / Privilege,Data Flow",,
Baby Cake,BABYCAKE,,unavailable,8/1/2021,Security Assessment,Solidity,2021-07-23T23:05:15-04:00,2021-07-31T04:55:44-04:00,16,,,"Volatile Code,Logical Issue",Centralization / Privilege,"Gas Optimization,Logical Issue,Language Specific,Volatile Code,Coding Style"
Merchant Token,,81,unavailable,4/7/2021,Security Audit,"Solidity, Yul","March 16, 2021","March 17, 2021",,,,,,
Omniverse,,,unavailable,10/29/2021,Security Assessment,Solidity,2021-10-28T10:10:50-07:00,2021-10-28T22:18:17-07:00,5,,Centralization / Privilege,Logical Issue,Logical Issue,Coding Style
Quantbook,QTBK,86,unavailable,10/24/2020,Smart Contract,Solidity,"July 29, 2020","August 12, 2020",,,,,,
SupreNFT,SNFT,,unavailable,10/20/2021,Security Assessment,Solidity,2021-10-20T15:03:41+08:00,2021-10-20T11:14:17+08:00,4,,,Volatile Code,Centralization / Privilege,"Language Specific,Gas Optimization"
DNAxCAT,DXCT,,unavailable,8/16/2021,Security Assessment,Solidity,2021-08-14T01:40:59-04:00,2021-08-16T05:15:36-04:00,4,,,"Centralization / Privilege,Volatile Code",,"Volatile Code,Gas Optimization"
Most,MOST,79,unavailable,10/24/2020,Smart Contracts & Tokens,Solidity,"August 5, 2020","August 11, 2020",,,,,,
Pledge Finance,PLGR,,unavailable,9/16/2021,Security Assessment,Solidity,2021-09-06T22:59:45-07:00,2021-09-15T20:15:22-07:00,4,,Centralization / Privilege,Mathematical Operations,,"Language Specific,Coding Style"
Charm Finance,CUBE,,unavailable,6/28/2021,Security Assessment,Solidity,2021-05-25T05:57:20-04:00,2021-06-28T13:46:35-04:00,8,,,Logical Issue,,"Gas Optimization,Centralization / Privilege"
Ambify,,84,unavailable,8/3/2021,Security Assessment,Solidity,2021-06-22T20:22:34-07:00,2021-08-03T14:35:28-07:00,10,,"Centralization / Privilege,Gas Optimization",,,"Gas Optimization,Mathematical Operations,Volatile Code"
Hodl Finance,HFT,,unavailable,11/4/2021,Security Assessment,Solidity,2021-09-13T13:16:32-07:00,2021-11-04T12:26:26-07:00,9,,"Centralization / Privilege,Volatile Code",Volatile Code,"Inconsistency,Volatile Code",Coding Style
MGA-Prometheus,MGA,,unavailable,10/4/2021,Security Assessment,Solidity,2021-10-04T17:06:00+08:00,2021-10-04T17:31:20+08:00,2,,,,,"Language Specific,Coding Style"
Solvent Protocol,,,unavailable,10/20/2021,Security Assessment,Rust,2021-10-04T19:50:28-07:00,2021-10-20T17:04:14-07:00,6,,,,Volatile Code,"Logical Issue,Magic Numbers,Language Specific,Coding Style"
ZEED,,,unavailable,9/26/2021,Security Assessment,Solidity,2021-09-24T13:17:45+08:00,2021-09-26T15:45:11+08:00,2,,Centralization / Privilege,,,Language Specific
Monster Slayer,,,unavailable,3/16/2021,Security Audit,Solidity,"March 1, 2021","March 7, 2021",6,,,V,,"O,G"
Save Planet Earth,SPE,,unavailable,6/28/2021,Security Assessment,Solidity,2021-06-07T03:00:00-04:00,2021-06-28T07:07:51-04:00,8,,,Logical Issue,,"Language Specific,Gas Optimization,Logical Issue,Coding Style"
CNHC,,,unavailable,12/3/2020,Security Audit,Solidity,"November 25, 2020","December 3, 2020",10,,,S,,"L,C,O"
BNBFactor,,,unavailable,8/13/2021,Security Assessment,Solidity,2021-07-28T13:46:56-07:00,2021-08-12T17:38:44-07:00,4,"Centralization / Privilege,Logical Issue",,Logical Issue,,Volatile Code
FAR Ecosystem,FAR,,unavailable,6/23/2021,Security Assessment,Solidity,2021-06-17T09:18:53+08:00,2021-06-22T16:54:42+08:00,6,,,"Logical Issue,Centralization / Privilege,Mathematical Operations",,"Gas Optimization,Language Specific"
Alium Swap,,,unavailable,4/12/2020,Smart Contract,Solidity,2021-04-01T20:00:00,2021-04-07T20:00:00,,,,,,
BEST,BEST,,unavailable,4/30/2021,Security Assessment,Solidity,2021-04-20T23:19:00-04:00,2021-04-30T03:57:52-04:00,15,,,"Logical Issue,Centralization / Privilege",,"Logical Issue,Optimization,Volatile Code,Mathematical Operations"
Chemix,KUN,77,unavailable,4/7/2021,Security Audit,Solidity,"April 07, 2021","May 20, 2021",,,,,,
Xpansion,XPS,,unavailable,11/4/2021,Security Assessment,Solidity,2021-11-02T14:12:18+08:00,2021-11-04T16:36:28+08:00,2,,,,Centralization / Privilege,Coding Style
Solv Protocol,SOLV,,unavailable,10/12/2021,Security Assessment,Solidity,2021-08-30T09:10:54+08:00,2021-09-30T14:58:39+08:00,18,,Centralization / Privilege,Logical Issue,,"Logical Issue,Coding Style,Gas Optimization"
PARADOX NFT BSC,PXBSC,80,unavailable,10/6/2021,,,,,,,,,,
Swapp Protocol,SWAPP,,unavailable,10/20/2021,Security Assessment,Solidity,2021-09-13T09:36:29+08:00,2021-10-20T13:22:47+08:00,40,,Centralization / Privilege,"Volatile Code,Logical Issue",Logical Issue,"Language Specific,Logical Issue,Gas Optimization,Mathematical Operations,Volatile Code"
AquaGoat.Finance,AQUAGOAT,,unavailable,7/20/2021,Security Assessment,Solidity,2021-07-08T12:56:00-07:00,2021-07-19T18:24:59-07:00,11,,Logical Issue,"Logical Issue,Control Flow",,"Coding Style,Volatile Code,Logical Issue,Control Flow,Gas Optimization"
Acet Finance,ACT,,unavailable,10/15/2021,Security Assessment,Solidity,2021-10-04T09:23:54-07:00,2021-10-15T12:50:58-07:00,6,,Centralization / Privilege,Gas Optimization,"Logical Issue,Volatile Code","Coding Style,Gas Optimization"
BetFury,,,unavailable,9/17/2021,Security Assessment,Solidity,2021-09-13T01:08:43-04:00,2021-09-17T14:07:09-04:00,3,,Centralization / Privilege,Mathematical Operations,,Gas Optimization
Chain Partners,,,unavailable,9/24/2021,Security Assessment,Solidity,2021-08-22T23:35:24-07:00,2021-09-23T18:24:23-07:00,4,,Centralization / Privilege,Centralization / Privilege,,"Language Specific,Volatile Code"
Liquidifty,LQT,,unavailable,8/30/2021,Security Assessment,Solidity,2021-05-12T02:21:40-07:00,2021-05-14T18:13:18-07:00,6,,,"Logical Issue,Centralization / Privilege",,"Logical Issue,Coding Style,Gas Optimization"
SocialGoodToken,SG,81,unavailable,10/24/2020,Smart Contract,Solidity,"July 10, 2020","July 13, 2020",,,,,,
Fogchaininc,,81,unavailable,10/24/2020,Smart Contract,Solidity,"December 9, 2019","December 10, 2019",,,,,,
GameFi Protocol,GFI,,unavailable,9/3/2021,Security Assessment,Solidity,2021-09-06T01:11:11-04:00,2021-09-06T23:34:06-04:00,5,,Centralization / Privilege,Centralization / Privilege,,"Language Specific,Volatile Code,Coding Style"
XBANK,XBA,,unavailable,10/20/2021,Security Assessment,Solidity,2021-10-08T07:43:59-07:00,2021-10-19T11:21:38-07:00,4,,Centralization / Privilege,Mathematical Operations,,"Coding Style,Gas Optimization"
Oven Token,,,unavailable,6/25/2021,Security Assessment,Solidity,2021-06-09T01:50:51-07:00,2021-06-25T04:55:47-07:00,7,,Volatile Code,"Logical Issue,Mathematical Operations,Volatile Code,Centralization / Privilege",,"Language Specific,Gas Optimization"
Kaizen.Finance,Kaizen Finance,,unavailable,9/24/2021,Security Assessment,Solidity,2021-09-06T08:58:27+08:00,2021-09-24T13:50:08+08:00,3,,Centralization / Privilege,,Control Flow,Volatile Code
Rice Wallet,RICE,,unavailable,8/11/2021,Security Assessment,Solidity,2021-07-28T04:28:02-07:00,2021-08-11T05:21:45-07:00,11,,Logical Issue,"Mathematical Operations,Centralization / Privilege,Logical Issue",,"Gas Optimization,Coding Style,Volatile Code,Logical Issue"
Shiba Farm,,,unavailable,11/8/2021,Security Assessment,Solidity,2021-11-06T14:07:27+08:00,2021-11-08T13:23:14+08:00,7,Logical Issue,Centralization / Privilege,"Volatile Code,Logical Issue",,"Volatile Code,Gas Optimization"
SafeVault,VAULT,81,unavailable,8/26/2021,Security Assessment,Solidity,2021-08-23T04:05:15-04:00,2021-08-26T00:14:54-04:00,13,,"Logical Issue,Centralization / Privilege",Logical Issue,,"Language Specific,Gas Optimization,Logical Issue,Coding Style"
OUD Token,OUD,,unavailable,7/27/2021,Security Assessment,Solidity,2021-07-06T12:43:58-04:00,2021-07-27T07:52:23-04:00,4,,Centralization / Privilege,Logical Issue,,"Gas Optimization,Coding Style"
Multiple,,,unavailable,8/2/2021,Security Assessment,Solidity,2021-06-23T18:38:46-07:00,2021-08-01T19:54:42-07:00,10,,,"Logical Issue,Centralization / Privilege",,"Logical Issue,Coding Style"
Finance Blocks,,,unavailable,10/22/2021,Security Assessment,Solidity,2021-10-15T11:11:38-07:00,2021-10-22T06:20:43-07:00,2,,Centralization / Privilege,,,Language Specific
Alyattes,ALYA,,unavailable,10/22/2021,Security Assessment,Solidity,2021-10-11T07:44:37-07:00,2021-10-22T10:20:23-07:00,10,,"Centralization / Privilege,Logical Issue",Logical Issue,,"Coding Style,Logical Issue,Optimization,Gas Optimization"
DEEPSPACE,DPS,,"40,934,100",10/19/2021,Security Assessment,Solidity,2021-08-26T13:34:36-07:00,2021-10-19T12:31:08-07:00,19,,Centralization / Privilege,"Volatile Code,Control Flow",,"Logical Issue,Gas Optimization,Volatile Code,Coding Style,Language Specific"
DIMITRA,DMTR,,unavailable,7/28/2021,Security Assessment,Solidity,2021-07-15T17:37:54-07:00,2021-07-28T13:02:48-07:00,7,Logical Issue,,,Logical Issue,"Language Specific,Gas Optimization,Volatile Code"
Mimoprotocol,,,unavailable,4/25/2021,Security Audit,Solidity,2021-04-03T02:52:11-07:00,2021-04-18T02:52:11-07:00,13,,,"Logical Issue,Control Flow",,"Control Flow,Gas Optimization"
CapsuleCoin,,,unavailable,2/16/2021,Security Audit,"Solidity, Yul","February 6, 2021","February 9, 2021",,,,,,
EarnDefi,,,unavailable,10/20/2021,Security Audit,Solidity,2021-03-13,"March 15, 2021",,,,,,
WealthLocks,,,unavailable,3/15/2021,Security Audit,Solidity,"March 15, 2021","March 29, 2021",8,,L,"V,M",,"L,G"
TXA,,,unavailable,7/19/2021,Security Assessment,Solidity,2021-07-08T05:28:54-07:00,2021-07-19T08:46:07-07:00,12,,,,,"Language Specific,Coding Style,Gas Optimization,Volatile Code"
Coviewnity,,,unavailable,6/22/2021,Security Assessment,Solidity,2021-06-15T10:58:37-04:00,2021-06-22T07:34:23-04:00,11,,,"Logical Issue,Volatile Code",Centralization / Privilege,"Coding Style,Gas Optimization,Volatile Code"
BQCC,BQCC,,unavailable,8/1/2019,Smart Contract,C++,"July 25, 2019","August 1, 2019",,,,,,
M-DAO,M-DAO,,unavailable,9/20/2021,Security Assessment,Solidity,2021-09-18T22:24:25-07:00,2021-09-20T00:26:41-07:00,5,,"Logical Issue,Centralization / Privilege","Control Flow,Volatile Code",,Language Specific
BDollar,,,unavailable,3/3/2021,Security Audit,"Solidity, Yul","February 04, 2021","February 24, 2021",,,,,,
Evai,,,unavailable,2/18/2021,Security Assessment,"Solidity,Yul",2021-05-11T20:00:00,2021-05-30T20:00:00,24,"Volatile Code,Data Flow",,,,"Language Specific,Coding Style,Logical Issue,Inconsistency,Data Flow"
Doraemon,DAM,,unavailable,8/30/2021,Security Assessment,Solidity,2021-08-28T05:15:35-04:00,2021-08-27T05:33:58-04:00,3,,,Centralization/Privilege,,"Logical Issue,Coding Style"
Quantum Assets,QA,,unavailable,9/22/2021,Security Assessment,Solidity,2021-09-15T06:58:20-07:00,2021-09-22T07:31:43-07:00,3,,Centralization / Privilege,,,"Language Specific,Gas Optimization"
Zam.io,ZAM,,unavailable,9/27/2021,Security Assessment,Solidity,2021-09-15T03:52:39-04:00,2021-09-27T22:29:01-04:00,3,,Centralization / Privilege,,,"Language Specific,Gas Optimization"
TechnoDoge,,,unavailable,9/27/2021,Security Assessment,Solidity,2021-09-07T08:48:15-07:00,2021-09-27T12:28:13-07:00,2,,Centralization / Privilege,,,Volatile Code
BluSea,BLUS,,unavailable,10/14/2021,Security Assessment,Solidity,2021-10-04T19:06:54+08:00,2021-10-14T13:42:37+08:00,7,,Centralization / Privilege,,Logical Issue,"Volatile Code,Coding Style"
Kung Fu Doge,KFDoge,,unavailable,7/13/2021,Security Assessment,Solidity,2021-07-06T09:17:06+08:00,2021-07-13T09:20:41+08:00,3,,,Logical Issue,,Logical Issue
ccFound,FOUND,,unavailable,9/14/2021,Security Assessment,Solidity,2021-09-08T14:53:00-07:00,2021-09-14T15:52:32-07:00,3,,Centralization / Privilege,,,Language Specific
Rocket Protocol,ROCK,,unavailable,4/30/2021,Security Assessment,Solidity,2021-04-25T01:22:32-04:00,2021-04-30T01:29:49-04:00,30,,Logical Issue,,,"Gas Optimization,Logical Issue,Coding Style,Mathematical Operations"
Empire Token,EMPIRE,80,unavailable,11/4/2021,Security Assessment,Solidity,2021-10-22T17:53:33+08:00,2021-11-04T10:01:40+08:00,18,,"Centralization / Privilege,Logical Issue","Volatile Code,Logical Issue",,"Language Specific,Gas Optimization,Coding Style,Control Flow,Logical Issue,Volatile Code"
XAN,XAN,,unavailable,10/26/2021,Security Assessment,Solidity,2021-10-15T10:51:59+08:00,2021-10-26T13:03:36+08:00,2,,Centralization / Privilege,,,Language Specific
BlockRocketTech,,,unavailable,4/13/2021,Security Audit,"Solidity, Yul","March 19, 2021","April 12, 2021",,,,,,
Bagels Finance,,,unavailable,6/28/2021,Security Assessment,Solidity,2021-05-31T09:40:12+08:00,2021-06-28T10:23:00+08:00,14,,,"Centralization / Privilege,Volatile Code",,"Optimization,Volatile Code,Logical Issue,Coding Style,Language Specific,Gas Optimization"
The Recharge,,,unavailable,6/24/2021,Security Assessment,Solidity,2021-06-10T02:06:34-07:00,2021-06-23T07:22:08-07:00,12,,,Logical Issue,Logical Issue,"Language Specific,Coding Style,Gas Optimization"
Manifold Technology,,,unavailable,5/12/2021,Security Assessment,Solidity,2021-05-10T12:22:58-04:00,2021-05-12T12:37:09-04:00,6,,,Logical Issue,,"Language Specific,Coding Style,Gas Optimization"
WorldPlus,,,unavailable,11/9/2021,Security Assessment,Solidity,2021-11-04T07:50:34-07:00,2021-11-08T12:06:59-08:00,3,,Centralization / Privilege,,,"Language Specific,Coding Style"
Trister World tCard,,,unavailable,3/18/2021,Smart Contract,Solidity,"March 8, 2021","March 12, 2021",,,,,,
2gather,,,unavailable,6/22/2021,Security Assessment,Solidity,2021-06-15T11:03:35-04:00,2021-06-22T07:34:30-04:00,17,,"Language Specific,Logical Issue","Logical Issue,Volatile Code",,"['Language Specific', 'Volatile Code', 'Coding Style', 'Gas Optimization', None]"
CoinOne,CONE,,unavailable,10/22/2021,Security Assessment,Solidity,2021-10-15T14:00:34+08:00,2021-10-22T13:25:14+08:00,18,,"Logical Issue,Centralization / Privilege","Volatile Code,Logical Issue",Logical Issue,"Coding Style,Gas Optimization,Language Specific,Logical Issue,Volatile Code"
Uninterested Unicorns by NEX10 LABS,,,unavailable,10/11/2021,Security Assessment,Solidity,2021-10-06T11:34:57-07:00,2021-10-11T14:12:37-07:00,4,,Centralization / Privilege,"Volatile Code,Logical Issue",,Logical Issue
Kaby Arena,KABY,,"7,954,384",9/16/2021,Security Assessment,Solidity,2021-08-25T17:58:56-04:00,2021-09-16T23:52:14-04:00,24,Logical Issue,"Centralization / Privilege,Mathematical Operations","Volatile Code,Logical Issue",Volatile Code,"Logical Issue,Coding Style,Gas Optimization,Language Specific"
DPK,DPK,,unavailable,10/27/2021,Security Assessment,Solidity,2021-10-27T18:01:52+08:00,2021-10-27T14:39:28+08:00,3,,Centralization / Privilege,Logical Issue,,Language Specific
EV Coin,,,unavailable,10/28/2021,Security Assessment,Solidity,2021-10-14T11:38:19-07:00,2021-10-28T06:19:55-07:00,2,,Centralization / Privilege,,,Language Specific
BNBHarvest,,,unavailable,11/7/2021,Security Assessment,Solidity,2021-11-01T19:34:26-07:00,2021-11-06T05:24:03-07:00,6,Logical Issue,Centralization / Privilege,"Logical Issue,Mathematical Operations",,Logical Issue
IJS Technologies,,,unavailable,10/13/2020,Security Audit,"Solidity, Yul",2021-05-09T00:00:00Z,2021-08-20T00:00:00Z,,,,,,
VeroFarm,Vero,,unavailable,10/5/2021,Preliminary Comments,Solidity,2021-09-24T22:20:24-04:00,2021-10-05T13:37:26-04:00,14,,Centralization / Privilege,,,"Language Specific,Coding Style"
BitMedi,BTMD,,unavailable,1/14/2021,Security Assessment,Solidity,2021-01-12T20:00:00,2021-01-14T20:00:00,,,,,,
Starton,,,unavailable,8/26/2021,Security Assessment,Solidity,2021-08-18T21:54:07-04:00,2021-08-26T01:41:20-04:00,7,,Centralization / Privilege,,"Centralization / Privilege,Volatile Code",Coding Style
UintCola NFT MarketPlace,,,unavailable,4/12/2020,Smart Contract,Solidity,"May 29, 2021","May 29, 2021",,,,,,
Merlin Lab,MERL,,unavailable,6/17/2021,Security Assessment,Solidity,2021-05-19T21:55:46-04:00,2021-06-17T14:31:52-04:00,15,,,"Centralization / Privilege,Control Flow,Data Flow,Gas Optimization,Volatile Code,Logical Issue,Mathematical Operations",,Coding Style
bStable,,,unavailable,5/29/2020,Smart Contract,Solidity,"May 25, 2021","May 25, 2021",,,,,,
KOI.BIO,,,unavailable,6/8/2021,Security Audit,Solidity,"June 04, 2021","June 08, 2021",,,,,,
DDEX,,,unavailable,6/8/2021,Security Audit,Solidity,"May 27, 2021","June 08, 2021",8,,,"L,G",,"L,G"
BrickChain Finance,,,unavailable,4/16/2021,Security Assessment,Solidity,2020-04-19T20:00:00,2020-05-06T20:00:00,8,,Volatile Code,"Logical Issue,Centralization / Privilege,Volatile Code",,"Volatile Code,Gas Optimization,Logical Issue"
Vira-lata Finance,REAU,,unavailable,5/7/2021,Security Assessment,Solidity,"April 25, 2021","May 5, 2021",,,,,,
SafePig,SPIG,,unavailable,6/10/2021,Security Audit,Solidity,"June 01, 2021","June 10, 2021",,,,,,
defiscale ,,,unavailable,4/2/2021,Smart Contract,Solidity,"April 01, 2021","April 01, 2021",,,,,,
Forest Knight,KNIGHT,,unavailable,9/22/2021,Security Assessment,Solidity,2021-09-10T21:41:31-04:00,2021-09-22T12:13:34-04:00,9,Centralization / Privilege,Centralization / Privilege,Gas Optimization,,"Volatile Code,Logical Issue"
MoonWilly,MNWL,,unavailable,9/13/2021,Security Assessment,Solidity,2021-09-10T01:43:28-04:00,2021-09-12T23:12:31-04:00,7,,"Centralization / Privilege,Logical Issue",Logical Issue,,"Gas Optimization,Logical Issue,Coding Style"
MoonLift Protocol,,,unavailable,6/4/2021,Smart Contract,Solidity,"June 02, 2021","June 04, 2021",,,,,,
OolongSwap,,,unavailable,10/15/2021,Security Assessment,Solidity,2021-10-11T09:20:00+08:00,2021-10-15T19:43:25+08:00,6,,Centralization / Privilege,,,"Volatile Code,Coding Style,Language Specific"
Bird Finance,,,unavailable,4/21/2020,Smart Contract,Solidity,"April 03, 2021","April 03, 2021",,,,,,
Froge Finance,FROGE,,unavailable,6/16/2021,Security Assessment,Solidity,2021-06-03T07:26:34-04:00,2021-06-16T03:58:28-04:00,15,,,"Mathematical Operations,Logical Issue,Volatile Code",,"Language Specific,Inconsistency,Data Flow,Gas Optimization,Control Flow"
Seerlink,,,unavailable,3/11/2021,Smart Contract,Solidity,"March 5, 2021","March 7, 2021",8,,,"L,P",,"L,O"
Poken Company,,,unavailable,10/29/2021,Security Assessment,Solidity,2021-07-28T13:03:12-07:00,2021-10-29T08:58:10-07:00,6,,Centralization / Privilege,"Coding Style,Logical Issue",,"Gas Optimization,Inconsistency"
TasteNFT,,,unavailable,6/4/2021,Security Assessment,Solidity,2021-05-24T04:46:10-04:00,2021-05-28T04:47:15-04:00,7,,V,"L,M,V,C",,"L,G"
TMN Global,TMNG,,unavailable,9/2/2021,Security Assessment,Solidity,2021-07-28T01:18:26-07:00,2021-09-02T01:30:40-07:00,5,,,Language Specific,,Gas Optimization
FUFU,FUFU,,unavailable,9/18/2021,Security Assessment,Solidity,2021-09-18T00:56:35-07:00,2021-09-18T04:28:43-07:00,1,,,Control Flow,,
Unilord,,,unavailable,4/26/2021,Security Assessment,"Solidity, Yul","April 11, 2021","April 22, 2021",,,,,,
CoinMerge,CMERGE,,unavailable,9/23/2021,Security Assessment,Solidity,2021-08-17T21:24:31-04:00,2021-09-23T01:31:55-04:00,10,,Centralization / Privilege,"Volatile Code,Logical Issue",Logical Issue,"Language Specific,Gas Optimization,Coding Style,Logical Issue"
ManySwap,MANY,,unavailable,4/8/2021,Security Audit,Solidity,"March 15, 2021","April 08, 2021",26,,"C,V,L",L,,"G,L,V,C"
King Kong,,,unavailable,5/11/2021,Security Assessment,Solidity,2021-05-06T00:22:21-07:00,2021-05-11T19:08:34-07:00,9,,Centralization / Privilege,"Permission,Optimization",,"Language Specific,Inconsistency,Optimization,Logical Issue,Coding Style,Gas Optimization"
BID Coin,,,unavailable,10/30/2021,Security Assessment,Solidity,2021-10-14T11:38:19-07:00,2021-10-29T08:55:57-07:00,2,,Centralization / Privilege,,,Language Specific
Phoenix DeFi,PNIX,,unavailable,5/20/2021,Security Assessment,Solidity,2021-04-23T19:50:39-07:00,2021-05-10T14:37:48-07:00,19,,"Volatile Code,Logical Issue","Logical Issue,Volatile Code,Centralization / Privilege",,"Logical Issue,Gas Optimization,Coding Style,Control Flow"
NFT11,,,unavailable,10/19/2021,Security Assessment,Solidity,2021-09-28T08:48:06-07:00,2021-10-19T12:31:54-07:00,5,,Centralization / Privilege,Gas Optimization,,"Gas Optimization,Volatile Code"
Raven X,RX,,unavailable,5/21/2021,Security Assessment,Solidity,2021-05-10T22:42:18-04:00,2021-05-21T20:58:09-04:00,10,,,"Logical Issue,Control Flow,Centralization / Privilege",,"Gas Optimization,Logical Issue,Control Flow,Coding Style"
Friction Finance,,,unavailable,4/15/2021,Security Audit,"Solidity, Yul","March 18, 2021","April 1, 2021",,,,,,
VirtualBacon DAO,,,unavailable,4/13/2021,Security Audit,"Solidity, Yul","March 16, 2021","March 17, 2021",,,,,,
Waggle Network,,,"9,924,729",10/11/2021,Security Assessment,Solidity,2021-09-20T08:44:53-07:00,2021-10-11T11:40:10-07:00,17,Centralization / Privilege,Centralization / Privilege,"Gas Optimization,Volatile Code,Logical Issue","Volatile Code,Logical Issue","Mathematical Operations,Coding Style"
Pandabit,,,unavailable,7/7/2021,Security Assessment,Solidity,2021-06-15T03:08:00-07:00,2021-07-07T13:17:01-07:00,8,,,"Centralization / Privilege,Logical Issue",Volatile Code,"Gas Optimization,Volatile Code"
WidiLand,WIDI,,unavailable,11/8/2021,Security Assessment,Solidity,2021-11-05T13:53:36+08:00,2021-11-08T11:42:45+08:00,3,,Centralization / Privilege,,,"Language Specific,Coding Style"
ESP Coin,ESP Token,,unavailable,6/28/2021,Security Assessment,Solidity,2021-06-26T04:54:30-07:00,2021-06-28T05:23:51-07:00,11,Logical Issue,,,,"Language Specific,Coding Style,Gas Optimization"
Cyber Time,CTF,,unavailable,4/16/2021,Security Assessment,Solidity,2021-04-03T00:54:49-04:00,2021-04-03T00:54:49-04:00,42,,C,L,,"G,V,L,C"
Reference System for DeFi,RX,,unavailable,5/27/2021,Security Assessment,Solidity,2021-05-10T10:43:02-04:00,2021-05-27T14:05:14-04:00,14,,Volatile Code,"Volatile Code,Control Flow,Logical Issue",Centralization / Privilege,"Language Specific,Logical Issue,Centralization / Privilege,Volatile Code,Mathematical Operations,Gas Optimization"
QUAM NETWORK,,,unavailable,4/16/2021,Security Audit,Solidity,"April 1, 2021","April 13, 2020",,,,,,
Liquid,,,unavailable,4/9/2021,Security Audit,Solidity,2021-03-12T13:21:15Z,2021-04-09T13:21:15Z,,,,,,
GNC DeFi,,,unavailable,4/21/2021,Security Audit,Solidity,"April 05, 2021","April 05, 2021",,,,,,
beshare,,,unavailable,4/13/2021,Security Audit,"Solidity, Yul","March 18, 2021","April 6, 2021",,,,,,
Cojam,CT,,unavailable,6/21/2021,Security Assessment,Solidity,2021-05-21T02:27:58-07:00,2021-05-29T02:35:14-07:00,23,,,"Volatile Code,Logical Issue",,"Gas Optimization,Inconsistency,Language Specific,Volatile Code"
Nine Chronicles,,,unavailable,8/18/2021,Security Assessment,Solidity,2021-08-16T03:37:49-04:00,2021-08-18T07:17:45-04:00,3,,Centralization / Privilege,,,"Language Specific,Gas Optimization"
MatrixETF,MDF,,unavailable,11/1/2021,Security Assessment,Solidity,2021-10-08T14:32:45+08:00,2021-11-01T11:44:46+08:00,25,"Volatile Code,Logical Issue",Centralization / Privilege,"Logical Issue,Volatile Code",Volatile Code,"Volatile Code,Coding Style,Language Specific,Gas Optimization,Logical Issue"
Fixed Rate Protocol,,,unavailable,3/8/2020,Smart Contract,Solidity,"February 18, 2021","March 08, 2021",14,,,V,,"B,V,D"
Starlink,,,unavailable,1/7/2021,Security Audit,"Solidity, Yul","January 5, 2021","January 7, 2021",,,,,,
Project SEED,SHILL,,unavailable,11/8/2021,Security Assessment,Solidity,2021-11-04T08:12:59-07:00,2021-11-08T07:34:24-08:00,2,,Centralization / Privilege,,,
CherrySwap,CHE,,unavailable,4/8/2021,Security Assessment,Solidity,2021-03-29T07:45:44-04:00,2021-04-08T06:00:12-04:00,18,,Logical Issue,"Logical Issue,Centralization / Privilege",,"Volatile Code,Optimization,Logical Issue"
Titans Finance,,,unavailable,12/5/2020,Smart Contract,Solidity,"December 4, 2020","December 5, 2020",,,,,,
Fair Safe,FSAFE,,unavailable,6/3/2021,Security Assessment,Solidity,2021-05-17T11:46:06-04:00,2021-06-02T22:41:49-04:00,12,,,"Logical Issue,Control Flow,Centralization / Privilege","Logical Issue,Centralization / Privilege","Logical Issue,Gas Optimization,Volatile Code,Coding Style"
Plutos Network,PLUT,,unavailable,6/9/2021,Smart Contract,Solidity,"June 01, 2021","June 09, 2021",2,,,,,L
Dog Moon,,,unavailable,5/26/2021,Smart Contract,Solidity,"May 24, 2021","May 24, 2021",,,,,,
Ore-System,,,unavailable,10/11/2021,Security Assessment,Solidity,2021-10-11T08:47:15-07:00,2021-10-10T19:15:02-07:00,11,,Centralization / Privilege,"Logical Issue,Control Flow",Logical Issue,"Gas Optimization,Coding Style,Control Flow,Volatile Code"
1Hive,,,unavailable,4/22/2021,Security Audit,"Solidity, Yul",2021-04-06T14:24:00Z,2021-04-22T14:24:00Z,,,,,,
ChocoLate Cash,CHC,,unavailable,6/15/2021,Smart Contract,Solidity,"June 13, 2021","June 14, 2021",1,,,,,Language Specific
XIXO Ecosystem,TKX,,unavailable,10/19/2021,Security Assessment,Solidity,2021-10-08T07:40:06-07:00,2021-10-20T07:05:36-07:00,4,,Centralization / Privilege,Mathematical Operations,,"Coding Style,Gas Optimization"
Solarbeam,SOLAR,,unavailable,11/10/2021,Security Assessment,Solidity,2021-09-21T08:51:30-07:00,2021-11-04T21:37:01-07:00,24,,Centralization / Privilege,"Logical Issue,Volatile Code",Logical Issue,"Gas Optimization,Logical Issue,Coding Style"
Astra Guild Ventures,,,unavailable,11/4/2021,Security Assessment,Solidity,2021-10-28T09:33:10-07:00,2021-11-11T20:42:21-08:00,3,,Centralization / Privilege,,,Language Specific
TacoSwap,TACO,,unavailable,6/12/2021,Security Assessment,Solidity,2021-06-11T11:09:34-07:00,2021-06-20T19:46:53-07:00,14,,,"Volatile Code,Centralization / Privilege,Control Flow,Logical Issue",Volatile Code,"Gas Optimization,Logical Issue,Volatile Code"
Neopin,,,unavailable,8/31/2021,Security Assessment,Solidity,2021-08-02T14:02:58-07:00,2021-08-31T10:16:49-07:00,7,,Centralization / Privilege,,,"Inconsistency,Gas Optimization"
BoringDAO,,,unavailable,5/31/2021,Security Assessment,Solidity,2021-09-05T04:12:10-07:00,2021-09-14T20:43:01-07:00,14,,Centralization / Privilege,"Volatile Code,Gas Optimization",,"Language Specific,Coding Style,Volatile Code,Logical Issue"
Cryptoland,,,unavailable,10/22/2021,Security Assessment,Solidity,2021-10-20T04:26:04-07:00,2021-10-22T22:15:22-07:00,9,,Centralization / Privilege,Volatile Code,Logical Issue,"Volatile Code,Coding Style,Logical Issue,Gas Optimization"
MMR,,,unavailable,9/28/2021,Security Assessment,Solidity,2021-08-25T15:16:03+08:00,2021-09-28T17:53:50+08:00,16,,"Logical Issue,Centralization / Privilege",Logical Issue,"Control Flow,Volatile Code,Logical Issue","Gas Optimization,Coding Style"
CenterPrime,,,unavailable,12/31/2020,Security Audit,"Solidity, Yul","December 16, 2020","December 31, 2020",,,,,,
Bertinity,BRTX,,unavailable,11/9/2021,Security Assessment,Solidity,2021-10-17T18:44:21-07:00,2021-11-08T19:49:10-08:00,2,,Centralization / Privilege,,Centralization / Privilege,
Squidgame Online,SQT,,unavailable,10/26/2021,Security Assessment,Solidity,2021-10-14T09:24:22+08:00,2021-10-26T19:35:21+08:00,9,,Centralization / Privilege,"Logical Issue,Inconsistency",Logical Issue,"Coding Style,Gas Optimization,Logical Issue,Volatile Code"
Coinfluence,CFLU,,unavailable,7/13/2021,Security Assessment,Solidity,2021-09-06T15:05:39-04:00,2021-09-17T11:49:38-04:00,15,,"Centralization / Privilege,Coding Style","Control Flow,Logical Issue",Logical Issue,"Logical Issue,Gas Optimization,Volatile Code,Coding Style"
MODA DAO,,,unavailable,7/11/2021,Security Assessment,Solidity,2021-06-29T00:37:55-07:00,2021-07-08T04:00:27-07:00,8,Logical Issue,,,,"Language Specific,Centralization / Privilege,Coding Style"
HOGT.COM,,,unavailable,6/8/2021,Security Audit,Solidity,"June 07, 2021","June 10, 2021",,,,,,
Seaweed Finance,,,unavailable,3/23/2021,Smart Contract,Solidity,"March 19, 2021","March 20, 2021",,,,,,
MeetPle,MPT,,unavailable,6/16/2021,Security Assessment,Solidity,2021-06-15T09:14:40-07:00,2021-06-15T22:31:33-07:00,7,,,,,"Centralization / Privilege,Gas Optimization,Coding Style"
Universal Membership Community,,,unavailable,4/21/2021,Smart Contract,Solidity,"January 01, 2021"," April 12, 2021",,,,,,
Microverse,MVP,,unavailable,10/19/2021,Security Assessment,Solidity,2021-10-15T15:26:26+08:00,2021-10-19T16:41:33+08:00,2,,Centralization / Privilege,,,
NFT-KungFu,Kungfu,,unavailable,6/9/2021,Smart Contract,Solidity,"June 04, 2021","June 09, 2021",,,,,,
Trister's Lend,TWFI,,unavailable,8/10/2021,Security Assessment,Solidity,2021-06-25T08:19:37-07:00,2021-08-09T17:50:18-07:00,16,,"Logical Issue,Centralization / Privilege","Logical Issue,Volatile Code",,"Gas Optimization,Coding Style"
SolarFare Finance,,,unavailable,6/14/2021,Security Assessment,Solidity,2021-05-26T09:08:28-04:00,2021-06-14T13:03:41-04:00,8,,Coding Style,"Logical Issue,Centralization/Privilege,Volatile Code",,"Gas Optimization,Volatile Code,Coding Style"
Kollect Cards,KOL,,unavailable,9/13/2021,Security Assessment,Solidity,2021-09-10T23:34:39-07:00,2021-09-13T02:56:35-07:00,1,,,Control Flow,,
POP,POP,,unavailable,5/10/2021,Security Assessment,"Solidity,Yul",2021-04-12T09:08:28-04:00,2021-05-03T13:03:41-04:00,18,,Language Specific,"Language Specific,Logical Issue","Mathematical Operations,Logical Issue","Coding Style,Gas Optimization,Language Specific"
NIFTSY,NIFTSY,,unavailable,7/14/2021,Security Assessment,Solidity,2021-07-06T04:47:32-07:00,2021-07-14T00:19:03-07:00,8,,,Centralization / Privilege,"Centralization / Privilege,Logical Issue","Language Specific,Volatile Code,Centralization / Privilege"
Cleaner Earth Token,CLEANER,,unavailable,8/25/2021,Security Assessment,Solidity,2021-08-24T18:49:50-07:00,2021-08-25T11:23:28-07:00,8,Compiler Error,"Logical Issue,Centralization / Privilege","Volatile Code,Logical Issue",,"Coding Style,Gas Optimization"
Ari10,,,unavailable,10/29/2021,Security Assessment,Solidity,2021-10-19T02:37:04-07:00,2021-10-29T01:30:40-07:00,9,,"Centralization / Privilege,Logical Issue",,"Logical Issue,Centralization / Privilege","Coding Style,Language Specific,Logical Issue,Volatile Code"
YAO Cash,,,unavailable,5/24/2021,Smart Contract,Solidity,"May 22, 2021"," May 22, 2021",,,,,,
UNFT,,,unavailable,11/1/2021,Security Assessment,Solidity,2021-10-26T15:06:39+08:00,2021-11-01T14:19:49+08:00,12,,"Centralization / Privilege,Logical Issue",Logical Issue,Volatile Code,"Logical Issue,Coding Style,Volatile Code"
Green Beli,GRBE,,unavailable,9/17/2021,Security Assessment,Solidity,2021-09-15T19:57:58-07:00,2021-09-16T19:57:58-07:00,11,,"Centralization / Privilege,Logical Issue","Volatile Code,Mathematical Operations",Logical Issue,"Logical Issue,Gas Optimization,Coding Style"
Windmill Token,,,unavailable,9/23/2021,Security Assessment,Solidity,2021-08-30T23:40:32-04:00,2021-09-23T21:19:32-04:00,13,,Centralization / Privilege,Logical Issue,Logical Issue,"Control Flow,Gas Optimization,Logical Issue,Coding Style"
DeFi Basket,,,unavailable,11/9/2021,Security Assessment,Solidity,2021-10-14T02:17:48-07:00,2021-11-08T22:02:32-08:00,6,,,Volatile Code,Logical Issue,"Logical Issue,Volatile Code,Coding Style"
DeflateFinance,,,unavailable,5/6/2021,Security Assessment,Solidity,2021-03-14,2021-05-06T20:00:00,,,,,,
Filst Token,,,unavailable,4/12/2020,Smart Contract,Solidity,"January 01, 2021","April 09, 2021",,,,,,
Flurry Finance,FLURRY,,unavailable,8/6/2021,Security Assessment,Solidity,2021-08-26T08:03:24-07:00,2021-09-06T09:47:02-07:00,15,,,"Logical Issue,Gas Optimization","Centralization / Privilege,Volatile Code,Language Specific","Coding Style,Language Specific,Gas Optimization"
idexo,IDO,,unavailable,10/28/2021,Security Assessment,Solidity,2021-05-25T13:10:19-04:00,2021-06-25T12:02:45-04:00,2,,,Logical Issue,,Language Specific
Povo Finance,POVO,,unavailable,8/27/2021,Security Assessment,Solidity,2021-08-20T05:08:11-04:00,2021-08-27T06:48:48-04:00,8,Centralization / Privilege,Logical Issue,"Logical Issue,Centralization / Privilege",Centralization / Privilege,"Coding Style,Logical Issue"
EthereumMax,EMAX,,unavailable,7/28/2021,Security Assessment,Solidity,2021-06-03T07:27:14-04:00,2021-07-28T10:05:54-04:00,7,,Logical Issue,Mathematical Operations,,"Language Specific,Gas Optimization"
NFT-XPANDA,XPC,,unavailable,8/21/2021,Security Assessment,Solidity,2021-08-19T04:07:48-07:00,2021-08-20T18:28:04-07:00,9,,Centralization / Privilege,"Volatile Code,Logical Issue",,"Gas Optimization,Coding Style"
Mindsync,MAI,,unavailable,10/8/2021,Security Assessment,Solidity,2021-08-04T06:55:17-04:00,2021-10-08T10:57:29-04:00,12,,Centralization / Privilege,Mathematical Operations,,"Volatile Code,Coding Style,Language Specific,Logical Issue"
Zytara,ZUSD,,unavailable,2/22/2021,Security Audit,"Solidity, Yul","December 15, 2020","December 30, 2020",,,,,,
MonetaSwap,FSAFE,,unavailable,6/15/2021,Security Assessment,Solidity,2021-06-01T15:33:40+08:00,2021-06-15T09:32:24+08:00,7,Logical Issue,Logical Issue,Logical Issue,,"Volatile Code,Coding Style"
Nfthero,,,unavailable,2/2/2021,Security Audit,"Solidity, Yul","Marth 4, 2021","March 16, 2021",,,,,,
ZooSwap,,,unavailable,4/8/2021,Security Assessment,Solidity,2021-03-29T10:02:43+08:00,2021-04-08T10:02:17+08:00,13,,"Centralization / Privilege,Logical Issue",Logical Issue,Centralization / Privilege,"Mathematical Operations,Volatile Code"
Micro Tuber,,,unavailable,1/15/2021,Smart Contract,Solidity,"December 7, 2020","December 8, 2020",,,,,,
MonkeyNFT,,,unavailable,4/6/2021,Security Audit,Solidity,"April 03, 2021","April 03, 2021",,,,,,
Detrust Finance,,,unavailable,8/2/2021,Security Assessment,Solidity,2021-07-28T18:47:06-07:00,2021-08-02T04:34:59-07:00,3,,,,,"Language Specific,Logical Issue,Coding Style"
Artemis Vision,,,unavailable,6/1/2021,Security Assessment,Solidity,2021-05-18T09:08:28-04:00,2021-06-01T13:03:41-04:00,11,,,"Volatile Code,Centralization/Privilege,Logical Issue",,"Language Specific,Gas Optimization,Coding Style,Logical Issue"
Spider Network,SID,,unavailable,6/10/2021,Security Audit,Solidity,"June 08, 2021","June 12, 2021",,,,,,
Coinlegs,,,unavailable,10/6/2021,Security Assessment,Solidity,2021-09-26T09:20:39+08:00,2021-10-06T19:12:56+08:00,5,,Centralization / Privilege,,,Gas Optimization
Noel Dex,,,unavailable,4/8/2021,Security Audit,Solidity,"April 08, 2021","April 08, 2021",,,,,,
AOCO,AOCO,,unavailable,8/9/2021,Security Assessment,Solidity,2021-08-01T22:51:28-07:00,2021-08-08T23:34:30-07:00,9,,"Centralization / Privilege,Logical Issue",Logical Issue,,"Language Specific,Coding Style,Gas Optimization,Logical Issue"
iM Intelligent Mining,,,unavailable,6/15/2021,Security Assessment,Solidity,2021-08-23T09:19:57-07:00,2021-08-31T10:33:56-07:00,8,,,"Volatile Code,Centralization / Privilege,Mathematical Operations",,"Language Specific,Volatile Code"
Opdex,,,unavailable,8/5/2021,Security Assessment,C#,2021-07-12T06:35:32-07:00,2021-08-04T06:12:42-07:00,13,,,Control Flow,,"Inconsistency,Coding Style,Gas Optimization"
HN,HN,,unavailable,11/1/2021,Security Assessment,Solidity,2021-10-31T09:41:06+08:00,2021-11-01T10:57:27+08:00,19,,"Logical Issue,Centralization / Privilege","Control Flow,Logical Issue,Volatile Code",Logical Issue,"Language Specific,Coding Style,Gas Optimization,Control Flow,Logical Issue,Volatile Code"
Consensus Coin,CC,,unavailable,9/7/2021,Security Assessment,Solidity,2021-09-01T01:42:25-07:00,2021-09-07T04:33:05-07:00,10,,Centralization / Privilege,"Logical Issue,Centralization / Privilege",Centralization / Privilege,"Coding Style,Logical Issue"
FRS,,,unavailable,5/26/2021,Smart Contract,Solidity,"May 25, 2021","May 25, 2021",,,,,,
MaidCoin,MAID,,unavailable,8/2/2021,Security Assessment,Solidity,2021-07-18T18:53:19-04:00,2021-08-02T19:38:25-04:00,17,,Logical Issue,"Volatile Code,Logical Issue","Volatile Code,Data Flow","Language Specific,Volatile Code,Gas Optimization"
Parasset,ASET,,unavailable,7/27/2021,Security Assessment,Solidity,2021-04-26T22:43:34-07:00,2021-07-27T22:45:39-07:00,18,,"Language Specific,Logical Issue","Language Specific,Volatile Code,Coding Style,Logical Issue",,"Logical Issue,Coding Style,Gas Optimization,Volatile Code"
Evolution Land,,,unavailable,5/31/2021,Smart Contract,Solidity,"May 29, 2021","May 29, 2021",,,,,,
Hcaptcha,,,unavailable,10/24/2020,Smart Contract,Solidity,"June 26, 2020","September 15, 2020",,,,,,
Fortune(Fom),FOM,,unavailable,10/29/2021,Security Assessment,Solidity,2021-10-29T10:35:31+08:00,2021-10-29T19:12:54+08:00,12,,Logical Issue,"Volatile Code,Logical Issue",Logical Issue,"Coding Style,Gas Optimization,Volatile Code"
Arbswap,ARBS,,unavailable,11/8/2021,Security Assessment,Solidity,2021-11-04T19:32:05+08:00,2021-11-08T17:26:54+08:00,7,,Centralization / Privilege,,,"Volatile Code,Logical Issue,Language Specific,Gas Optimization"
BenSwap,,86,unavailable,9/14/2021,Security Assessment,Solidity,2021-09-01T18:12:22-07:00,2021-09-14T11:43:03-07:00,14,,Centralization / Privilege,"Logical Issue,Volatile Code,Mathematical Operations",Logical Issue,"Volatile Code,Coding Style,Logical Issue,Gas Optimization"
Rielcoin,,,unavailable,11/6/2021,Security Assessment,Solidity,2021-11-03T08:44:21-07:00,2021-11-05T10:30:33-07:00,1,,Centralization / Privilege,,,
Sister in Law,SIL,,unavailable,4/6/2021,Security Assessment,Solidity,2021-03-15T20:00:00,2021-04-06T20:00:00,25,,Logical Issue,"Coding Style,Gas Optimization,Logical Issue,Data Flow",,"Logical Issue,Coding Style,Gas Optimization"
LiquityFi,,,unavailable,4/22/2021,Smart Contract,Solidity,"April 22, 2021","April 22, 2021",,,,,,
Lydia Finance,LYD,,unavailable,6/13/2021,Security Assessment,Solidity,2021-05-30T17:39:40-07:00,2021-06-11T20:09:07-07:00,13,,"Volatile Code,Logical Issue,Centralization / Privilege","Logical Issue,Volatile Code",,"Logical Issue,Gas Optimization,Coding Style"
Rockets.Farm,ROCKET,,unavailable,8/5/2021,Security Assessment,Solidity,2021-08-01T23:01:38-07:00,2021-08-05T00:32:07-07:00,13,,Centralization / Privilege,"Logical Issue,Coding Style,Inconsistency","Logical Issue,Control Flow","Logical Issue,Gas Optimization,Volatile Code,Language Specific"
gold miner,,,unavailable,10/18/2021,Security Assessment,Solidity,2021-10-15T09:50:58+08:00,2021-10-18T09:58:59+08:00,4,,Centralization / Privilege,,,Logical Issue
Swan Finance,,,unavailable,2/22/2021,Security Audit,"Solidity, Yul","December 08, 2020","December 08, 2020",,,,,,
Yoda,,,unavailable,10/22/2021,Security Assessment,Solidity,2021-10-13T10:14:26+08:00,2021-10-22T16:12:14+08:00,21,,"Centralization / Privilege,Logical Issue","Volatile Code,Logical Issue","Logical Issue,Volatile Code","Language Specific,Gas Optimization,Coding Style,Logical Issue"
ChilliSwap,,,unavailable,4/13/2021,Security Audit,"Solidity, Yul","March 16, 2021","April 8, 2021",,,,,,
Soda Protocol,SODA,,unavailable,10/27/2021,Security Assessment,Rust,2021-09-21T12:44:23+08:00,2021-10-27T09:02:22+08:00,7,,,"Logical Issue,Control Flow,Mathematical Operations","Mathematical Operations,Logical Issue",Logical Issue
ZE*RA,ZENRA,,unavailable,10/14/2021,Security Assessment,Solidity,2021-09-28T13:10:11+08:00,2021-10-14T15:16:09+08:00,2,,Centralization / Privilege,,,
PLS2E,P2E,,unavailable,11/5/2021,Security Assessment,Solidity,2021-10-27T14:32:45+08:00,2021-11-05T11:39:15+08:00,7,,,Logical Issue,,Logical Issue
GIBX Swap,X,,unavailable,9/3/2021,Security Assessment,Solidity,2021-08-23T22:24:31-07:00,2021-09-03T03:09:16-07:00,42,,"Centralization / Privilege,Logical Issue","Logical Issue,Volatile Code",,"Logical Issue,Coding Style,Gas Optimization"
Chellit,CHE,,unavailable,11/3/2020,Security Assessment,C++,2020-10-17T11:03:35-04:00,2020-11-03T07:34:30-04:00,,,,,,
First Mall Token,,,unavailable,4/21/2021,Smart Contract,Solidity,"April 10, 2021","April 10, 2021",,,,,,
Kala Coin,KALA,,unavailable,11/11/2021,Security Assessment,Solidity,2021-10-25T11:48:38-07:00,2021-11-09T10:46:23-08:00,11,,Centralization / Privilege,"Volatile Code,Control Flow",Logical Issue,"Logical Issue,Volatile Code,Coding Style,Control Flow"
bloXmove,BLXM,,unavailable,10/5/2021,Security Assessment,Solidity,2021-09-13T13:14:19+08:00,2021-10-05T14:37:32+08:00,2,,Centralization / Privilege,,,Gas Optimization
BitMovio,,,unavailable,10/24/2020,Smart Contract,Solidity,"June 25, 2019","July 10, 2019",,,,,,
MetaFinance,MF,,unavailable,11/9/2021,Security Assessment,Solidity,2021-10-26T09:49:19+08:00,2021-11-09T09:08:22+08:00,5,,Centralization / Privilege,,,"Coding Style,Gas Optimization,Volatile Code"
DePocket,,,unavailable,10/4/2021,Security Assessment,Solidity,2021-09-28T14:21:12-04:00,2021-10-04T02:32:19-04:00,3,,Centralization / Privilege,Volatile Code,,Language Specific
Radio Finance,,,unavailable,3/24/2021,Security Audit,Solidity,"March 19, 2021","March 23, 2021",9,,,"O,L",,"V,O"
CCSwap,,,unavailable,5/7/2020,Security Assessment,Solidity,2021-07-31T11:06:38+08:00,2021-09-23T11:17:20+08:00,14,,Centralization / Privilege,"Gas Optimization,Logical Issue",Volatile Code,"Logical Issue,Volatile Code"
Chronicle,,,unavailable,6/21/2021,Security Assessment,Solidity,2021-05-07T04:33:00-07:00,2021-05-21T07:27:52-07:00,18,,,"Logical Issue,Volatile Code,Language Specific,Centralization / Privilege",Mathematical Operations,Language Specific
CheersLand,CHEERS,,unavailable,10/11/2021,Security Assessment,Solidity,2021-10-08T10:33:20+08:00,2021-10-11T10:27:20+08:00,6,,"Centralization / Privilege,Logical Issue",Volatile Code,Logical Issue,Gas Optimization
PKKT Limited,,,unavailable,5/27/2021,Smart Contract,Solidity,"May 25, 2021","May 25, 2021",,,,,,
ZuFinance,,,unavailable,9/15/2021,Security Assessment,Solidity,2021-09-07T09:18:07-07:00,2021-09-15T08:13:43-07:00,9,,Centralization / Privilege,,Logical Issue,"Volatile Code,Gas Optimization,Control Flow,Log,Coding Style"
AVME,AVME,,unavailable,7/28/2021,Security Assessment,Solidity,2021-07-18T21:12:27-04:00,2021-07-27T21:14:31-04:00,12,,Centralization / Privilege,Logical Issue,,"Gas Optimization,Volatile Code,Logical Issue,Language Specific,Coding Style"
TrustToken,,,unavailable,5/20/2021,Security Assessment,Solidity,2021-04-19T02:11:23-04:00,2021-05-20T04:13:27-04:00,24,,,"Language Specific,Control Flow,Logical Issue",Logical Issue,"Language Specific,Control Flow,Logical Issue,Coding Style"
Blin Metaverse,BLIN,,unavailable,9/15/2021,Security Assessment,Solidity,2021-09-05T18:08:54-07:00,2021-09-15T02:39:11-07:00,21,,Centralization / Privilege,"Logical Issue,Volatile Code",Logical Issue,"Logical Issue,Gas Optimization,Volatile Code"
Formation FI,FORM,,unavailable,9/2/2021,Security Assessment,Solidity,2021-08-13T04:18:46-04:00,2021-09-02T07:25:27-04:00,15,,Centralization / Privilege,"Volatile Code,Logical Issue","Logical Issue,Volatile Code","Logical Issue,Gas Optimization"
StarMon,SMON,,unavailable,8/31/2021,Security Assessment,Solidity,2021-08-26T20:29:26-07:00,2021-08-30T20:19:40-07:00,7,,Centralization / Privilege,Volatile Code,,"Language Specific,Coding Style,Optimization,Gas Optimization"
Jackpot,JPT,,unavailable,11/9/2021,Security Assessment,Solidity,2021-10-26T02:57:25-07:00,2021-11-08T21:40:02-08:00,5,,Centralization / Privilege,Logical Issue,,Coding Style
Kesef Finance,KSF,,unavailable,7/16/2021,Security Assessment,Solidity,2021-06-10T02:28:04-04:00,2021-07-16T12:22:36-04:00,15,"Volatile Code,Logical Issue",Logical Issue,Logical Issue,Logical Issue,"Logical Issue,Coding Style"
MOORE,MOORE,,unavailable,7/31/2021,Security Assessment,Solidity,2021-07-27T02:08:31-07:00,2021-07-31T04:27:46-07:00,15,,"Centralization / Privilege,Logical Issue","Volatile Code,Logical Issue,Control Flow",,"Language Specific,Gas Optimization,Control Flow,Coding Style,Volatile Code"
Magician,MBT,,unavailable,10/22/2021,Security Assessment,Solidity,2021-10-14T13:11:19+08:00,2021-10-22T11:08:15+08:00,9,,Centralization / Privilege,Logical Issue,Logical Issue,"Logical Issue,Mathematical Operations,Coding Style"
Monsta Infinite,,,unavailable,9/10/2021,Security Assessment,Solidity,2021-09-03T00:00:00-04:00,2021-09-07T15:24:09-04:00,21,,Centralization / Privilege,"Mathematical Operations,Coding Style","Volatile Code,Logical Issue","Coding Style,Volatile Code,Logical Issue,Gas Optimization"
Kudex.Finance,KUD,,unavailable,8/4/2021,Security Assessment,Solidity,2021-07-23T00:52:51-07:00,2021-08-04T02:06:10-07:00,5,,,"Mathematical Operations,Centralization / Privilege",Logical Issue,Coding Style
ThunderSwap Finance,TNDR,,unavailable,5/10/2021,Security Assessment,Solidity,2021-04-26T03:08:44-04:00,2021-05-10T18:28:15-04:00,15,,,"Logical Issue,Centralization / Privilege",,"Gas Optimization,Volatile Code,Coding Style"
Dank Protocol,DANK,,unavailable,10/9/2021,Security Assessment,Solidity,2021-10-02T09:18:19+08:00,2021-10-08T09:41:38+08:00,9,,Centralization / Privilege,Volatile Code,Logical Issue,Coding Style
Taxa Network,,,unavailable,4/22/2021,Security Assessment,Solidity,2021-04-13T20:00:00,2021-04-22T20:00:00,,,,,,
Subme,SUB,,unavailable,8/17/2021,Security Assessment,Solidity,2021-08-05T11:14:30-04:00,2021-08-17T13:13:29-04:00,27,,,Logical Issue,Volatile Code,"Language Specific,Gas Optimization,Coding Style"
ClosedSea,SEA,,unavailable,10/12/2021,Security Assessment,Solidity,2021-10-07T22:05:05+08:00,2021-10-12T14:39:58+08:00,7,,Centralization / Privilege,Volatile Code,Logical Issue,"Volatile Code,Gas Optimization"
Earnable,EARN,,unavailable,9/17/2021,Security Assessment,Solidity,2021-09-13T00:29:39-04:00,2021-09-17T00:29:39-04:00,12,Centralization / Privilege,Centralization / Privilege,"Logical Issue,Control Flow",,"Logical Issue,Coding Style,Volatile Code,Gas Optimization"
LiteDex,,,unavailable,10/18/2021,Security Assessment,Solidity,2021-09-27T09:45:00-07:00,2021-10-18T16:52:46-07:00,7,,"Centralization / Privilege,Logical Issue",Volatile Code,,"Coding Style,Gas Optimization"
Mobius Finance,MOT,,unavailable,8/24/2021,Preliminary Comments,Solidity,2021-06-13T09:41:39+08:00,2021-08-24T16:19:27+08:00,21,,"Control Flow,Centralization / Privilege","Logical Issue,Volatile Code,Gas Optimization","Logical Issue,Inconsistency","['Gas Optimization', None, 'Coding Style', 'Logical Issue']"
Balance.Finance,AACE,,unavailable,10/14/2021,Security Assessment,Solidity,2021-10-13T17:38:43+08:00,2021-10-14T19:17:00+08:00,12,,Centralization / Privilege,"Volatile Code,Logical Issue",,"Language Specific,Coding Style,Gas Optimization"
Bitgrit,,,unavailable,3/10/2021,Security Audit,"Solidity, Yul","January 15, 2021","January 24, 2021",,,,,,
Hotpotato,,,unavailable,2/8/2021,Security Audit,Solidity,"January 30, 2020","February 6, 2021",13,,"V,L","O,L,I,V",,"C,G"
Shiva Token,SHIVA,,unavailable,10/27/2021,Security Assessment,Solidity,2021-10-13T08:46:23-07:00,2021-10-27T15:11:11-07:00,14,Centralization / Privilege,Centralization / Privilege,"Logical Issue,Volatile Code,Inconsistency","Logical Issue,Gas Optimization","Gas Optimization,Coding Style"
BPLAY,BPLAY,,unavailable,6/22/2021,Security Assessment,Solidity,2021-03-22T13:15:46-07:00,2021-04-02T15:06:29-07:00,24,,Control Flow,"Mathematical Operations,Logical Issue,Volatile Code",,"Language Specific,Control Flow,Volatile Code,Inconsistency,Coding Style,Gas Optimization"
Bloq,,,unavailable,3/10/2021,Security Audit,"Solidity, Yul","February 13, 2021","February 15, 2021",,,,,,
TokensFarm,,,unavailable,9/14/2021,Security Assessment,Solidity,2021-08-17T08:49:18-04:00,2021-09-14T04:45:52-04:00,12,Logical Issue,"Centralization / Privilege,Logical Issue","Logical Issue,Volatile Code,Mathematical Operations",,"Gas Optimization,Logical Issue,Coding Style,Language Specific"
Match Token,,,unavailable,8/2/2021,Security Assessment,Solidity,2021-06-29T10:01:01-04:00,2021-08-02T12:18:04-04:00,26,Centralization / Privilege,Centralization / Privilege,"Volatile Code,Gas Optimization",Volatile Code,"Language Specific,Coding Style,Volatile Code,Gas Optimization"
Fishy Tank,FTE,,unavailable,10/22/2021,Security Assessment,Solidity,2021-10-14T08:51:59-07:00,2021-10-25T19:26:02-07:00,1,,Centralization / Privilege,,,
VirtualGod,VGOD,,unavailable,9/13/2021,Security Assessment,Solidity,2021-09-06T01:01:09-04:00,2021-09-13T07:10:58-04:00,15,,Centralization / Privilege,Logical Issue,,"['Coding Style', 'Control Flow', 'Logical Issue', None, 'Gas Optimization', 'Language Specific']"
Wemp Token,,,unavailable,10/19/2021,Security Assessment,Solidity,2021-09-10T19:11:58-07:00,2021-10-18T18:00:08-07:00,12,,Centralization / Privilege,"Volatile Code,Control Flow",Logical Issue,"Gas Optimization,Language Specific,Coding Style,Volatile Code"
Liquidify.io,,,unavailable,10/12/2021,Security Assessment,Solidity,2021-09-14T21:02:23-07:00,2021-10-12T13:06:31-07:00,16,,"Centralization / Privilege,Volatile Code,Logical Issue","Logical Issue,Volatile Code",,"Logical Issue,Coding Style,Language Specific,Mathematical Operations"
First Equites Token,,,unavailable,4/21/2021,Smart Contract,Solidity,"April 10, 2021"," April 10, 2021",,,,,,
Marsis,,,unavailable,6/11/2021,Smart Contract,Solidity,"May 29, 2021","June 10, 2021",,,,,,
Turtle Finance,,,unavailable,7/16/2021,Security Assessment,Solidity,2021-06-27T18:24:30-07:00,2021-07-16T20:30:27-07:00,23,,"Centralization / Privilege,Logical Issue",Logical Issue,,"Logical Issue,Coding Style,Gas Optimization"
DOG TOKEN,DOG TOKEN,,unavailable,8/19/2021,Security Assessment,Solidity,2021-08-15T07:43:16-04:00,2021-08-19T05:18:04-04:00,17,,Centralization / Privilege,"Logical Issue,Control Flow,Volatile Code,Centralization / Privilege",Logical Issue,"Language Specific,Coding Style,Gas Optimization,Volatile Code,Logical Issue,Control Flow"
ParaSwap,,,unavailable,6/7/2021,Security Assessment,"Solidity,Yul",2021-03-25T09:08:28-04:00,2021-05-06T13:03:41-04:00,17,,,Volatile Code,"Volatile Code,Control Flow","Coding Style,Control Flow,Gas Optimization,Language Specific,Inconsistency"
Rlink,RLT,,unavailable,10/11/2021,Security Assessment,Solidity,2021-09-23T15:01:33+08:00,2021-10-11T13:13:08+08:00,4,,Centralization / Privilege,,,"Volatile Code,Coding Style,Language Specific"
Gorilla,,,unavailable,5/31/2021,Security Assessment,Solidity,2021-04-19T11:15:49+08:00,2021-04-28T11:36:29+08:00,11,,Centralization / Privilege,Centralization / Privilege,,"Coding Style,Gas Optimization,Control Flow,Mathematical Operations"
Game Coin,GMEX,,unavailable,10/27/2021,Security Assessment,Solidity,2021-09-17T18:54:43-07:00,2021-10-29T04:07:25-07:00,20,,"Logical Issue,Centralization / Privilege","Control Flow,Logical Issue,Volatile Code",Logical Issue,"Language Specific,Coding Style,Gas Optimization,Control Flow,Volatile Code,Logical Issue"
FILWallet,,,unavailable,10/15/2021,Penetration Test,N/A,2021-10-01T20:00:00,2021-10-15T20:00:00,,,,,,
KingDeFi,KRW,,unavailable,6/29/2021,Security Assessment,Solidity,2021-08-18T08:05:41-04:00,2021-09-06T14:09:44-04:00,16,Centralization / Privilege,,"Gas Optimization,Logical Issue",,"Volatile Code,Gas Optimization,Coding Style,Logical Issue"
Vigoss,VGS,,unavailable,10/18/2021,Security Assessment,Solidity,2021-08-09T13:13:27+08:00,2021-10-18T14:04:05+08:00,12,,"Centralization / Privilege,Control Flow",Logical Issue,Logical Issue,"Logical Issue,Inconsistency"
PointPay,,,unavailable,6/25/2021,Security Assessment,Solidity,2021-06-16T23:31:25-07:00,2021-06-25T01:24:12-07:00,6,,,Language Specific,Logical Issue,"Language Specific,Centralization / Privilege,Coding Style"
Deerfi Protocol,,,unavailable,12/2/2020,Security Audit,Solidity,"November 18, 2020","November 23, 2020",,,,,,
CRYPTO WEST,,,unavailable,7/27/2021,Security Assessment,Solidity,2021-07-26T22:53:58-07:00,2021-07-27T22:33:59-07:00,8,,Mathematical Operations,,,"Gas Optimization,Language Specific,Coding Style,Logical Issue"
LockTrip,LOC,,unavailable,8/23/2018,Smart Contract,Solidity,2018-08-11T20:00:00,2018-08-23T20:00:00,,,,,,
ADCX,ADC,,unavailable,9/7/2021,Security Assessment,Solidity,2021-08-10T21:46:07-04:00,2021-09-02T03:48:01-04:00,5,,Centralization / Privilege,Logical Issue,,"Logical Issue,Gas Optimization"
BunnyArmy.io,BAC,,unavailable,10/23/2021,Security Assessment,Solidity,2021-10-18T11:03:18+08:00,2021-10-23T11:13:50+08:00,15,,Centralization / Privilege,Logical Issue,Logical Issue,"Compiler Error,Coding Style,Mathematical Operations,Logical Issue"
Safe Energy,ENERGYX,,unavailable,8/20/2021,Security Assessment,Solidity,2021-08-25T12:13:31-07:00,2021-08-19T21:29:30-07:00,7,,,Logical Issue,Data Flow,"Gas Optimization,Logical Issue,Coding Style"
Talent Token,TTX,,unavailable,6/18/2021,Security Assessment,Solidity,2021-06-09T13:55:58-04:00,2021-06-18T15:37:59-04:00,4,,,"Logical Issue,Language Specific",,"Language Specific,Centralization / Privilege"
DMEX,,,unavailable,3/31/2021,Smart Contract,Solidity,"March 31, 2021","March 31, 2021",,,,,,
Meow Swap,,,unavailable,8/26/2021,Preliminary Comments,Solidity,2021-08-19T13:31:30-07:00,2021-08-26T17:37:12-07:00,14,,"Centralization / Privilege,Logical Issue","Volatile Code,Logical Issue",,"Logical Issue,Coding Style,Volatile Code"
Ocean Mollu,OMO,,unavailable,11/2/2021,Security Assessment,Solidity,2021-10-25T13:07:33+08:00,2021-11-02T09:13:21+08:00,23,Logical Issue,Centralization / Privilege,"Compiler Error,Volatile Code",Logical Issue,"Logical Issue,Volatile Code,Coding Style,Gas Optimization"
Climb Token,,,unavailable,4/26/2021,Security Assessment,Solidity,2021-04-12T17:38:41-04:00,2021-04-12T17:38:41-04:00,9,,Volatile Code,Volatile Code,,Gas Optimization
iSwap,,,unavailable,7/20/2021,Security Assessment,Solidity,2021-10-11T13:42:32+08:00,2021-10-20T10:52:37+08:00,5,,,"Control Flow,Logical Issue",,"Logical Issue,Coding Style"
HUP.LIFE,HUP,,unavailable,6/14/2021,Security Assessment,Solidity,2021-05-30T18:07:33-04:00,2021-06-14T14:48:39-04:00,15,,,Logical Issue,,"Gas Optimization,Language Specific,Coding Style,Inconsistency"
Folds,,,unavailable,4/30/2021,Security Assessment,Solidity,2021-03-31T20:00:00,2021-04-30T20:00:00,,,,,,
Hillstone Finance,,,unavailable,6/28/2021,Security Assessment,Solidity,2021-06-08T03:20:36-04:00,2021-06-28T12:56:08-04:00,3,,,,,"Coding Style,Centralization / Privilege,Language Specific"
French ICO,FICO,,unavailable,4/9/2021,Security Assessment,"Solidity,Yul",2021-03-15T20:00:00,2021-04-09T20:00:00,,,,,,
Kingdome Game 4.0,KDG,,unavailable,10/7/2021,Security Assessment,Solidity,2021-10-06T19:34:45+08:00,2021-10-07T17:15:09+08:00,18,"Logical Issue,Centralization / Privilege","Logical Issue,Centralization / Privilege","Logical Issue,Volatile Code",Logical Issue,"Logical Issue,Coding Style,Language Specific"
Furia Finance,FURIA,,unavailable,7/12/2021,Security Assessment,Solidity,2021-07-01T18:10:54-07:00,2021-07-09T20:50:38-07:00,14,,"Centralization / Privilege,Logical Issue","Control Flow,Logical Issue,Volatile Code",,"Inconsistency,Logical Issue,Volatile Code,Gas Optimization,Coding Style"
Infinitee Finance,INFTEE,,unavailable,9/29/2021,Security Assessment,Solidity,2021-09-15T11:09:56-07:00,2021-09-29T13:46:16-07:00,7,,Centralization / Privilege,Volatile Code,,"Coding Style,Logical Issue"
Sienna,,,unavailable,4/28/2021,Security Assessment,Rust,2021-04-26T01:41:26-04:00,2021-06-29T03:48:18-04:00,53,,,Logical Issue,"Language Specific,Mathematical Operations,Logical Issue","Language Specific,Logical Issue"
SafeHamsters,SAFEHAMSTERS,,unavailable,7/29/2021,Security Assessment,Solidity,2021-07-22T04:23:06-07:00,2021-07-29T03:59:58-07:00,13,,"Centralization / Privilege,Logical Issue","Logical Issue,Control Flow",,"Language Specific,Gas Optimization,Logical Issue,Volatile Code,Coding Style"
T1 Racing,T1,,unavailable,9/19/2021,Security Assessment,Solidity,2021-09-19T13:11:54+08:00,2021-09-19T23:14:27+08:00,5,,,"Logical Issue,Control Flow",,"Coding Style,Volatile Code"
MMXN,,,unavailable,3/18/2020,Smart Contract,Solidity,"June 16, 2021","June 18, 2021",,,,,,
Authmen,,,unavailable,4/15/2021,Smart Contract,Solidity,"April 14, 2021"," April 14, 2021",,,,,,
ClearSight,,81,unavailable,9/25/2021,Security Assessment,Solidity,2021-09-07T07:53:03-07:00,2021-09-24T19:06:59-07:00,4,Centralization / Privilege,,"Volatile Code,Mathematical Operations",,Gas Optimization
New Origin,NOC,,unavailable,11/8/2021,Security Assessment,Solidity,2021-11-06T11:43:17+08:00,2021-11-08T09:32:20+08:00,4,,Centralization / Privilege,,,"Logical Issue,Language Specific,Gas Optimization"
SubDAO Network,GOV,,unavailable,10/5/2021,Security Assessment,Solidity,2021-10-04T17:29:32+08:00,2021-10-05T16:29:00+08:00,3,,Centralization / Privilege,,,"Language Specific,Gas Optimization"
BNByields,,,unavailable,11/1/2021,Security Assessment,Solidity,2021-10-30T18:31:14-07:00,2021-11-01T11:30:46-07:00,3,"Logical Issue,Centralization / Privilege",,Logical Issue,,
Lecube,,,unavailable,9/14/2021,Smart Contract,Solidity,"March 2, 2021","March 26, 2021",,,,,,
YouSwap,,,unavailable,4/21/2021,Security Assessment,Solidity,"April 28, 2021","April 28, 2021",,,,,,
E2P,,,unavailable,1/18/2021,Smart Contract,Solidity,"December 16, 2020","December 18, 2020",,,,,,
Heroes of NFT,,,unavailable,9/27/2021,Security Assessment,Solidity,2021-09-13T16:34:09-04:00,2021-09-27T15:41:41-04:00,25,,"Logical Issue,Centralization / Privilege","Volatile Code,Logical Issue",,"Language Specific,Volatile Code,Gas Optimization,Mathematical Operations,Coding Style,Logical Issue"
ELONAID,ELONAID Token,,unavailable,7/22/2021,Security Assessment,Solidity,2021-07-06T10:28:27-07:00,2021-07-21T19:36:02-07:00,8,,Centralization / Privilege,"Control Flow,Logical Issue",,"Coding Style,Logical Issue,Gas Optimization"
CDz Exchange,CDZ,,unavailable,8/11/2021,Security Assessment,Solidity,2021-08-12T22:08:10-04:00,2021-09-02T22:58:49-04:00,8,,,Centralization / Privilege,Centralization / Privilege,"Language Specific,Volatile Code,Gas Optimization"
Cash Ape Rise,CAR,,unavailable,7/22/2021,Security Assessment,Solidity,2021-07-12T15:07:06-04:00,2021-07-21T23:23:17-04:00,12,,Centralization / Privilege,"Control Flow,Logical Issue,Mathematical Operations",,"Logical Issue,Coding Style"
ButterSwap,BUTTER,,unavailable,6/9/2021,Security Assessment,Solidity,2021-08-10T00:22:57-04:00,2021-08-17T01:38:20-04:00,7,,,Volatile Code,Centralization / Privilege,"Gas Optimization,Coding Style,Logical Issue"
SON Of SHIB,,,unavailable,10/27/2021,Security Assessment,Solidity,2021-10-18T10:23:31-07:00,2021-10-27T14:26:52-07:00,13,Logical Issue,"Centralization / Privilege,Control Flow,Logical Issue","Logical Issue,Volatile Code,Coding Style",,"Inconsistency,Coding Style"
Pinecone Finance,PCT,,unavailable,9/28/2021,Security Assessment,Solidity,2021-09-18T15:02:48+08:00,2021-09-28T10:47:54+08:00,18,,Centralization / Privilege,Compiler Error,Logical Issue,"Gas Optimization,Language Specific,Coding Style,Volatile Code,Logical Issue"
Coinversation-KACO,KAC,,unavailable,10/13/2021,Security Assessment,Solidity,2021-09-01T09:17:37+08:00,2021-10-12T11:46:18+08:00,11,,"Logical Issue,Centralization / Privilege",Volatile Code,,"Gas Optimization,Coding Style,Logical Issue"
Moneta,MNA,,unavailable,6/14/2021,Security Audit,Solidity,"June 08, 2021","June 12, 2021",,,,,,
Babylons,BABI,,unavailable,9/10/2021,Security Assessment,Solidity,2021-07-10T07:47:25-07:00,2021-09-09T19:45:54-07:00,7,,Centralization / Privilege,"Centralization / Privilege,Mathematical Operations,Volatile Code",,Coding Style
UniArts Network's Impossible art formula gallery,UARTs,,unavailable,11/3/2021,Security Assessment,Solidity,2021-10-23T09:56:55+08:00,2021-11-03T14:13:25+08:00,22,Logical Issue,"Logical Issue,Centralization / Privilege","Volatile Code,Logical Issue","Logical Issue,Volatile Code","Volatile Code,Coding Style"
VDOGE,,,unavailable,5/18/2021,Smart Contract,Solidity,"May 17, 2021"," May 17, 2021",,,,,,
The Legend of Deification,TLOD,,unavailable,8/25/2021,Security Assessment,Solidity,2021-08-19T23:39:17-04:00,2021-09-08T04:12:54-04:00,4,,Centralization / Privilege,,"Volatile Code,Logical Issue",Language Specific
VOXIES,,,unavailable,10/1/2021,Security Assessment,Solidity,2021-09-29T11:31:39-07:00,2021-10-01T14:55:53-07:00,3,,Centralization / Privilege,,,
Pando browser,,,unavailable,4/4/2021,Security Audit,"Solidity, Yul","March 26, 2021","March 26, 2021",,,,,,
DOTC PRO,,,unavailable,6/11/2021,Smart Contract,Solidity,"May 18, 2021","May 19, 2021",,,,,,
Orenda Protocol,,,unavailable,10/21/2021,Security Assessment,Solidity,2021-07-16T20:52:39-07:00,2021-07-16T15:52:48-07:00,15,Centralization / Privilege,"Control Flow,Centralization / Privilege,Logical Issue","Control Flow,Mathematical Operations,Centralization / Privilege",,"Language Specific,Gas Optimization,Volatile Code"
MilitiaGame,MILIT,,unavailable,10/23/2021,Security Assessment,Solidity,2021-10-22T14:54:59+08:00,2021-10-23T09:15:47+08:00,14,,Centralization / Privilege,"Control Flow,Volatile Code,Logical Issue",Logical Issue,"Language Specific,Gas Optimization,Volatile Code,Logical Issue"
Universe Finance,,,unavailable,8/14/2021,Security Assessment,Solidity,2021-08-05T22:37:22-07:00,2021-08-13T22:56:19-07:00,7,,Centralization / Privilege,Logical Issue,,"Control Flow,Coding Style,Logical Issue"
Santacash,,,unavailable,2/22/2021,Security Audit," Solidity, Yul","February 05, 2021","February 18, 2021",,,,,,
Elemon,ELMON,,unavailable,10/15/2021,Security Assessment,Solidity,2021-09-20T08:40:12-07:00,2021-10-14T20:43:49-07:00,13,,Centralization / Privilege,Logical Issue,Mathematical Operations,"Coding Style,Logical Issue"
Tronhome,,,unavailable,4/13/2021,Security Audit,Solidity,"March 16, 2020","April 7, 2021",,,,,,
BuffSwap,,,unavailable,10/4/2021,Security Assessment,Solidity,2021-09-23T11:42:12-07:00,2021-10-04T14:48:41-07:00,3,,Centralization / Privilege,,,Gas Optimization
Ondo Finance,,,unavailable,5/24/2021,Security Assessment,Solidity,2021-04-12T12:16:32-04:00,2021-04-19T12:16:32-04:00,,,,,,
AOK,,,unavailable,11/3/2020,Security Audit,"Proprietary, C++",2020-10-17T14:24:00Z,2020-11-03T14:24:00Z,,,,,,
Overline,,,unavailable,6/2/2021,Security Assessment,"Solidity,Yul",2021-01-29T09:08:28-04:00,2021-02-09T13:03:41-04:00,20,,Mathematical Operations,"Volatile Code,Logical Issue",Volatile Code,"Language Specific,Magic Numbers,Gas Optimization,Coding Style,Volatile Code,Dead Code,Logical Issue"
Sadbaby,,,unavailable,10/1/2021,Security Assessment,Solidity,2021-09-24T08:06:40-07:00,2021-10-01T14:56:50-07:00,7,,Centralization / Privilege,,Control Flow,"Logical Issue,Language Specific,Coding Style"
Duet/Zerogoki,DUET,,unavailable,7/12/2021,Security Assessment,Solidity,2021-06-30T10:00:05-07:00,2021-07-11T19:03:11-07:00,13,,Centralization / Privilege,"Coding Style,Logical Issue",,"Gas Optimization,Logical Issue,Coding Style"
Magicbox,MB,,unavailable,9/3/2021,Security Assessment,Solidity,2021-08-19T09:55:50+08:00,2021-09-03T19:38:51+08:00,6,,"Centralization / Privilege,Logical Issue",,Volatile Code,"Logical Issue,Language Specific,Coding Style"
PrnRocket,PRNROCKET,,unavailable,7/15/2021,Security Assessment,Solidity,2021-06-28T19:35:47-04:00,2021-07-14T21:01:07-04:00,14,,Centralization / Privilege,"Control Flow,Inconsistency,Volatile Code",Logical Issue,"Coding Style,Gas Optimization,Inconsistency,Volatile Code,Logical Issue"
Synapse Network,SNP,,unavailable,8/19/2021,Security Assessment,Solidity,2021-08-02T07:12:53-04:00,2021-08-19T03:28:15-04:00,15,Logical Issue,Centralization / Privilege,Logical Issue,,"Gas Optimization,Language Specific,Logical Issue,Coding Style"
SurgeBTC,,,unavailable,9/17/2021,Security Assessment,Solidity,2021-08-31T14:33:41+08:00,2021-09-17T09:17:11+08:00,3,,Centralization / Privilege,Logical Issue,,Logical Issue
Joinswap,JOIN,,unavailable,10/1/2021,Security Assessment,Solidity,2021-09-19T14:26:01+08:00,2021-10-01T15:07:15+08:00,16,,Centralization / Privilege,"Volatile Code,Logical Issue",,"Coding Style,Gas Optimization,Language Specific,Logical Issue"
ENVOY Network,,,unavailable,9/14/2021,Security Assessment,Solidity,2021-08-30T12:39:04-04:00,2021-09-14T00:43:36-04:00,4,,"Centralization / Privilege,Logical Issue",Volatile Code,,Gas Optimization
Garfield.Finance,,,unavailable,5/31/2021,Smart Contract,Solidity,"May 29, 2021","May 29, 2021",,,,,,
Pixl Coin,PXLC,,unavailable,9/24/2021,Security Assessment,Solidity,2021-09-02T14:41:26-04:00,2021-09-24T15:02:02-04:00,15,,"Centralization / Privilege,Control Flow","Logical Issue,Volatile Code","Volatile Code,Logical Issue","Coding Style,Gas Optimization,Volatile Code"
PiMoon,PiMoon,,unavailable,8/23/2021,Security Assessment,Solidity,2021-08-21T07:50:27-04:00,2021-08-23T07:28:41-04:00,15,,"Centralization / Privilege,Logical Issue","Control Flow,Logical Issue",,"Coding Style,Gas Optimization,Volatile Code,Logical Issue,Control Flow"
NFT STARS,,,unavailable,5/19/2021,Smart Contract,Solidity,"May 19, 2021"," May 19, 2021",,,,,,
DogBSC,,,unavailable,5/19/2021,Smart Contract,Solidity,"May 18, 2021"," May 18, 2021",,,,,,
Hashbon,HASH,,unavailable,10/7/2021,Security Assessment,Solidity,2021-08-26T16:37:18-04:00,2021-10-07T22:54:20-04:00,8,,Centralization / Privilege,Centralization / Privilege ,,"Language Specific,Gas Optimization,Coding Style"
Cryptospace Finance,CRY,,unavailable,8/5/2021,Security Assessment,Solidity,2021-07-20T21:33:42-04:00,2021-08-04T21:41:42-04:00,15,,Centralization / Privilege,"Logical Issue,Volatile Code",Logical Issue,"Volatile Code,Control Flow,Coding Style,Logical Issue,Gas Optimization"
HeroWorld,hero,,unavailable,11/1/2021,,,,,,,,,,
HyperGraph,,,unavailable,5/26/2021,Smart Contract,Solidity,"May 26, 2021","May 26, 2021",,,,,,
OakFarm,OKF,,unavailable,8/17/2021,Security Assessment,Solidity,2021-08-08T20:26:20-07:00,2021-08-16T18:31:27-07:00,22,,Centralization / Privilege,"Logical Issue,Volatile Code",,"Coding Style,Gas Optimization,Logical Issue"
Flux,,,unavailable,3/8/2020,Security Assessment,Solidity,2021-06-19T13:36:34+08:00,2021-07-14T16:24:30+08:00,30,Logical Issue,Logical Issue,"Logical Issue,Mathematical Operations",,"Logical Issue,Language Specific,Coding Style,Gas Optimization"
Bbr Finance,,,unavailable,3/10/2021,Security Audit,"Solidity, Yul","February 12, 2021","February 23, 2021",,,,,,
ETHST,,,unavailable,5/31/2021,Security Assessment,Solidity,2021-05-12T22:08:34-07:00,2021-05-28T22:26:16-07:00,18,,Centralization / Privilege,"Control Flow,Logical Issue,Inconsistency",,"Coding Style,Logical Issue,Optimizaition,Mathematical Operations,Gas Optimization"
Gamefox Infinity,GFI,,unavailable,10/12/2021,Security Assessment,Solidity,2021-10-12T13:33:12+08:00,2021-10-12T15:00:31+08:00,25,,"Centralization / Privilege,Logical Issue",Volatile Code,,"Coding Style,Language Specific,Gas Optimization,Logical Issue,Volatile Code"
Ziktalk,ZIK,,unavailable,5/5/2021,Security Assessment,"Solidity,Yul",2021-04-20T20:00:00,2021-05-05T20:00:00,,,,,,
Bami,,,unavailable,4/20/2021,Security Audit,"Solidity, Yul","April 8, 2021","April 19, 2021",,,,,,
PigToken,PIG,,unavailable,8/13/2021,Security Assessment,Solidity,2021-08-02T04:06:57-04:00,2021-08-13T07:41:48-04:00,16,,Centralization / Privilege,"Logical Issue,Control Flow,Volatile Code",Logical Issue,"Language Specific,Coding Style,Gas Optimization,Control Flow,Volatile Code,Logical Issue"
Hotpot Swap,,,unavailable,9/2/2021,Security Assessment,Solidity,2021-08-23T13:36:34+08:00,2021-09-23T10:40:40+08:00,15,,"Centralization / Privilege,Control Flow","Volatile Code,Mathematical Operations,Logical Issue","Volatile Code,Logical Issue",Coding Style
Ideamarket,,,unavailable,11/3/2021,Security Assessment,Solidity,2021-10-04T14:05:30-07:00,2021-11-03T07:47:06-07:00,12,,Centralization / Privilege,"Volatile Code,Logical Issue",,Coding Style
Slime Finance,SLME,,unavailable,3/25/2021,Security Assessment,Solidity,2021-03-08T12:15:02-05:00,2021-03-25T13:28:36-04:00,28,"Control Flow,Gas Optimization","Volatile Code,Logical Issue",Logical Issue,,"Coding Style,Gas Optimization,Logical Issue"
SumSwap,,,unavailable,3/18/2021,Security Assessment,Solidity,2021-09-17T09:34:26+08:00,2021-10-26T11:31:14+08:00,25,Logical Issue,Centralization / Privilege,"Volatile Code,Mathematical Operations,Logical Issue,Coding Style",Logical Issue,"Volatile Code,Language Specific,Coding Style,Gas Optimization,Logical Issue"
NFT Journey to the West,,,unavailable,4/21/2021,Smart Contract,Solidity,"January 01, 2021"," April 19, 2021",,,,,,
Kylin Swap,,,unavailable,4/21/2021,Security Assessment,Solidity,2021-04-01T17:19:43-07:00,2021-04-11T21:00:00-07:00,27,Centralization / Privilege,,"Control Flow,Volatile Code,Compiler Error",,"Gas Optimization,Volatile Code,Control Flow"
Mint,MINT,,unavailable,2/16/2021,Security Assessment,Solidity,2021-02-08T20:00:00,2021-02-16T20:00:00,,,,,,
Kawaii Islands,KWT,,unavailable,11/11/2021,Security Assessment,Solidity,2021-09-17T01:13:22-07:00,2021-11-10T03:14:49-08:00,10,,Centralization / Privilege,Logical Issue,,"Volatile Code,Coding Style,Logical Issue"
ak messenger,AKME,,unavailable,7/20/2021,Security Assessment,Solidity,2021-07-09T08:53:24-04:00,2021-07-20T13:43:59-04:00,26,Compiler Error,"Logical Issue,Language Specific","Volatile Code,Logical Issue",Centralization / Privilege,"Coding Style,Language Specific,Gas Optimization,Inconsistency,Logical Issue,Mathematical Operations"
Cribnb,,,unavailable,5/10/2021,Security Assessment,"Solidity,Yul",2021-04-26T20:00:00,2021-05-10T20:00:00,,,,,,
E-motive Auto Exchange,EMOT,,unavailable,7/14/2021,Security Assessment,Solidity,2021-07-08T04:55:10-07:00,2021-07-14T09:21:05-07:00,7,,Centralization / Privilege,,,"Language Specific,Gas Optimization,Logical Issue"
Gainswap,,,unavailable,1/15/2021,Security Audit,Solidity,"December 4, 2020","December 9, 2020",,,,,,
UNIC,UNIC,,unavailable,10/24/2020,Security Audit,"Solidity, Yul","December 4, 2020","December 6, 2020",,,,,,
Lucky Lion,LUCKY,,unavailable,10/12/2021,Security Assessment,Solidity,2021-09-27T09:45:57-07:00,2021-10-12T07:37:28-07:00,9,,Centralization / Privilege,Volatile Code,,Gas Optimization
Reality Cards,,,unavailable,6/25/2021,Security Assessment,Solidity,2021-06-14T08:14:00-07:00,2021-06-25T11:11:46-07:00,31,,Control Flow,"Volatile Code,Coding Style","Control Flow,Volatile Code,Inconsistency","Volatile Code,Business Model,Coding Style,Gas Optimization,Inconsistency,Logical Issue"
Risk Harbor,,,unavailable,4/27/2021,Security Assessment,Solidity,2021-04-01T12:31:13-04:00,2021-04-27T19:05:09-04:00,32,,"Control Flow,Business Model","Logical Issue,Control Flow,Volatile Code,Language Specific",,"Coding Style,Volatile Code,Gas Optimization"
Project Dogex,DOGEX,,unavailable,10/4/2021,Security Assessment,Solidity,2021-09-27T09:43:49-07:00,2021-10-04T14:46:33-07:00,11,,Centralization / Privilege,"Logical Issue,Control Flow",,"Coding Style,Logical Issue,Gas Optimization,Volatile Code"
Mello,Mello,,unavailable,6/2/2021,Security Assessment,Solidity,2021-05-13T12:27:31-04:00,2021-06-02T15:24:41-04:00,5,,"Mathematical Operations,Logical Issue",Mathematical Operations,,"Language Specific,Coding Style"
DeFi Launch,DLAUNCH,,unavailable,11/2/2021,Security Assessment,Solidity,2021-10-18T10:18:12+08:00,2021-11-02T09:54:03+08:00,11,,Centralization / Privilege,Volatile Code,Volatile Code,"Gas Optimization,Logical Issue,Coding Style"
Bit.Country,NUUM,,unavailable,11/6/2021,Security Assessment,Solidity,2021-09-26T01:09:29-07:00,2021-11-05T18:55:01-07:00,7,,"Logical Issue,Centralization / Privilege","Coding Style,Logical Issue",,Gas Optimization
Boss Rally,,,unavailable,9/23/2021,Security Assessment,Solidity,2021-09-20T14:28:02+08:00,2021-09-23T09:06:24+08:00,22,,"Centralization / Privilege,Logical Issue",Volatile Code,,"Coding Style,Language Specific,Gas Optimization,Logical Issue,Volatile Code"
Solo Top,,,unavailable,4/21/2021,Smart Contract,Solidity,"April 16, 2021","April 16, 2021",,,,,,
Meli games,,,unavailable,11/2/2021,Security Assessment,Solidity,2021-10-15T14:25:24+08:00,2021-11-02T11:45:24+08:00,58,,"Centralization / Privilege,Logical Issue",Volatile Code,,"Language Specific,Coding Style,Gas Optimization,Control Flow,Volatile Code"
Ramen Swap,,,unavailable,3/10/2021,Security Audit,Solidity,"March 1, 2021","March 8, 2021",13,L,"V,L",L,,"C,L,O"
Defrost Finance,H2O,,unavailable,11/10/2021,Security Assessment,Solidity,2021-10-25T18:50:20+08:00,2021-11-10T09:30:29+08:00,24,Logical Issue,Centralization / Privilege,"Volatile Code,Logical Issue",,"Language Specific,Gas Optimization,Coding Style,Logical Issue,Control Flow"
JOJO,JOJO,,unavailable,7/27/2021,Security Assessment,Solidity,2021-07-05T23:30:33-07:00,2021-07-26T18:02:59-07:00,18,,Centralization / Privilege,"Control Flow,Volatile Code,Centralization / Privilege,Logical Issue",,"Language Specific,Gas Optimization,Coding Style,Volatile Code,Logical Issue,Control Flow"
PRDT Finance,,,unavailable,10/29/2021,Security Assessment,Solidity,2021-10-11T11:31:45-07:00,2021-10-28T05:52:17-07:00,27,,"Language Specific,Logical Issue,Centralization / Privilege","Volatile Code,Logical Issue","Logical Issue,Control Flow,Volatile Code","Coding Style,Inconsistency,Gas Optimization,Magic Numbers,Mathematical Operations,Logical Issue"
Swaperry,PERRY,,unavailable,8/2/2020,Security Assessment,Solidity,2021-07-17T01:50:27-04:00,2021-08-02T02:48:54-04:00,18,,"Centralization / Privilege,Control Flow","Data Flow,Logical Issue",Logical Issue,"Language Specific,Gas Optimization,Logical Issue,Coding Style"
Rottschild,ROTTS,,unavailable,10/20/2021,Security Assessment,Solidity,2021-10-14T01:10:19-07:00,2021-10-20T19:56:07-07:00,8,,Centralization / Privilege,"Volatile Code,Logical Issue",Language Specific,"Gas Optimization,Volatile Code,Logical Issue"
Revive Project,PULSE,,unavailable,8/27/2021,Security Assessment,Solidity,2021-07-28T11:24:16-07:00,2021-08-27T06:49:11-07:00,21,,"Centralization / Privilege,Volatile Code","Centralization / Privilege,Mathematical Operations,Control Flow,Logical Issue,Volatile Code",,"Coding Style,Volatile Code,Control Flow"
Monster Buffer,BUF,,unavailable,8/25/2021,Security Assessment,Solidity,2021-08-17T21:15:27-04:00,2021-08-23T21:36:06-04:00,27,Logical Issue,Centralization / Privilege,"Compiler Error,Logical Issue,Centralization / Privilege",Logical Issue,"Coding Style,Gas Optimization,Volatile Code,Language Specific"
Unstoppable.money,,,unavailable,5/24/2021,Penestration Test ,,"December 12, 2020","February 05, 2021",,,,,,
LoserChick,,,unavailable,6/16/2021,Security Assessment,Solidity,2021-06-08T18:20:11-07:00,2021-06-13T02:00:01-07:00,14,,"Logical Issue,Centralization / Privilege","Logical Issue,Mathematical Operations,Coding Style","Volatile Code,Centralization / Privilege","Coding Style,Gas Optimization,Logical Issue"
ByteNext ,,,unavailable,4/14/2021,Security Audit,"Solidity, Yul","March 18, 2021","April 6, 2021",,,,,,
Doraemon-NFT,DOMON,,unavailable,8/4/2021,Security Assessment,Solidity,2021-07-29T22:24:46-07:00,2021-08-04T04:42:42-07:00,19,,"Logical Issue,Centralization / Privilege","Logical Issue,Control Flow,Volatile Code",,"Language Specific,Coding Style,Gas Optimization,Control Flow,Volatile Code,Logical Issue"
AST.Finance,AST,,unavailable,8/2/2021,Security Assessment,Solidity,2021-08-02T01:20:42-04:00,2021-08-05T07:02:55-04:00,15,,Centralization / Privilege,"Inconsistency,Logical Issue,Volatile Code,Coding Style","Logical Issue,Control Flow","Logical Issue,Gas Optimization,Volatile Code,Language Specific"
HyperJump,,,unavailable,5/26/2021,Security Assessment,Solidity,2021-04-09T16:17:10-04:00,2021-05-26T09:47:00-04:00,23,C,"C,V,L",L,,"C,G,V,L"
OpenFire,FOE,,unavailable,7/14/2021,Security Assessment,Solidity,2021-06-27T09:07:04+08:00,2021-07-14T10:42:15+08:00,16,,"Centralization / Privilege,Volatile Code",Logical Issue,Centralization / Privilege,"Logical Issue,Gas Optimization,Optimization,Centralization / Privilege,Coding Style"
Sovi Finance,,,unavailable,2/10/2021,Security Audit,Solidity,"January 6, 2021","January 10, 2021",14,L,L,"O,L,I",,"O,G,C"
Planet Sandbox,PSB,,unavailable,9/29/2021,Security Assessment,Solidity,2021-09-23T18:23:37-07:00,2021-09-29T11:21:19-07:00,10,,"Centralization / Privilege,Volatile Code",Coding Style,,"Logical Issue,Language Specific"
ShopNEXT,,,unavailable,10/19/2021,Security Assessment,Solidity,2021-10-04T14:09:10-07:00,2021-10-19T10:55:07-07:00,21,,"Centralization / Privilege,Mathematical Operations","Logical Issue,Volatile Code,Gas Optimization","Logical Issue,Mathematical Operations","Gas Optimization,Language Specific,Volatile Code,Coding Style"
JSN,JSN,,unavailable,10/14/2021,Security Assessment,Solidity,2021-10-09T11:45:21+08:00,2021-10-14T19:35:28+08:00,4,,Centralization / Privilege,,Logical Issue,
LuckyChip,,,unavailable,10/5/2021,Security Assessment,Solidity,2021-09-07T07:55:04-07:00,2021-10-04T13:05:09-07:00,18,,"Centralization / Privilege,Volatile Code,Mathematical Operations","Volatile Code,Logical Issue",Control Flow,"Logical Issue,Coding Style,Volatile Code"
Hamdan platform,HMC,,unavailable,10/18/2021,Security Assessment,Solidity,2021-10-06T10:30:56+08:00,2021-10-18T15:04:26+08:00,25,Volatile Code,Centralization / Privilege,"Volatile Code,Logical Issue",,"Volatile Code,Coding Style,Logical Issue,Gas Optimization,Language Specific"
BNB Cash,BNBCH,,unavailable,10/15/2021,Preliminary Comments,Solidity,2021-10-11T14:58:53+08:00,2021-10-15T11:10:25+08:00,13,,Centralization / Privilege,"Logical Issue,Control Flow",,"Coding Style,Control Flow,Gas Optimization,Volatile Code,Logical Issue"
Ginza Network,GINZA,,unavailable,9/7/2021,Security Assessment,Solidity,2021-08-12T07:29:38-04:00,2021-09-04T02:41:17-04:00,24,,"Volatile Code,Logical Issue,Centralization / Privilege",Logical Issue,,"Logical Issue,Gas Optimization,Coding Style,Language Specific"
The Mining Token,TMT,,unavailable,10/26/2021,Security Assessment,Solidity,2021-08-25T09:12:21+08:00,2021-10-26T14:26:29+08:00,15,,"Centralization / Privilege,Logical Issue","Volatile Code,Logical Issue",Logical Issue,"Coding Style,Language Specific"
KeplerSwap,,,unavailable,9/22/2021,Security Assessment,Solidity,2021-07-05T01:36:36-07:00,2021-09-21T17:24:38-07:00,60,"Centralization / Privilege,Logical Issue,Volatile Code","Logical Issue,Centralization / Privilege,Volatile Code","Volatile Code,Control Flow,Logical Issue","Mathematical Operations,Volatile Code,Logical Issue,Inconsistency","Language Specific,Gas Optimization,Coding Style,Logical Issue,Volatile Code"
LuckTogether,LUCK,,unavailable,7/9/2021,Security Assessment,Solidity,2021-06-30T19:47:53-07:00,2021-07-16T06:15:26-07:00,14,,Centralization / Privilege,"Logical Issue,Centralization / Privilege,Volatile Code",,"Coding Style,Gas Optimization"
Walnut,Nutbox,,unavailable,10/25/2021,Security Assessment,Solidity,2021-10-04T10:18:37+08:00,2021-10-29T14:33:50+08:00,34,Logical Issue,"Centralization / Privilege,Logical Issue","Volatile Code,Logical Issue",,"Language Specific,Gas Optimization,Optimization,Logical Issue,Control Flow,Coding Style"
BUDO II,BUDO,,unavailable,9/15/2021,Security Assessment,Solidity,2021-09-15T00:43:09-07:00,2021-09-15T20:44:16-07:00,15,,"Centralization / Privilege,Logical Issue","Logical Issue,Control Flow,Volatile Code",,"Volatile Code,Logical Issue,Gas Optimization"
PokerFi,PK,,unavailable,8/20/2021,Security Assessment,Solidity,2021-07-26T16:42:07-07:00,2021-08-19T23:39:00-07:00,21,,"Centralization / Privilege,Logical Issue",Logical Issue,Logical Issue,Logical Issue
Thor,THOR,,unavailable,8/23/2021,Security Assessment,Solidity,2021-08-02T22:07:14-07:00,2021-09-16T20:37:26-07:00,23,Logical Issue,"Logical Issue,Centralization / Privilege","Language Specific,Volatile Code,Gas Optimization","Logical Issue,Centralization / Privilege","Gas Optimization,Inconsistency,Coding Style,Logical Issue"
Distinct Fortune,Distinct Fortune,,unavailable,9/28/2021,Security Assessment,Solidity,2021-09-22T16:10:05+08:00,2021-09-28T10:55:53+08:00,13,,Centralization / Privilege,Volatile Code,,"Coding Style,Gas Optimization,Volatile Code,Logical Issue"
niuniu.city,Niuniu,,unavailable,11/4/2021,Security Assessment,Solidity,2021-11-02T16:37:03+08:00,2021-11-04T10:59:52+08:00,9,,"Centralization / Privilege,Volatile Code,Logical Issue",Volatile Code,,Volatile Code
Sky Fort,SKYF,,unavailable,8/12/2021,Security Assessment,Solidity,2021-07-16T17:53:06-07:00,2021-08-11T22:55:19-07:00,23,,"Centralization / Privilege,Logical Issue","Centralization / Privilege,Logical Issue,Control Flow,Volatile Code","Volatile Code,Language Specific","Language Specific,Logical Issue,Mathematical Operations,Coding Style,Gas Optimization"
CoinSwap.io,COINS,,unavailable,9/9/2021,Security Assessment,Solidity,2021-08-14T09:57:13+08:00,2021-10-20T14:07:39+08:00,31,,"Logical Issue,Centralization / Privilege","Volatile Code,Logical Issue",Logical Issue,"Language Specific,Coding Style,Gas Optimization,Logical Issue"
Psyduck Inu,PSYDUCKINU,87,unavailable,11/10/2021,,,,,,,,,,
DM5,DM5,,unavailable,8/21/2021,Security Assessment,Solidity,2021-08-08T03:57:41-07:00,2021-08-21T00:54:40-07:00,65,,"Centralization / Privilege,Logical Issue","Centralization / Privilege,Volatile Code,Logical Issue",,"Language Specific,Coding Style,Gas Optimization,Volatile Code,Logical Issue"
Trader's Global Business,,,unavailable,10/28/2021,Security Assessment,Solidity,2021-10-12T14:04:53-07:00,2021-10-27T14:14:52-07:00,14,Volatile Code,"Centralization / Privilege,Control Flow","Logical Issue,Volatile Code",,"Coding Style,Inconsistency,Logical Issue"
Lossless,,,unavailable,10/29/2021,Security Assessment,Solidity,2021-10-18T15:22:11+08:00,2021-10-29T16:27:00+08:00,18,Centralization / Privilege,Centralization / Privilege,,Logical Issue,"Language Specific,Volatile Code,Gas Optimization,Logical Issue"
NagaSwap,TAXI ,,unavailable,1/11/2021,Security Audit,"Solidity, Yul","January 09, 2021","January 11, 2021",,,,,,
Crow Finance,,,unavailable,3/4/2021,Security Audit,Solidity,"Feburary 23, 2021","March 4, 2021",21,,L,,,"D,O"
CashCow,,,unavailable,6/16/2021,Security Assessment,Solidity,2021-06-02T04:40:58+08:00,2021-06-18T10:09:41+08:00,18,,Centralization / Privilege,"Centralization / Privilege,Logical Issue,Gas Optimization,Mathematical Operations",,"Volatile Code,Gas Optimization"
AICON,BABY ,,unavailable,1/27/2021,Security Audit,"Solidity, Yul","January 25, 2021","January 27, 2021",,,,,,
Universal Dollar Protocol,U8D,,unavailable,2/1/2021,Security Audit,Solidity,"January 21, 2021","Feburary 3, 2021",8,,,I,,"C,G,I,L"
Baby Token,BABY ,,unavailable,1/27/2021,Security Audit,"Solidity, Yul","January 25, 2021","January 27, 2021",2,,,,,C
